Titulo,Moneda,Precio,Ubicacion,Rubro
Se Vende  Agencia De Lotería,US$,25000,"Quilmes Oeste, ...",Lotería
Dietética..,US$,6500,"Floresta, Capital ...",Dietética
Vendo Lavadero De Camiones,US$,150000,"Victoria, Entre R...",Otros
Fondo De Comercio Peluqueria,US$,8000,"San Miguel, Bs.as. G.b....",Peluquería
Vendo Fondo De Comercio,US$,80000,"Hurlingham, Provincia...",Otros
Venta De Chapa O Agencia De Loteria,$,20000,"Avellaneda, Bs.as. G....",Lotería
Vendo Fondo De Comercio Librería Papelería,$,11000000,"Guaymallén,...",Librería
Vendo Importante Fondo De Comercio + De 10 Años Funcionando,US$,35000,"Villa Ballester, Gene...",Otros
Fondo De Comercio - Kiosko,US$,12000,Ciudad De Có...,Kiosco
Vendo Fondo De Comercio Lenceria,US$,25000,B7600dol Mar Del ...,Indumentaria
Kiosco De Diarios Y Revistas - Fondo De Comercio,US$,5600,"Sarandí, Avell...",Kiosco
Marca De Accesorios,US$,1200,Ciudad Autónoma De ...,Otros
"Vendo Pesa,nueva Sin Uso",$,100,"Rafael Calzada, ...",Otros
Fondo De Comercio Telefonia,$,3000,Provincia De Buenos A...,Otros
Vendo Monedas Antiguas Y Billetes De 5 Pesos,$,500000,"Corzuela, Gen...",Otros
Se Vende Excelente Bar Cafetería En Alta Gracia,$,65,"Centro, Alta...",Cafetería
Fondo Taller Mecanico,$,24000000,"Los Robles, Córdoba",Otros
Oportunidad!: Vendo Fondo De Comercio Agencia De Loteria,US$,111111,"Bahía Blanca, Provincia De Buenos Aires, Argentina, Universitario, Bahía Blanca, Buenos Aires Interior",Lotería
"Vendo Fondo De Comercio, Casita De Fiestas",$,10000,"Punta Alta, Coronel Rosales, Buenos Aires Interior",Eventos
"Agencia De Lotería De La Ciudad ,y Maxikiosko, ,",$,16000000,"Barracas, Capital Federal",Kiosco
Agencia Lotería La Plata Sin Costo De Alquiler Por 5 Años.,US$,25000,"Provincia De Buenos Aires, Argentina, Villa Elvira, La Plata, Bs.As. G.B.A. Sur",Lotería
Fondo De Comercio Heladería En Béccar - (josé Ingenieros 3510),US$,22000,"Béccar, San Isidro, Bs.As. G.B.A. Norte",Heladería
Refrigerante/ Anticorrosivo -  Fondo De Comercio Fabricacion,US$,15000,"Bernal, Provincia De Buenos Aires, Argentina, Bernal, Quilmes, Bs.As. G.B.A. Sur",Fábrica
"Fondo De Comercio Maxikiosco, Excelente Ubicacion, Gran Rentabilidad",US$,15000,"Ciudad Autónoma De Buenos Aires, Argentina, Caballito, Capital Federal",Kiosco
Agencia Loteria,US$,35000,"Morón, Bs.As. G.B.A. Oeste",Lotería
Agencia De Loteria Y Rapipago Sobre Importante Avenida,US$,30000,"Wilde, Provincia De Buenos Aires, Argentina, Wilde, Avellaneda, Bs.As. G.B.A. Sur",Lotería
Agencia De Lotería De La Ciudad,US$,9500,"Floresta, Capital Federal",Lotería
Venta De Fabrica De Paneles Sip Posicionada  En Todo El País.,US$,74000,"Villa Sarmiento, Provincia De Buenos Aires, Argentina, Villa Sarmiento, Morón, Bs.As. G.B.A. Oeste",Fábrica
Venta Agencia De Loteria Y Quiniela La Plata Provincia De Buenos Aires,US$,25000,"La Plata, Provincia De Buenos Aires, Argentina, La Plata, Bs.As. G.B.A. Sur",Lotería
Agencia De Loteria,US$,25000,"Provincia De Buenos Aires, Argentina, Castelar, Morón, Bs.As. G.B.A. Oeste",Lotería
Parada De Diarios Estacion Villa Ballester,US$,4000,"Villa Ballester, Provincia De Buenos Aires, Argentina, Villa Ballester, General San Martín, Bs.As. G.B.A. Norte",Otros
Fondo De Comercio De Alquiler De Autos Funcionando,US$,78000,"San Martín De Los Andes, Neuquén, Argentina, Zona Centro, San Martin De Los Andes, Neuquén",Otros
Chapa Licencia Agencia De Lotería De La Provincia .quilmes,US$,22000,"Quilmes, Bs.As. G.B.A. Sur",Lotería
Agencia De Loteria Y Quiniela,US$,30000,"Lanús Este, Lanús, Bs.As. G.B.A. Sur",Lotería
Parada De Diarios (devoto),$,8500000,"Villa Devoto, Capital Federal",Otros
Bar 2 Año Antiguedad En Funcionamiento,US$,16000,"Rosario, Provincia De Santa Fe, Argentina, Abasto, Rosario, Santa Fe",Otros
Venta  Agencia  De  Loteria,US$,27900,"B1889JRH Ezpeleta Oeste, Provincia De Buenos Aires, Argentina, Quilmes Oeste, Quilmes, Bs.As. G.B.A. Sur",Lotería
Vendo Chapa Lotería Para Quilmes Urgente,US$,15000,"Quilmes, Bs.As. G.B.A. Sur",Lotería
Chapa De Agencia De Lotería Para Todo El Partido De 3 Febrer,US$,20000,"Loma Hermosa, Tres De Febrero, Bs.As. G.B.A. Oeste",Lotería
Venta Fondo De Comercio Lotería - Pilar,US$,29000,"Pilar, Bs.As. G.B.A. Norte",Lotería
Fondo De Comercio Mercat,US$,8000,"Villa Crespo, Capital Federal",Otros
Equipo De Música Muteki 6.2 Canales,$,1055000,"Barrio Sur, San Miguel De Tucumán, Tucumán",Otros
Vendo Casa De Antigüedades De 40 Años De Trayectoria,US$,139000,"San Nicolás De Los Arroyos, San Nicolás, Buenos Aires Interior",Otros
Vendo Fondo De Comercio,$,3000000,"Gerli, Lanús, Bs.As. G.B.A. Sur",Otros
Hotel Pasajeros 26 Habitaciones En Venta Barrio San Cristóba,US$,350000,"San Cristóbal, Capital Federal",Hotelería
Fondo De Comercio,US$,24000,"Lanús Oeste, Lanús, Bs.As. G.B.A. Sur",Otros
Vendo Chapa De Loteria,US$,11111,"Villa Pueyrredón, Capital Federal",Lotería
Vendo Fondo De Comercio,US$,5500,"Buenos Aires, Argentina, Almagro, Capital Federal",Otros
Fondo De Comercio,US$,15000,"Matheu, Escobar, Bs.As. G.B.A. Norte",Otros
Radio Fm Funcionando Con Licencia,US$,3000000,"Dina Huapi, Río Negro, Argentina, Dina Huapi, Pilcaniyeu, Río Negro",Otros
Venta Agencia De Loteria Pcia. Bs As Zona Ezeiza,$,111,"Tristán Suárez, Ezeiza, Bs.As. G.B.A. Sur",Lotería
Fondo De Comercio Heladeria Y Cafeteria,US$,15000,"San Fernando, Bs.As. G.B.A. Norte",Cafetería
Importante Metalúrgica Fabrica De Implementos Agrícolas. 40 Años De Trayectoria.,US$,1650000,"Provincia De Santa Fe, Argentina, San Genaro, San Jerónimo, Santa Fe",Fábrica
"Fondo De Comercio Autoescuela, Más 30 Años, Amplia Clientela",US$,10000,"Ituzaingó Centro, Ituzaingó, Bs.As. G.B.A. Oeste",Otros
Vendo Agencia Lotería Capitán Sarmiento,$,30000,"Capitán Sarmiento, Buenos Aires Interior",Lotería
"Venta De Fondo De Comercio , Tienda De Fiambres Y Quesos",US$,22000,"Barracas, Capital Federal",Fiambrería
Fondo De Comercio,US$,120000,"Centro, San Miguel De Tucumán, Tucumán",Otros
Venta De Fondo De Comercio Farmacia,US$,55000,"Nono, Córdoba, Argentina, Nono, San Alberto, Córdoba",Farmacia
Vendo Veterinaria Mardelplata,US$,65000,"Plaza Colón, Mar Del Plata, Bs.As. Costa Atlántica",Veterinaria
Fondo De Comercio Agencia De Remis,$,5000,"Huerta Grande, Punilla, Córdoba",Otros
Fondo De Comercio Proveedor De Materiales Generales Para La Industria Y La Construccion. Local A La Calle En Caba,US$,49000,"Ciudad Autónoma De Buenos Aires, Argentina, Flores, Capital Federal",Otros
Fondo De Comercio Carniceria,$,40000000,"Cosquín, Provincia De Córdoba, Argentina, Alto Cementario, Cosquín, Córdoba",Carnicería
"Agencia De Loteria En Salto, Provincia De Bs As",$,100,"Provincia De Buenos Aires, Argentina, Salto, Buenos Aires Interior",Lotería
Kiosco Y Agencia De Quiniela,US$,18000,"La Plata, Provincia De Buenos Aires, Argentina, Villa Elvira, La Plata, Bs.As. G.B.A. Sur",Kiosco
1,$,49000000,"Otros Barrios, Mendoza",Otros
Pijoan La Historia Del Arte,$,300000,"Roque Pérez, Buenos Aires Interior",Otros
Agencia De Loteria,$,111111,"Quilmes Oeste, Quilmes, Bs.As. G.B.A. Sur",Lotería
"Vendo Panadería, Hermosa, Clientela Fija, Antigüedad 4 Años",US$,22000,"Cerro De Las Rosas, Córdoba",Panadería
"Vendo Stock De Materiales De Ferretería, Precio Charlable",$,12000000,"Luján De Cuyo, Mendoza",Ferretería
Licencia/chapa/permiso De Agencia De Lotería Pba,US$,10000,"Wilde, Provincia De Buenos Aires, Argentina, Wilde, Avellaneda, Bs.As. G.B.A. Sur",Lotería
Chapa + Cerramiento Blindado Loteria De La Ciudad,US$,10000,"Villa Pueyrredón, Capital Federal",Lotería
Venta Fondo De Comercio Optica,US$,22000,"C1425BGX CABA, Argentina, Palermo, Capital Federal",Otros
Fondo De Comercio,US$,120000,"Cariló, Bs.As. Costa Atlántica",Otros
Vendo O Permuto Fondo De Comercio Ferreteria,US$,50000,"Centro, Bahía Blanca, Buenos Aires Interior",Ferretería
Venta De Agencia De Lotería De La Ciudad De Buenos Aires En Floresta.,US$,12000,"Avenida Rivadavia 8571, Ciudad Autónoma De Buenos Aires, Argentina, Floresta, Capital Federal",Lotería
Hostel De Vanguardia: Oportunidad Única De Negocio En El Turismo. Venta Fondo De Comercio,US$,25000,"S2000BTE Rosario, Santa Fe, Argentina, República De La Sexta, Rosario, Santa Fe",Hotelería
Fondo De Comercio Farmacia,US$,111111,"Provincia De Buenos Aires, Argentina, Burzaco, Almirante Brown, Bs.As. G.B.A. Sur",Farmacia
Chapa De Loteria De La Provincia De Buenos Aires,US$,15000,"Provincia De Buenos Aires, Argentina, Lomas De Zamora, Bs.As. G.B.A. Sur",Lotería
Agencia De Loteria De La Provincia Oficial,US$,15000,"San Justo, La Matanza, Bs.As. G.B.A. Oeste",Lotería
Se Vende Fondo De Comercio,US$,38000,"La Carlota, Córdoba",Otros
Bar Cafeteria Tradicional  Importante Esquina Céntrica De Córdoba  La Esquina,US$,20000,"Ciudad De Córdoba, Provincia De Córdoba, Argentina, Alberdi, Córdoba",Cafetería
Venta De Fondo De Comercio,US$,10000,"Colegiales, Capital Federal",Otros
Fondo De Comercio Berazategui,US$,25000,"Berazategui Oeste, Berazategui, Bs.As. G.B.A. Sur",Otros
Vendo Apart Hotel Sierra De La Ventana,US$,340000,"Sierra De La Ventana, Tornquist, Buenos Aires Interior",Hotelería
Venta De Fondo De Comercio - Local Ropa Deportiva/urbana,US$,20000,"Villa Crespo, Capital Federal",Indumentaria
Fondo De Comercio Con Mas De 20 Años,US$,79000,"Villa Mercedes, General Pedernera, San Luis",Otros
Fondo De Comercio Pago Fácil,US$,20000,"Quilmes, Bs.As. G.B.A. Sur",Otros
Fondo De Comercio Loteria De La Ciudad Quiniela,US$,22500,"Caballito, Capital Federal",Lotería
Parada De Diarios Villa Del Parque Valor $10.000.000.-,$,10000000,"CABA, Buenos Aires, Argentina, Villa Del Parque, Capital Federal",Otros
