Titulo,Moneda,Precio,Ubicacion,Rubro
"Vendo Fondo De Comercio, Maxikiosco 24 Horas Por Motivo De Viaje",US$,11000,Ciudad Autóno...,Kiosco
Venta De Fondo De Comercio,$,5000,La Lucila...,Otros
Fondo De Comercio Gastronomía.,US$,22000,"San Vicente, Buen...",Otros
Carrito De Comidas,US$,5800,"Roldán, Santa Fe",Otros
"Fondo De Comercio Almacén, Gran Oportunidad!!!",US$,55000,"Congreso, Capit...",Otros
Fondo De Comercio. Villa General Belgrano. Libreria Y Artist,US$,4000,"Centro, Villa Gen...",Librería
Restaurant--pizzeria---pelotero-proveedor Del Estado,US$,75000,San Luis Pro...,Eventos
Peluquería Unisex,US$,15000,"Lanús Este,...",Peluquería
Fondo De Comercio,US$,8000,Congreso...,Otros
Venta Fondo De Comercio Ropa Calzado,US$,1111111,Vill...,Indumentaria
"Gran Oportunidad, Venta De Fondo De Comercio",US$,20000,Área Cent...,Otros
Salon De Belleza. Fondo De Comercio.,US$,27000,"Monserrat, Capital Fed...",Salón de belleza
Dietetica Fondo De Comercio,US$,7999,"Buenos Aires, Ar...",Dietética
Fondo De Comercio,US$,35000,"Centro Cívico, San Fra...",Otros
Vendo Fondo De Comercio,US$,48000,"Centro, Córdoba",Otros
Fondo De Comercio Bicicleteria,US$,130000,"Canning, Ezeiza, Bs.as...",Bicicletería
Venta Fondo De Comercio. Urgente!!! Precio Súper Rebajado,US$,15000,"Luis Guillón, Este...",Otros
Fondo De Comercio Cotillón Y Repostería,US$,50000,Villa Urquiz...,Cotillón
Fondo De Comercio Quilmes Centro,US$,28000,"Quilmes, Bs.as. G....",Otros
Fondo De Comercio Barberia,$,4500000,"Villa Del Parque, C...",Barbería
Fondo De Comercio Pescaderia Y Marisqueria,US$,18000,"Barrio Marítimo, Berazat...",Otros
Ferretería Cinco Años Establecida.,US$,49000,Ituzaingó Nort...,Ferretería
Oportunidad .vendo/perm. Financio Fondo Come,US$,40000,"Zona Centro, Villa Ges...",Otros
Fondo De Comercio Fiambreria,US$,28000,"Alejandro Korn, Sa...",Fiambrería
Fondo De Comercio - Cervecería En Venta - Palermo - Plaza Serrano,US$,75000,Ciudad Autónoma De B...,Cervecería
Fondo De Comercio Franquicia Kawirth,US$,15000,"Caballito, Capital Fede...",Franquicia
Fondo De Comercio Cancha De Fútbol,US$,15000,Av República Argentina Esquina 153...,Cancha de futbol
Fondo Comercio Panaderia Y Confiteria,$,1000,"Quilmes, Bs.as. G.b.a....",Panadería
Vendo Fondo De Comercio Locutorio Maxikiosco Y Cyber,US$,7500,Matade...,Kiosco
Fondo De Comercio Petshop Y Peluquería,US$,18000,"Palermo Soho, Ca...",Peluquería
Parada De Diarios Y Revistas En Estación Subte  A,$,1551825,"Once, Capital ...",Otros
Fondo De Comercio Maquinaria Cafetería Heladera Exhibidora,$,3500000,"Lomas De Zamora, Bs.as. ...",Cafetería
Permuto Omplejo De 6 Departamentos  En Merlo San Luis Por Motorhome Y Vehiculos,US$,170000,"Merlo, San...",Otros
Venta Fondo De Comercio En Centro De San Martin Local De Pilas Y Baterias,US$,100000,"San Martín, Provincia...",Otros
Se Busca Socio Para Local De Comida Rápida En Palermo Soho,US$,22000,"Palermo Soho, Capit...",Otros
Oportunidad Única: Fondo De Comercio De Heladería En Ubicación Estratégica,US$,12000,"Bac, Ciu...",Heladería
Fondo De Comercio,US$,6500,"Almagro, Capital Federal",Otros
Pañalera Venta Fonde De Comericio - Excelente Rentabilidad - Excelente Ubicacion,US$,39000,"Rosario, ...",Otros
Oportunidad Única Para Emprendedores!! @_tanbrocoli  Gesell,US$,13500,"Zona Centro, Villa Gesell, Bs.As. Costa Atlántica",Otros
Fondo De Comercio Veterinaria (parque Patricios),US$,25000,"Parque Patricios, Capital Federal",Veterinaria
Excelente Fondo De Comercio Se Vende!!,$,18000,"Lanús Este, Lanús, Bs.As. G.B.A. Sur",Otros
Importante Fondo De Comercio (venta Por Mudanza),US$,110000,"Villa Carlos Paz, Provincia De Córdoba, Argentina, Centro, Villa Carlos Paz, Córdoba",Otros
Vendo Fondo De Comercio,$,15000,"Zona Centro, San Martin De Los Andes, Neuquén",Otros
Fondo De Comercio-perfumería Y Limpieza,US$,19000,"San Antonio De Padua, Provincia De Buenos Aires, Argentina, San Antonio De Padua, Merlo, Bs.As. G.B.A. Oeste",Otros
Venta Agencia De Lotería A Trasladar,US$,9000,"Mar Del Plata, Provincia De Buenos Aires, Argentina, La Perla, General Pueyrredón, Buenos Aires Interior",Lotería
Fondo De Comercio Ropa Mujer,US$,15000,"Villa Del Parque, Capital Federal",Indumentaria
Fondo De Comercio Merceria,US$,45000,"Monte Castro, Capital Federal",Otros
Vendo Fondo De Comercio  Casita De Fiestas  Punta Alta,$,15000000,"Punta Alta, Coronel Rosales, Buenos Aires Interior",Eventos
Fondo De Comercio,US$,50000,"Boulogne Sur Mer, San Isidro, Bs.As. G.B.A. Norte",Otros
Fondo De Comercio Dietética Vitalcer,US$,39000,"Belgrano, Capital Federal",Dietética
Fondo De Comercio Restó-café Excelente Ubicación,US$,11,"Ciudad De Santa Fe, Provincia De Santa Fe, Argentina, Otros Barrios, Santa Fe Capital, Santa Fe",Cafetería
Fondo De Comercio Dietetica Y Panaderia Saludable,US$,75000,"Acassuso, Provincia De Buenos Aires, Argentina, Acassuso, San Isidro, Bs.As. G.B.A. Norte",Dietética
Fondo De Comercio,$,19000,"Banfield, Lomas De Zamora, Bs.As. G.B.A. Sur",Otros
Gimnasio Fondo De Comercio,US$,35000,"Luis Agote, Rosario, Santa Fe",Gimnasio
Fondo De Comercio De Heladeria,US$,9000,"Adolfo P. Carranza 2999, Ciudad Autónoma De Buenos Aires, Argentina, Villa Del Parque, Capital Federal",Heladería
Vendo Fondo De Comercio Rotisería Muy Buena Ubicación.,US$,15000,"Santa Teresita, Provincia De Buenos Aires, Argentina, Santa Teresita, Bs.As. Costa Atlántica",Otros
"Fondo De Comercio - Venta - Temperley,",US$,190000,"Temperley, Lomas De Zamora, Bs.As. G.B.A. Sur",Otros
Venta De Fondo De Comercio De Maxikiosko,US$,25000,"Monte Castro, Capital Federal",Kiosco
Fondo De Comercio. Local De Indumentaria,US$,8000,"Wilde, Provincia De Buenos Aires, Argentina, Wilde, Avellaneda, Bs.As. G.B.A. Sur",Indumentaria
Kiosco-polirrubro Zona Guemes,US$,0,"Güemes, Mar Del Plata, Bs.As. Costa Atlántica",Kiosco
"Restaurante De Diseño. 1 Año De Uso, Totalmente Equipado En Centro De Ituzaingó",US$,100000,"Ituzaingó, Provincia De Buenos Aires, Argentina, Ituzaingó Centro, Ituzaingó, Bs.As. G.B.A. Oeste",Restaurante
"Vendo Negocio Poli Rubro (calzado, Ropa, Telas, Etc.) Con 18 Años De Antigüedad Por No Poder Atender",US$,50000,"Río Cuarto, Provincia De Córdoba, Argentina, Río Cuarto, Córdoba",Indumentaria
Fondo De Comercio Centro Carlos Paz,US$,15000,"Villa Carlos Paz, Provincia De Córdoba, Argentina, Centro, Villa Carlos Paz, Córdoba",Otros
Agroveterinaria,US$,80000,"El Bolsón, Río Negro, Argentina, Aldea Del Este, Bariloche, Río Negro",Veterinaria
"Transfiero Fondo Comercio, Tienda Saludable, Referente Zona.  Consultar Precio. Oportunidad. Negocio. Dietética",US$,10500,"Provincia De Buenos Aires, Argentina, Remedios De Escalada, Lanús, Bs.As. G.B.A. Sur",Dietética
Fondo De Comercio - Container En Predio Gastronómico,US$,15000,"Rosario, Provincia De Santa Fe, Argentina, Alberto Olmedo, Rosario, Santa Fe",Otros
Pantografo Laser Cortadora 600x900,US$,4000,"Monte Castro, Capital Federal",Otros
Vendo Panadería,US$,47000,"Hostería San Antonio, Luján, Buenos Aires Interior",Panadería
Venta Fondo De Comercio - Cerveceria/bar- Oportunidad,US$,35000,"Av. Nazca 1800 - 2100, Ciudad Autónoma De Buenos Aires, Argentina, Villa Del Parque, Capital Federal",Cervecería
Oportunidad! Kiosco/almacen Lichu En Venta!,US$,14000,"Villa Carlos Paz, Provincia De Córdoba, Argentina, Las Malvinas, Villa Carlos Paz, Córdoba",Kiosco
Kiosco De Diarios Y Revistas En Rosario Fondo De Comercio En Zona Sur Avenida Ovidio Lagos Y Gregorio Dean Funes,$,7500000,"Rosario, Provincia De Santa Fe, Argentina, Jorge Cura, Rosario, Santa Fe",Kiosco
"Transfiero Licencia Lotería Caba Cabinas Blindadas,",$,3900000,"Caballito, Capital Federal",Lotería
Vendo Ferreteria En Las Sierras De Cordoba Oportunidad Para Cambio De Vida!!! 23 Años En El Rubro Gran Variedad De Mercaderia!! Ingresos Comprobables!!,US$,150000,"Av. Costanera Guido Santarelli, Santa Rosa De Calamuchita, Córdoba, Argentina, Amboy, Calamuchita, Córdoba",Ferretería
Fondo De Comercio - Dietética - Escucho Ofertas!!!,US$,5000,"Nueva Córdoba, Córdoba",Dietética
Sala De Ensayo - Venta De Fondo De Comercio - San Francisco Solano,$,1500000,"San Francisco Solano, Provincia De Buenos Aires, Argentina, San Francisco Solano, Quilmes, Bs.As. G.B.A. Sur",Otros
Fondo De Comercio Y Vivienda De Carnicería,US$,6000,"Agronomía, Capital Federal",Carnicería
Vendo Fondo De Comercio,$,10000000,"Francisco Álvarez, Moreno, Bs.As. G.B.A. Oeste",Otros
Fondo De Comercio - Carniceria En Venta,US$,24000,"Ciudadela, Provincia De Buenos Aires, Argentina, Ciudadela, Tres De Febrero, Bs.As. G.B.A. Oeste",Carnicería
Fábrica De Helados De Alta Calidad - 19 Años De Trayectoria,US$,200000,"Floresta, Capital Federal",Fábrica
Cafeteria Al Paso Frente A La Universidad De Palermo,US$,19000,"C1175 Buenos Aires, Argentina, Almagro, Capital Federal",Cafetería
Agencia De Lotería De La Ciudad,US$,4000,"Villa Luro, Ciudad Autónoma De Buenos Aires, Argentina, Villa Luro, Capital Federal",Lotería
Vendo Fondo De Comercio Franquicia De Pizza Y Empanadas,US$,20000,"Pontevedra, Merlo, Bs.As. G.B.A. Oeste",Franquicia
Vendo Fondo De Comercio Y Franquicia De Seitu,$,17000000,"Monte Grande, Esteban Echeverría, Bs.As. G.B.A. Sur",Franquicia
"Fondo De Comercio Lubricentro, Funcionando !!",$,30000000,"Villa Parque Santa Ana, Provincia De Córdoba, Argentina, Villa Parque Santa Ana, Santa María, Córdoba",Otros
Fondo De Comercio Heladería Sei Tu,US$,25000,"Luis Guillón, Esteban Echeverría, Bs.As. G.B.A. Sur",Heladería
Vendo Agencia De Quiniela Y Lotería Oficial.,US$,55000,"Apart Club San Pedro, San Pedro, Buenos Aires Interior",Lotería
Fondo De Comercio Rotiseria V Devoto A Metros De Beiro,US$,9000,"Villa Devoto, Capit...",Otros
Agencia De Lotería Oficial - Berazategui - Zona Sur,US$,65000,"Villa España, Pro...",Lotería
Gimnasio Completo,US$,45000,"La Plata, Bs.as. G.b...",Gimnasio
Fondo De Comercio Lubricentro Más De 30 Años De Antigüedad,US$,25000,"Av. Pres. Hipólito Yrigoyen

 2837...",Otros
Venta Fondo De Comercio Empanadas Y Pizzas,US$,27000,"Almagro, Capita...",Pizzería
"Fondo De Comercio,villa La Angostura,café Bar",$,65000,Villa La Angostu...,Cafetería
Venta De Fondo De Comercio  Ferreteria Con Mercaderia Incluida Bien Surtida.,US$,135000,"San Isidro, Pro...",Ferretería
Fondo De Comercio Urgente Por Viaje,US$,20000,"Quilmes Oeste, ...",Otros
Fondo De Comercio Carnicería,US$,1,"Santa Rita, Capita...",Carnicería
Laboratorio Suplementos Dietarios Habilitado Fdo. Comercio,$,400000,Redios De Escala De San Martin  Sn...,Otros
"Se Vende Fondo De Comercio Kiosco Y Despensa , Buen Precio",US$,10000,"Villa San Andrés,...",Almacén
Kiosco De Diarios Y Revistas,US$,10000,Estacion Beccar (anden Mano A Reti...,Kiosco
Venta De Fondo De Comercio De Local Dedicado A Venta De Indumentaria Femenina,US$,15000,"Villa Lugano, Bue...",Indumentaria
Fondo De Comercio Barberia Peluqueria,US$,6000,"San Nicolás, Capital...",Barbería
Fondo De Comercio Franquicia Tropea Escucho Ofertas,US$,30000,Villa Crespo...,Franquicia
Fondo Zinguería Nueva El Precio Es X Toda La Mercadería,US$,1200,"Ituzaingó Norte, Itu...",Otros
Venta Fondo De Comercio,$,100,"Almagro, Capita...",Otros
"Vendo Fondo De Comercio, Heladería Con 16 Años De Antigüedad",US$,22000,"Boulogne Sur Mer,...",Heladería
Lavadero De Autos,US$,20000,"Temperley, Lo...",Lavadero de autos
"Fondo De Comercio Bar, Restaurante, Cafeteria",US$,22000,"Monserrat, Capita...",Cafetería
Local Gastronomico,$,1111,Guillermo Enrique...,Otros
Importante Pinturería Zona Sur S/avenida C/estacionam Propio,US$,45000,"Quilmes, Provincia...",Otros
Concesionario Para Local Ramallo Club En Operación - Leer Descripción,US$,1000,"San Isidro, ...",Otros
Fondo De Comercio Centro De Estética,US$,12000,"Boedo, Capital F...",Salón de belleza
Farmacia,US$,60000,"Esquel, Futaleufú, Chubut",Farmacia
Venta Ferreteria Con Clientes Fijos,US$,25000,"Bgj, Pr...",Ferretería
Local Habilitado Para Dietetica Y Herboresteria,US$,20000,"Caseros 3069, B1636 Olivos, P...",Dietética
"Se Vende Marca Registrada, Clase 39, Mixta: Expreso Rutas Argentinas",US$,38000,"Luis Guillon, Pro...",Otros
Vendo Fondo De Comercio,US$,22000,"San Cristóbal, C...",Otros
Fondo De Comercio Para Trasladar,US$,9000,"Centro, Villa Carlos P...",Otros
Fondo De Comercio Local Ropa Femenina Lomas De Zamora,US$,9000,"Lomas De Zamora, Bs.as...",Indumentaria
Fondo De Comercio Dietética,US$,15000,Ciudad Autónoma ...,Dietética
Vendo Fondo De Comercio,$,2000000,"San Miguel, Bs.a...",Otros
Fondo De Comercio,US$,15000,"Villa Pueyrredón, ...",Otros
Maxikiosco,US$,12000,Ciudad Au...,Kiosco
Vendo Fondo De Comercio Colchoneria Y Afines,$,34990,Gran Bu...,Otros
Pizzería Luigy,US$,40000,"Lanús Oeste, La...",Pizzería
Estetica Fondo De Comercio,US$,10000,"Berazategui, Bs.as. G...",Salón de belleza
Fondo De Comercio Tienda Saludable,US$,35000,"“caisamar”, Mar Del Pl...",Otros
Venta De Fondo De Comercio De Indumentaria,US$,18000,"Villa Pueyrredón, Cap...",Indumentaria
Fondo De Comercio Fiambrería Y Productos De Almacén,$,1111,"El Bolsón, El Bols...",Fiambrería
Fondo De Comercio De Indumentaria Femenina Y Niños,US$,18000,"Villa Pueyrredón, Cap...",Indumentaria
"Local De Bazar, Decoracion Y Mates",US$,5500,"San Martín, Mendoza, Arge...",Otros
Fondo De Comercio,US$,50000,"Otros Barrios, Mendo...",Otros
Fondo De Comercio Local De Indumentaria General Las Heras,US$,68000,"General Las Heras, ...",Indumentaria
"Venta Llave Negocio Para Carne Vacuna,cerdo ,y Pollo",$,11000000,Ampliación ...,Otros
Fondo De Comercio Lenceria En Venta,US$,200000,"Centro, Bariloche...",Indumentaria
Fondo De Comercio - Bar+restaurant Lomas De Zamora Alem 200,US$,100000,"Lomas De Zamora, Bs.as. G...",Restaurante
Fondo De Comercio Vineria,US$,18000,"Mar Del Plata, Provincia De Buenos Aires, Argentina, La Perla, General Pueyrredón, Buenos Aires Interior",Bebidas
Fondo De Comercio Lavadero Autos,US$,20000,"San Miguel, Bs.As. G.B.A. Norte",Lavadero de autos
Se Vende Fondo De Comercio De Café Bar Frente A La Universidad De Quilmes,US$,12000,"Roque Sáenz Peña 299-329, Bernal, Provincia De Buenos Aires, Argentina, Bernal, Quilmes, Bs.As. G.B.A. Sur",Cafetería
Fondo De Comercio Pet Shop Caballito,US$,6500,"Ciudad Autónoma De Buenos Aires, Argentina, Caballito, Capital Federal",Pet shop
Agencia De Loteria,US$,12000,"Parque Patricios, Capital Federal",Lotería
Fondo De Comercio Heladeria,US$,20000,"Buenos Aires, Argentina, Villa Urquiza, Capital Federal",Heladería
Agencia De Loteria De La Provincia De Bs.as,US$,47000,"Villa Ballester, Provincia De Buenos Aires, 1653, Villa Ballester, General San Martín, Bs.As. G.B.A. Norte",Lotería
Venta De Fondo De Comercio Salón De Fiestas Y Eventos,US$,35000,"La Plata, Bs.As. G.B.A. Sur",Eventos
Importante Fondo De Comercio Heladería Y Cafetería 230 M2 - A Dos Cuadras Del Congreso De La Nación,US$,40000,"Buenos Aires, Argentina, Balvanera, Capital Federal",Cafetería
Bar Al Paso Y Kiosco,US$,16000,"Quilmes, Provincia De Buenos Aires, Argentina, Quilmes, Bs.As. G.B.A. Sur",Kiosco
Fondo De Comercio Pizzeria Olivos,US$,30000,"Olivos, Vicente López, Bs.As. G.B.A. Norte",Pizzería
"Fondo De Comercio Peluqueria , Barberia , Salon De Belleza En Predio Supermercado De Facil Acceso",US$,4000,"Tortuguitas, Provincia De Buenos Aires, Argentina, José C. Paz, Bs.As. G.B.A. Norte",Barbería
Fondo De Comercio,US$,18000,"Centro, Rosario, Santa Fe",Otros
Gran Oportunidad!!fondo De Comercio,US$,8000,"La Plata, Bs.As. G.B.A. Sur",Otros
Vendo Fondo De Comercio - Optica,US$,27000,"Merlo, Junín, San Luis",Otros
Kiosco De Diarios Y Revistas,US$,40000,"Campos De Alvarez, Moreno, Bs.As. G.B.A. Oeste",Kiosco
Vendó Fondo De Comercio..,US$,9300,"Puerto, Mar Del Plata, Bs.As. Costa Atlántica",Otros
Casa De Comidas - Rotiseria,US$,20000,"Quilmes, Bs.As. G.B.A. Sur",Otros
"Parada De Diarios En Florida, Vicente López, Bs. As.",US$,10000,"Florida, Vicente López, Bs.As. G.B.A. Norte",Otros
Agencia De Lotería De La Provincia En Hurlingham,US$,30000,"Hurlingham, Provincia De Buenos Aires, Argentina, Hurlingham, Bs.As. G.B.A. Oeste",Lotería
Vendo Exelente Fondo De Comercio,$,5000000,"Villa Santos Tesei, Hurlingham, Bs.As. G.B.A. Oeste",Otros
Ferreteria,$,111,"Mar Del Plata, Provincia De Buenos Aires, Argentina, Barrio Colinas Verdes, General Pueyrredón, Buenos Aires Interior",Ferretería
Venta Importante Solarium Fondo De Comercio,US$,47000,"Jardín Espinosa, Córdoba",Otros
Vendo Fondo De Comercio Pizzería En Zona Bernal Este,US$,12,"Bernal, Quilmes, Bs.As. G.B.A. Sur",Pizzería
Dietética Ubicada En Zona Céntrica De Morón,US$,27000,"Provincia De Buenos Aires, Argentina, Morón, Bs.As. G.B.A. Oeste",Dietética
Fondo De Comercio Remiseria,US$,30000,"Ringuelet, Provincia De Buenos Aires, Argentina, Ringuelet, La Plata, Bs.As. G.B.A. Sur",Otros
Instalaciónes Y Mercadería De Pesca En Capital,US$,90000,"Congreso, Capital Federal",Otros
Vendo Fondo De Comercio Rubro Tecnología,US$,35000,"Colón, Entre Ríos",Otros
Fondo De Comercio,US$,3000,"Villa Bosch, Tres De Febrero, Bs.As. G.B.A. Oeste",Otros
"Vendo Fondo De Comercio Tienda De Mascotas, Parque Y Jardín",$,22222222,"Garín, Escobar, Bs.As. G.B.A. Norte",Otros
Fondo De Comercio Ropa De Bebés Centro De Lomas Galería Nazm,US$,6000,"Lomas De Zamora, Bs.As. G.B.A. Sur",Indumentaria
Exelente Estado Funcionando Perfecto.,$,400000,"San Nicolás, Capital Federal",Otros
"Venta Fondo De Comercio,  Umara Nails, Villa Urquiza",US$,28000,"Ciudad Autónoma De Buenos Aires, Argentina, Villa Urquiza, Capital Federal",Salón de belleza
Fondo De Comercio Market Medialunas,US$,9500,"Villa Devoto, Capital Federal",Otros
Fondo De Comercio En San Martin De Los Andes !,US$,25000,"Zona Centro, San Martin De Los Andes, Neuquén",Otros
Fondo De Comercio Salón De Uñas Y Pestañas Almagro,US$,10000,"Almagro, Capital Federal",Otros
Venta Agencia De Lotería Y Quiniela.,US$,18000,"Villa Ballester, General San Martín, Bs.As. G.B.A. Norte",Lotería
Vendo Fondo De Comercio Kiosco- Zona Céntrica,US$,3000,"Monserrat, Capital Federal",Kiosco
Vendo Pet Shop 20 Años,$,1000,"Ituzaingó, Provincia De Buenos Aires, Argentina, Ituzaingó Norte, Ituzaingó, Bs.As. G.B.A. Oeste",Pet shop
Agencia De Lotería De La Provincia De Buenos Aires,$,10000000,"Florencio Varela, Bs.As. G.B.A. Sur",Lotería
Parada De Diarios. Escucho Oferta,US$,2800,"Tapiales, La Matanza, Bs.As. G.B.A. Oeste",Otros
Fondo De Comercio Zona Recoleta Arreglo De Ropa,US$,5000,"Recoleta, Capital Federal",Indumentaria
Barberia Fondo De Comercio,$,7000000,"William C. Morris, Hurlingham, Bs.As. G.B.A. Oeste",Barbería
Agencia De Loteria,US$,13000,"Caballito, Capital Federal",Lotería
Complejo De Fútbol 5,US$,40000,"La Plata, Bs.As. G.B.A. Sur",Hotelería
Agencia De Lotería Zona Florida,US$,25000,"Barrio Parque Gral San Martín, General San Martín, Bs.As. G.B.A. Norte",Lotería
"Vendo  Fondo De Comercio, Kiosco, Almacen Fiambreria En Carlos Paz",US$,20000,"Carlos Paz Sierras, Villa Carlos Paz, Córdoba",Fiambrería
Maxikiosco Escucho Ofertas!  Libreria Fondo De Comercio,$,1111,"Los Polvorines, Malvinas Argentinas, Bs.As. G.B.A. Norte",Kiosco
Agencia De Lotería Provincia Monte Grande Centro,US$,37000,Monte ...,Lotería
Fondo De Comercio Ferreteria,US$,100000,"Del Viso, P...",Ferretería
"Kiosco, Rapipago, Fotocopiadora Y Envío De Paqueteria",US$,27000,"San Vicente, Bueno...",Kiosco
Fondo De Comercio Local Maxikiosco,US$,1,"Monte Chingolo, Pr...",Kiosco
Fondo De Comercio Casa Electricidad,US$,25000,"Martínez, S...",Otros
"Vendo Fonde De Comercio En Bernal, Quilmes",$,10000,"Bernal Oeste, Pro...",Otros
Fondo De Comercio En Venta Restobar En Chacarita Funcionando,US$,40000,"Chacarita, Cap...",Restaurante
Venta De Fondo De Comercio (instalaciones) + Posibilidad Venta De Marca,US$,48000,Ciudad Autónoma De B...,Otros
Se Vende Fondo De Comercio...,US$,30000,"Lanús Este, Lanús, Bs.as...",Otros
Vendo Fondo De Comercio De Lavadero De Autos,US$,70000,"Tilcara 2933, Buenos Air...",Lavadero de autos
Lote De Griferias,US$,9000,"Ramos Mejía, La M...",Otros
Fondo De Comercio Bebidas,US$,19900,"Villa Crespo,...",Bebidas
"Agencia De Lotería Y Rapipago, Fondo De Comercio Rentable",US$,20000,Parque Avell...,Lotería
"Dueño Vende Fondo De Comercio: Torre, Antena Y Oficina Aptas Para Fm En El Centro De Rosario. Excelente Ubicacion",US$,22000,"Rosario, Provincia D...",Otros
Fondo De Comercio,$,9500,"Monte Grande,...",Otros
Vendo Permuto Empresa De Transporte,US$,1111,Ciudad Autónom...,Otros
"Fondo De Comercio, Casa De Lotería.",US$,17000,A Dos Cuadras De C...,Lotería
Fondo De Comercio - Zona Comercial San Fernando,$,50000,"San Fernando, ...",Otros
Dietetica El Lahuan - Impecable - Excelente Oportunidad - Cambia Tu Vida!!!!,US$,32000,"Lago Puelo, Chubut...",Dietética
Fondo De Comercio Mercería Y Retacería Financiación,US$,5000,"Luis Guillon, ...",Otros
Venta Fondo De Comercia Casa De Repuestos Vw Ford Gm,US$,100000,"Grand Bourg, Provin...",Otros
Fabrica De Ionizadores Solares Para Piscinas,US$,50000,San Francis...,Fábrica
Fondo De Comercio Lenceria,US$,9000,Cent...,Indumentaria
Fondo De Comercio En Adrogué,US$,25000,"Adrogué, Alm...",Otros
Salas De Ensayo En Santa Fe Capital,US$,24000,"Ciudad De Santa Fe, ...",Otros
Vendo Fondo De Comercio,US$,40000,"Nueva Córdoba, Córd...",Otros
Pizzeria Con Alta Rotación,US$,70000,Ciudad De Santia...,Pizzería
Vendo Fondo De Comercio De Farmacia. Excelente Oportunidad!,US$,18000,"Villa 9 De Julio, ...",Farmacia
"Fondo De Comercio - Merceria, Lenceria, Bebes - Mas De 30 Años De Actividad! - La Merceria Mas Completa De La Zona!",US$,47000,...,Indumentaria
Fondo De Comercio Palermo,US$,14000,"Palermo Soho, Cap...",Otros
Lavarropas Automático Samsung 6.5 Kg Saww65m0nhuu 1000 Rpm C,$,700000,"Francisco Álvarez, ...",Indumentaria
Heladera Exhibidora 4 Puertas,$,1000000,"González Catán, L...",Otros
Fondo Comercio Dietetica,US$,5000,"Alto Alberdi,...",Dietética
Agencia De Loteria Muy Buena Rentabilidad),US$,10000,"Villa Pueyrredón, Capi...",Lotería
Vendo O Permuto Agencia De Loteria .florencio Varela,US$,35,"Florencio Varela, ...",Lotería
Se Vende Fondo De Comercio - Kiosco En Pleno Centro,US$,5500,"Córdoba, Pr...",Kiosco
Agencia De Loteria Mar Del Plata Centro A Metros De La Peatonal,US$,35000,"Mar Del Plata, Prov...",Lotería
Agencia De Lotería,US$,9000,"Ituzaingó Norte, Ituzai...",Lotería
Vendo Fondo De Comercio,US$,25000,Villa Allende ...,Otros
Vendo Licencia Con Máquina En Guarda!,US$,10000,"La Plata, Bs.a...",Otros
Fondo De Comercio,US$,16000,"Villa Riachuelo, Capi...",Otros
Chapa Licencia Agencia De Lotería De La Ciudad,US$,2500,A...,Lotería
Agencia De Lotería,US$,50000,"Palermo, Capital Feder...",Lotería
Fondo De Comercio - Indumentaria Infantil/bebes - Quilmes Peatonal,US$,14000,"Quilmes, Pr...",Indumentaria
Kiosco Puesto Parada De Diarios Y Revistas,US$,38000,"Palermo, Capita...",Kiosco
Fiambreria (fondo De Comercio),$,8000,Santos Lugares...,Fiambrería
Vendo Agencia De Lotería,US$,50000,"Lanús, Pr...",Lotería
Agencia De Loteria,US$,15000,Buenos Ai...,Lotería
Fondo De Comercio Agencia Oficial De Loteria,US$,15000,Lanús Oes...,Lotería
Agencia De Lotería,US$,33000,"Quilmes, Bs.as...",Lotería
Cerveceria Y Hamburgueseria En Polo Gastronomico De Banfield,US$,1,"Banfield, Provinci...",Cervecería
Venta Agencia De Loteria Oficial Prov Bs.as.,US$,30000,Provincia De Buenos ...,Lotería
Fondo De Comercio Agencia De Quiniela Y Rapipago,US$,29900,"Centro, Villa Carlos Paz...",Lotería
Agencia De Loteria En Llavallol,US$,21000,"Llavallol, P...",Lotería
"Loteria Neuquina, Fondo De Comercio De Lotería Y Quiniela",US$,59999,"Zona Centro, San Mar...",Lotería
Se Venden Heladeras Y Picadora D Carne,$,700000,Vill...,Otros
Chapa Loteria De La Provincia,$,1111,"Quilmes Oeste, Qui...",Lotería
Pizzería Muy Acreditada Zona Paalomarr,US$,50000,"El Palomar, Morón, B...",Pizzería
"Dietetica Y Almacen Naturista Sobre Avenida Comercial, A Diez Metros De Parada De Colectivos",US$,12000,"Tigre, Provinci...",Dietética
Vendo Fondo De Comercio Feria Americana,$,4000000,"Almagro, Capi...",Otros
Fondo De Comercio Agencia De Loteria Y Rapipago. Lanus Oeste,US$,15000,"Lanús Oeste,...",Lotería
Fondo Comercio Ferreteria Funcionando,US$,26000,"Rosario, Provi...",Ferretería
Venta Fondo De Comercio Fiambreria Y Almacén,US$,1111,"Santos Lugares, Tre...",Fiambrería
Fondo De Comercio Casa De Deportes 33 Años De Trayectoria,US$,50000,Ciudad ...,Otros
Oportunidad De Inversión Venta De Fondo De Comercio - Rubro Informática,US$,5500,"Santa Fe, Argentina, ...",Otros
Frezzer Helados,$,400000,José Ign...,Otros
Venta De Fondo De Comercio,US$,20000,"Recoleta, Capital Fede...",Otros
Agencia De Loteria,US$,20000,"Recoleta, Capital F...",Lotería
Fondo De Comercio Fabrica De Calzado,US$,45000,"Lomas Del Mirador, La Mat...",Fábrica
Fondo De Comercio,US$,6000,"Boedo, Capital Federal",Otros
Kiosco Venta Fondo De Comercio,US$,15000,Avenida Tte Gral Juan Domingo Peró...,Kiosco
Vendo Fondo Comercio Supermercado Muy Bien Ubicado Y Equipado. 30 Años En El Rubro,US$,70000,"San Lorenzo, Provincia...",Supermercado
Agencia De Lotería. Florencio Varela,US$,15000,"Florencio Varela,...",Lotería
Fondo De Comercio Pet Shop Y Peluqueria Canina !!!oportunidad!!!,US$,8500,"Bermúdez 1406, Buenos A...",Peluquería
Agencia De Lotería Y/o Quiniela,US$,18000,"San José, Almiran...",Lotería
Fondo De Comercio Maxikiosco,US$,10000,"Caba, Argentina, Vill...",Kiosco
"Kiosco, Excelente Ubicación En Ramos Mejía",US$,7500,"Ramos Mejía,...",Kiosco
Vendo Fondo Comercio Fiambrería Y Granja Sobre Avenida Monte Castro- Caba,$,32000000,Buenos...,Fiambrería
"Vents Agencia Lotería Y Kiosco, Doy Financiación",US$,33000,"La Falda, Córdoba, A...",Kiosco
Agencia De Quiniela Dueño Directo Sin Expensas,US$,25000,Villa Urquiz...,Lotería
