Titulo,Moneda,Precio,Ubicacion,Rubro
Venta De Complejo De Cabañas Frente Lago En Potrero De Garay.los Espinillos Apto Credito.,US$,400000,"Córdoba, Argentina, Potrero De Garay, Santa María, Córdoba",Hotelería
Fondo De Comercio Dietetica,US$,13000,"Monte Castro, Capital Federal",Dietética
Fondo De Comercio Pizeria Y Cafetería,US$,24000,"Flores, Capital Federal",Cafetería
Dueño Fondo De Comercio Excelente Cervecería,US$,22000,"Centro, Mar Del Plata, Bs.As. Costa Atlántica",Cervecería
Fondo De Comercio: Barbería Moderna Y Equipada. Excelente Ublicación.,US$,17500,"Ciudad Autónoma De Buenos Aires, Argentina, Palermo, Capital Federal",Barbería
Vendo Fondo De Comercio Vta Empanadas ..,US$,25000,"Palermo, Capital Federal",Otros
Complejo De 4 Cabañas .el Valor Publicado Es Por Unidad,US$,49000,"San Clemente, Bs.As. Costa Atlántica",Hotelería
"Cafetería Restó *oportunidad* Imperdible Fondo De Comercio Gastronómico, Café  Restaurante,",US$,29000,"Capital, Mendoza, Argentina, Otros Barrios, Mendoza",Cafetería
"Fondo Comercio, Distribuidora  Alimentos Saludables, Zona Sur. Consultar Precio. Oportunidad Inversión Negocios Saludables",US$,18200,"Provincia De Buenos Aires, Argentina, Remedios De Escalada, Lanús, Bs.As. G.B.A. Sur",Otros
Fondo De Comercio Cervecería Bar Hamburguesería Almagro Excelente Zona Muy Bien Instalado Oportunidad,US$,40000,"Ciudad Autónoma De Buenos Aires, Argentina, Almagro, Capital Federal",Cervecería
Fondo De Comercio Heladería Con Franquicia,US$,15000,"San Isidro, Provincia De Buenos Aires, Argentina, San Isidro, Bs.As. G.B.A. Norte",Franquicia
"Retasado...fondo De Comercio: Local De Sanitario, Servicios Y Arts De Ferretería Con Vivienda. Excelente Condiciones De Alquiler, Sin Expensas",US$,72500,"Buenos Aires, Argentina, Villa Urquiza, Capital Federal",Ferretería
Venta - Fondo De Comercio De Fábrica De Pastas - 50 Años De Trayectoria,US$,55000,"B1832 Lomas De Zamora, Provincia De Buenos Aires, Argentina, Lomas De Zamora, Bs.As. G.B.A. Sur",Fábrica
"Fondo De Comercio Papelera Mayorista Y Minorista, Limpieza, Higiene Institucional Y Bazar",US$,40000,"Provincia De Buenos Aires, Argentina, Quilmes, Bs.As. G.B.A. Sur",Papelera
Fondo De Comercio Accesorios Y Repuestos Para Motos,US$,37000,"Ciudad Autónoma De Buenos Aires, Argentina, Recoleta, Capital Federal",Otros
"Complejo Solanas Frente Al Mar, Categoría Con Clientela, Vendo Urgente, Excelente Rentabilidad !!!",US$,590000,"Nueva Atlantis, Provincia De Buenos Aires, Argentina, Nueva Atlantis, Bs.As. Costa Atlántica",Hotelería
Cabañas Tipo Casa De Campo Para Uso Personal Y/o Para Alquiler Turístico,US$,350000,"Concepción Del Uruguay, C. Del Uruguay, Entre Ríos",Otros
Fondo De Comercio Bar/local De Bebida C/contrato De Alquiler,$,8500000,"Colegiales, Capital Federal",Bebidas
"Complejo De 7 Departamentos A Mtrs Del Mar, Muy Buena Renta",US$,500000,"Santa Clara Del Mar, Bs.As. Costa Atlántica",Hotelería
Vendo Fondo De Comercio Pet Shop - Veterinaria - Tienda Mascotas,US$,17990,"Buenos Aires, Argentina, Palermo, Capital Federal",Pet shop
Liquidacion Total Por Viaje - Ferreteria En Ciudad De Córdoba,US$,99000,"Provincia De Córdoba, Argentina, Centro, Córdoba",Ferretería
Fondo De Comercio Peluquería,US$,19000,"Boulogne Sur Mer, San Isidro, Bs.As. G.B.A. Norte",Peluquería
Fondo De Comercio Cotillon - Villa Del Parque,US$,65000,"Cuenca 3490, Ciudad Autónoma De Buenos Aires, Argentina, Villa Del Parque, Capital Federal",Cotillón
Fondo De Conercio Vinoteca Ubicado Estratégicamente,US$,1,"Francisco Alvarez, Provincia De Buenos Aires, Argentina, Francisco Álvarez, Moreno, Bs.As. G.B.A. Oeste",Bebidas
Vendo 2 Fondos De Comercio En B Guemes Excelente Ubicacion,US$,75000,"Guemes, Córdoba",Otros
Fondo De Comercio Bar Restaurante Pimienta Food & Bar 100% Funcional Y Exitoso,US$,25000,"San Telmo, CABA, Argentina, San Telmo, Capital Federal",Restaurante
Liquido Permuto Fondo De Comercio Restaurante Bar,US$,38000,"Güemes, Mar Del Plata, Bs.As. Costa Atlántica",Restaurante
Balneario Pehuen Co. Chalet 4 Ambientes + Local Comercial.,US$,110000,"Balneario Pehuen Co, Coronel Rosales, Buenos Aires Interior",Otros
Oportunidad Real - Fondo Comercio Estética,US$,39000,"San Miguel, Provincia De Buenos Aires, Argentina, San Miguel, Bs.As. G.B.A. Norte",Salón de belleza
Ferretería Industrial Fondo De Comercio,US$,240000,"Villa Madero, Provincia De Buenos Aires, Argentina, La Tablada, La Matanza, Bs.As. G.B.A. Oeste",Ferretería
"Venta De Fondo De Comercio En Miami, Florida, Usa. Pet Shop Con Venta De Mascotas, Peluqueria Canina Y Venta De Alimentos Y Productos Accesorios Para Mascotas.",US$,199000,"Argentina, Miami, Florida, USA",Peluquería
"Fondo De Comercio De Prendas De Vestir, O Venta Por Lotes",US$,39000,"Necochea, Provincia De Buenos Aires, Argentina, Necochea, Bs.As. Costa Atlántica",Indumentaria
"Fondo De Comercio Cotillon, Articulos Reposteria, Descartables Y Disfraces. Globos Con Helio.",US$,17500,"Ciudad Jardin Lomas De Palomar, Provincia De Buenos Aires, Argentina, Ciudad Jardín Lomas Del Palomar, Tres De Febrero, Bs.As. G.B.A. Oeste",Cotillón
Venta Fondo De Comercio Hamburguesería,US$,28000,"Villa Lugano, Capital Federal",Hamburguesería
"Vendo Fondo De Comercio, Maxikiosco, Market, Villa Luro",US$,11000,"Villa Luro, Capital Federal",Kiosco
Venta Fondo De Comercio. Imperdible Oportunidad!!!!,US$,30000,"Barrio Parque Gral San Martín, General San Martín, Bs.As. G.B.A. Norte",Otros
Venta De Fondo De Comercio Supermercado,$,1000,"Tapiales, La Matanza, Bs.As. G.B.A. Oeste",Supermercado
Vendo//permuto Fondo De Comercio Salon De Belleza,$,18000,"Don Torcuato Oeste, Tigre, Bs.As. G.B.A. Norte",Salón de belleza
Vendo Fondo De Comercio 2 Locales De Venta De Indumentaria!,US$,25000,"Virreyes, San Fernando, Bs.As. G.B.A. Norte",Indumentaria
Venta De Fondo De Comercio Online - Indumentaria Femenina,US$,15000,"Buenos Aires, Argentina, Palermo, Capital Federal",Indumentaria
Fondo De Comercio Dietética,US$,14500,"Palermo, Capital Federal",Dietética
Galpon Deposito Guardamuebles Permuto,US$,360000,"Buenos Aires, Argentina, Mataderos, Capital Federal",Otros
Venta De Empresa De Seguridad Privada En Rosario,US$,150000,"ARB, Provincia De Santa Fe, Argentina, Centro, Rosario, Santa Fe",Otros
Panadería,US$,47000,"San Rafael, Mendoza",Panadería
Cadena De Sucursales Insumos De Uñas Y Maquillajes,US$,500000,"Florencio Varela, Bs.As. G.B.A. Sur",Otros
Liquidooo!! Fondo De Comercio Bar En San Miguel,US$,30000,"San Miguel, Bs.As. G.B.A. Norte",Otros
"Gran Oportunidad Restaurante En Caballito, Hermoso Local",US$,180000,"Ciudad Autónoma De Buenos Aires, Argentina, Caballito, Capital Federal",Restaurante
Venta Fondo De Comercio Clínica Geriátrica Con/sin Propiedad,US$,225000,"San Justo, La Matanza, Bs.As. G.B.A. Oeste",Geriátrico
Fondo De Comercio Salón De Uñas,US$,10000,"Bernal, Q...",Otros
Panadería,US$,4000,"Rosario, Provincia ...",Panadería
"¡gran Oportunidad! Venta De Fondo De Comercio De Indumentaria, Zapatería Y Accesorios En Neuquén",US$,20000,Q8300lwb...,Indumentaria
"Fondo De Comercio, Colocadora De Caños De Escapes Y Enganches, Macachin",US$,120000,Río Te...,Otros
Fondo Comercio Mercadería  Inclu/escucho Oferta/tomo Permuta,US$,16500,"Caseros, Provin...",Otros
Fondo De Comercio Dietética Victoria Presidente Perón,US$,27000,Vic...,Dietética
Inmobiliaria Con Importante Clientela Y Antigüedad - Hay Financiación - Se Toman Valores (venta Fondo De Comercio),US$,29800,"Buenos Aires, ...",Otros
Vendo Fondo De Comercio (o En Propiedad) Mar Del Plata Con 55 Años De Trayectoria Exelente Clientela,US$,30000,"Mar Del Plata, Provin...",Otros
"Ferretería Bulonera Y Lubricentro, Vendo Por Mudanza.",US$,48000,"Ostende, Provinci...",Ferretería
Fondo De Comercio Camping En Costa Atlantica,US$,220000,"Miramar, Bs.as....",Otros
Excelente Fondo De Comercio,US$,50000,"Terminal Vieja, Mar...",Otros
Vendo O Permuto Fábrica De Balanzas Electrónicas Ganaderas X Auto O Camioneta,US$,25000,General A...,Fábrica
Fondo De Comercio Maxikiosco,US$,7000,Ciudad...,Kiosco
"Vendo Urgente Por Problema De Salud !!! Hermoso Complejo De 4200m2. Muy Equipado, Exelente Ocupación !!!",US$,220000,"Calamuchita, Provin...",Hotelería
Fondo De Comercio Bar Olivos. Oportunidad Por Junio,US$,20000,"Avenida Del Libertador 1960, ...",Otros
Dietetica Y Panaderia Saludable,US$,75000,"Acassuso, Provincia De B...",Dietética
Venta De Fondo De Comercio Pet Shop San Isidro,US$,14000,San Isidro Centra...,Pet shop
Fondo De Comercio Pizzería - Rotiseria En Paternal,US$,15000,General José Gervasio A...,Pizzería
Fondo De Comercio Fiambrería Excelente,US$,27000,Villa Balles...,Fiambrería
Fondo De Comercio Recepción De Lavanderia Tintoreria,US$,7500,"Avellaneda, Bs.as. G....",Otros
Venta Oportunidad Real Kiosco Esquina Barrio Norte,US$,8500,Ciudad Autónoma De Buen...,Kiosco
Fondo De Comercio: Agencia De Lotería Y Kiosco En Chivilcoy,US$,35000,"Chivilcoy, Provinci...",Kiosco
Venta Fondo De Comercio En Belgrano- Servicio Tecnico  De Celulares Y Computadoras - Venta De Accesorios,US$,3800,"Buenos Aires, Ar...",Otros
Cafeteria Pastelería Y Restó,US$,85,General P...,Cafetería
Fondo De Comercio Verduleria Con Dietetica Y Art. Limpieza.,US$,15000,"Villa Crespo, Ca...",Dietética
Fondo De Comercio Odontológico Habilitado Por Mns En Caba,US$,19000,"Villa Del Parque, Capit...",Salud
Fondo De Comercio Empanadas Economicas Frente A Facultad,US$,30999,"Balvanera, Capita...",Otros
Fiambreria Premium En City Bell,US$,35000,"City Bell, Provinci...",Fiambrería
Fondo De Comercio Librería En Villa Del Parque Caba,US$,25000,Villa Del Parq...,Librería
Fondo De Comercio Librería Y Centro De Copiado En Recoleta,US$,30000,Ciudad Autónoma De Buen...,Librería
Venta Fondo Comercio Restobar Lomas De Zamora,US$,80000,Lomas De Za...,Restaurante
Fondo De Comercio De Ropa Sobre Av. Cabildo Casi Juramento,US$,39000,Ciudad Autónoma ...,Indumentaria
Fondo De Comercio Lavanderia,US$,1,"San Miguel, Bs.as...",Otros
Fondo De Comercio Hamburguesería Artesanal Cadena Franquicia,US$,29000,"Boedo, Cap...",Franquicia
Peluquería En Venta Por Viaje,US$,99,Jockey Clu...,Peluquería
Fondo De Comercio Salón De Belleza - Peluquería Con 16 Años De Sólida Trayectoria En El Rubro,US$,8000,"Merlo, Provincia De...",Peluquería
Agencia De Loteria De La Ciudad De Bs. As. Venta Fondo De Comercio Caba,US$,24000,"Buenos Aires, Argentin...",Lotería
Fondo De Comercio-.cómida Al Paso,US$,18000,"Caseros, Bs...",Otros
Fondo De Comercio!! Indumentaria Para Chicos -  Se Escuchan Ofertas,$,111111,"Catamarca 1762, Mar Del Plata...",Indumentaria
Agencia De Quiniela Y Loteria En Mataderos Usd 25.000,US$,25000,"Buenos Aires, Argent...",Lotería
"Fondo De Comercio Reposteria, Cotillon Y Mucho Mas",US$,29000,Sáenz Pe...,Cotillón
"Fondo De Comercio Reposteria, Cotillon, Y Mucho Mas",US$,34000,"Santos Lugares,...",Cotillón
Fondo De Comercio Fiambrería Y Despensa,US$,28000,Avenida Presidente Hipólito Yrigoy...,Almacén
Vendo Complejo De 8  Departamentos/ Renta Asegurada/acepto Permuta En Parte De Pago/ Financiación,US$,165000,Las Margaritas...,Hotelería
Vendo Fondo De Comercio Lavadero De Autos,US$,30000,Remedios De Escalada...,Lavadero de autos
"Fondo De Comercio Pet Shop, Peluquería Canina Mascotas",US$,11000,"Recoleta, Capital Fe...",Peluquería
Oportunidad!! Fondo De Comercio Maxikiosco Excelente Ubicación! Ramos Mejía,US$,14900,"Ramos Mejía, Provinci...",Kiosco
Venta Fondo De Comercio Cafeteria De Especialidad,US$,99000,C1426djd Cdad...,Cafetería
Restaurante Fondo De Comercio,$,65,"Centro, Bariloche, Río N...",Restaurante
Vendo Agencia De Loteria De La Provincia De Bs.as Y Kiosco,US$,8000,Villa Santos Tes...,Kiosco
Agencias De Loteria - Liquidacion Total -,US$,15000,"Pilar, Bs.as. G.b.a. Norte",Lotería
Venta Fondo De Comercio - Fabrica De Pastas - Lomas De Zamora,US$,68000,"Lomas De Zamora, Pro...",Fábrica
Fondo De Comercio Local De Decoración Y Alfombras En Devoto,US$,18000,"Buenos Aires, Argenti...",Otros
Vende Fondo De Comercio. Trabajando Con Todo El Equipamiento,US$,12000,"Quilmes, Provincia ...",Otros
Fondo De Comercio Kiosco Y Regaleria,US$,15000,La Pla...,Kiosco
Cafetera Bunn Vp-17 Impecable Estado. Poco Uso,$,900000,Gen...,Cafetería
Fondo De Comercio Heladeria,US$,180000,"Belgrano R, Capital F...",Heladería
Fondo De Comercio Heladeria,US$,15000,...,Heladería
Fondo De Comercio Local De Ropa Femenina,US$,12000,"Muñiz, Provincia De ...",Indumentaria
Agencia De Quiniela,US$,25000,Guillermo Enrique Hudson...,Lotería
Vendo Fondo De Comercio Instrumentos Musicales Zona Acoyte Y Rivadavia 10 Años De Trayectoria,US$,11111,Bu...,Otros
Ferreteria  - Ideal  Cambio Para Cambio De Vida,US$,500000,"Tornquist, Prov...",Ferretería
Ferreteria - Ideal Cambio Para Cambio De Vida,US$,500000,"Tornquist, Prov...",Ferretería
Venta Fondo De Comercio. De Bar /cervecería.,US$,40000,Villa Balleste...,Cervecería
Se Vende Gomeria Completa En La Falda - Punilla - Oportunidad Unica,US$,28000,"La Falda, Provinci...",Gomería
Excelente Fondo De Comercio,US$,60000,"Quilmes, Bs.as. G.b.a....",Otros
Restoran Cafeteria,US$,60000,"Berazategui, Provin...",Cafetería
"Carniceria En Flores, La Mejor De Flores Transfiero!",US$,150,"Flores, Capital Feder...",Carnicería
Fondo De Comercio Restaurant Italiano.  Funcionando A Full,US$,80000,"Avellaneda, Bs.a...",Restaurante
Fondo Comercio La Falda  Parrilla  Lomoteria En Plen,US$,18000,"La Falda, Punilla...",Parrilla
Fondo  De Comercio Vinoteca Gonnet,US$,12000,"Manuel B. Gonnet, La Plat...",Bebidas
"Fondo De Comercio Heladeria,  14 Años En La Zona",US$,10000,"Villa Lugano, Ca...",Heladería
Gran Oportunidad!! Fondo De Comercio,US$,26000,"Funes, Santa Fe",Otros
"Venta De Fondo De Comercio : Fiambreria Y Almacen Gourmet. Zona De Martinez. Inmejorable Oportunidad. Armado X Estudio De Arquitectura, Moderno C/ Muebles De Diseño Y Maquinaria De Primera Calidad.",US$,38000,"Martínez, Provincia D...",Fiambrería
Fondo Comercio: Dietética Y Almacén De Productos Naturales,US$,30000,"Boedo, Capita...",Dietética
Venta Fondo De Comercio/fiambreria Americana,US$,1,Fl...,Fiambrería
Venta Marca De Lencería Diferente,US$,99000,Ciudad...,Indumentaria
Fondo De Comercio Lavadero De Ropa Palermo Soho,US$,17000,"Palermo Soho, Capital...",Indumentaria
"Vendo Fondo Comercio En Importante Shoping De Caba,",$,23000,"Saavedra, Capital F...",Otros
Fondo De Comercio Heladeria,$,10000000,"Villa Celina, La ...",Heladería
Almacen Quesos Y Fiambres,US$,25000,"Floresta, Capital ...",Fiambrería
Vendo Quiniela Agencia Lotería Provincia Bs As Quilmes,US$,15000,Quilmes Oeste...,Lotería
Vendo Fondo De Comercio,$,111,"Adrogué, Almirante ...",Otros
Fondo De Comercio De Instituto De Enseñanza De Inglés,US$,1,Provincia De Buenos Ai...,Otros
Fondo De Comercio Estetica,$,9000,"Quilmes, Bs...",Salón de belleza
Fondo De Comercio En Guernica,US$,30000,"Guernica, Presidente Perón...",Otros
Agencia De Lotería José C Paz,US$,30000,José C. P...,Lotería
Venta De Fondo De Comercio: Servicio Técnico Celular,$,6999,Pasaje San Benito De Palermo 1500 ...,Otros
Fábrica De Helados Y Local Comercial - Más De 20 Años De Trayectoria!,US$,100000,Ciudad Autónoma De Buenos A...,Fábrica
Vendo Fondo De Comercio Accesorios De Telefonía Celular,US$,50000,"Longchamps, Almirant...",Otros
Franquicia Fast Food De Pastas 1,US$,1,"Boedo, Capital Federal",Hamburguesería
Peluqueria Totalmente Equipada Ubicada En El Barrio De Las Cañitas,US$,1,Ciudad...,Peluquería
Fondo De Comercio Local Gastronómico,US$,20000,Ramos M...,Otros
Propiedad En Traslasierra Tu Emprendimiento Turístico A Solo 10min De Merlo San Luis,US$,70,"La Ramada, San J...",Otros
Fondo Comercio Ferretería Imperdible,US$,28000,"Libertad, Merlo, Bs....",Ferretería
Fondo De Comercio Ferreteria,US$,73000,Adro...,Ferretería
Fondo De Comercio Parrilla,US$,89000,"Palermo Hollywood, ...",Parrilla
Pepper -bar Restaurante,US$,30000,"Chivilcoy, Provinc...",Restaurante
Fondo De Comercio Fiambreria Sandwicheria Apto Bar,US$,10500,"San Nicolás, Cap...",Fiambrería
Venta Fondo De Comercio Av. Pedro Goyena - Caballito. Despensa Boutique-fiambreria-vineria-quesos Y Fiambres-,US$,27000,"Caballito, ...",Bebidas
Venta De Fiambreria Totalmente Equipada.,$,9000000,Lomas D...,Fiambrería
Fondo De Comercio Churreria Villa Adelina,US$,19000,"Villa Adelina, San...",Panadería
Vendo Fondo Comercio,US$,60000,"Temperley, Lomas D...",Otros
Excelente Opotunidad Venta Fondo De Comercio- Optica Recoleta,US$,50000,Ciudad Aut...,Otros
Importante Estética Y Centro De Pilates,US$,20000,"Lomas De Zamora, Bs.as....",Salón de belleza
"Fondo De Comercio 4 Canchas Padel , 1 Bar Y 1 Proshop",US$,279999,"Canning, Ezeiz...",Otros
"Almacén, Fiambrería, Excelente Ubicación",$,18000,"Centro, Mar Del Plata,...",Fiambrería
Venta Fondo De Comercio Vinoteca - Almacen Gourmet,US$,8000,Santos Luga...,Bebidas
"Venta De Fondo De Comercio Para Dietética, Tienda De Suplementos, Café, Kiosko",US$,18000,"Palermo, Capital Fe...",Cafetería
Cafeteria Pasteleria Dulce Salado Take Away,US$,12000,Ciudad Autónom...,Cafetería
Instalaciones + Mercaderia Libreria Completa Caballito,US$,14900,"Caballito, Capital...",Librería
Vendo Fondo Comercio Ferreteria Amplia Clientela,US$,160000,"Palermo, Capital F...",Ferretería
Panaderia Y Cafe Con Estilo!,US$,24000,Ciudad De Cór...,Cafetería
Exelente Resto Bar - Pizzas De 1° Calidad - Tragos Y Otros,US$,40000,"Washington 6222, Isidro Casan...",Pizzería
"Agencia De Lotería, Sube Y Kiosco Lanus Oeste",US$,25000,Lanús ...,Kiosco
Venta Complejo Cabañas  - Tanti,US$,300000,"X5155 Tanti, Có...",Hotelería
Fondo De Comercio,$,65,"Terminal Nueva, Mar ...",Otros
Vendo Fondo De Comercio,US$,22000,"Quilmes, Bs.as. G.b.a. ...",Otros
Vendo Fondo De Comercio Pizzeria Capital Federal   Coghlan,US$,35000,Bueno...,Pizzería
Fondo De Comercio Telefonía Celular - La Costa,US$,12000,"Santa Teresita, Pr...",Otros
Fondo D Comercio. Funcionando.,US$,20000,Monte Grande...,Otros
Fondo Comercio Gastronomico,US$,13000,"Barrio Norte, Capit...",Otros
Venta Fondo De Comercio Estética Merlo Centro,US$,5000,"Merlo, Provinc...",Salón de belleza
"Ferreteria En Plena Zona Del Rubro, Mas De 50 Años De Presencia.",US$,25000,"Córdoba, Provincia ...",Ferretería
Heladería Fondo De Comercio,US$,50000,Don Torc...,Heladería
Almacen De Bebidas Y Varios En Pleno Centro De Villa Del Parque,US$,8500,Ciudad Autónoma De Buen...,Bebidas
Venta Fondo De Comercio Maxikiosco,US$,21000,Nuestra Señora Del Buen Viaje 1043...,Kiosco
Fondo De Comercio Dietetica Y Despensa,US$,65000,"Ituzaingó Sur, ...",Almacén
Reconocida Barberia En Caseros Venta Fondo De Comercio Barberia - Local Indumentaria,US$,39900,Case...,Barbería
Importante Propiedad En Esquina Con Fondo De Comercio De Fábrica Y Atención Al Público De Helados-panaderia-pasteleria-rotiseria-churreria En 2 Locales Independientes,US$,800000,Ciudad Autó...,Panadería
Fondo De Comercio Franquicia Tropea Escucho Ofertas,US$,30000,Villa Crespo...,Franquicia
Vendo Fondo De Comercio Maxikiosco,US$,13000,"Ciudadela, Provinc...",Kiosco
Fondo De Comercio,US$,15000,"Núñez, Capital F...",Otros
Vendo Agencia De Lotería De La Ciudad En Liniers,US$,10000,"Liniers, Capita...",Lotería
Llave De Restobar,US$,6000,"Centro, Bah...",Restaurante
"Venta De Fondo De Comercio, Cotillon",US$,7000,"Garín, Escobar, ...",Cotillón
Franquicia Lo De Jacinto,US$,30000,"Nueva Córdoba, Córdoba",Franquicia
Venta De Fondo De Comercio Supermercado,US$,12345,"Villa Bonich, Billing...",Supermercado
Lavadero De Ropa,US$,35000,"Recoleta, Capi...",Indumentaria
Boutique De Ropa En Monte Grande. Venta Fondo De Comercio,US$,18000,"Monte Grande, Esteban Ec...",Indumentaria
Gimnasio En Monte Grande Venta Fondo De Comercio,US$,100000,"Monte Grande, Es...",Gimnasio
Fondo Comercio Gastronómico En Mar Azul Excelente Ubicación,US$,15000,33 Entre Mar Del Plata Y Punta Del...,Otros
Agencia De Quiniela Ofiicial,US$,30000,"Quequén, Necochea, Buenos ...",Lotería
"Venta De Fondo De Comercio Ferreteria En Belgrano, Excelente Esquina. Oportunidad!",US$,22000,Ciudad Autónoma D...,Ferretería
Fondo De Comercio Almacén Y Kiosco,$,15000,"Sarandí, Avellaneda, Bs.As. G.B.A. Sur",Kiosco
Fondo De Comercio Kiosco Despensa En Venta,US$,3850,"KMA, Provincia De Buenos Aires, Argentina, Villa Luzuriaga, La Matanza, Bs.As. G.B.A. Oeste",Almacén
Excelente Oportunidad - Fondo De Comercio - Zona Centro Banfield,US$,28000,"Banfield, Provincia De Buenos Aires, Argentina, Banfield, Lomas De Zamora, Bs.As. G.B.A. Sur",Otros
"Fondo De Comercio, Agencia De Loterías",US$,30000,"La Unión, Ezeiza, Bs.As. G.B.A. Sur",Lotería
Vendo Fondo De Comercio Gastronómico (ideal Sushi) En San Martín,US$,8000,"San Martín, Provincia De Buenos Aires, Argentina, Barrio Parque Gral San Martín, General San Martín, Bs.As. G.B.A. Norte",Otros
Fondo De Comercio Bar,US$,70000,"Martínez, San Isidro, Bs.As. G.B.A. Norte",Otros
Vendo Fondo De Comercio Pizeria,US$,30000,"Boedo, Capital Federal",Otros
Fondo De Comercio Pet Shop Veterinaria,US$,4000,"Villa Devoto, Capital Federal",Pet shop
"Fondo De Comercio, Centro De Estética",US$,10000,"Lanús Oeste, Lanús, Bs.As. G.B.A. Sur",Salón de belleza
Fondo De Comercio Ferreteria Ramos Mejia,US$,78000,"Villa Sarmiento, Morón, Bs.As. G.B.A. Oeste",Ferretería
Fondo De Comercio Restó De Comida Saludable,US$,45000,"Centro, Pinamar, Bs.As. Costa Atlántica",Otros
Pizzería Fondo De Cormercio Villa Crespo,US$,28000,"Villa Crespo, Capital Federal",Pizzería
Fondo De Comercio Dietetica Villa Urquiza,US$,17000,"Villa Urquiza, Capital Federal",Dietética
Vendo Fondo De Comercio Parrilla,US$,9000,"Ramos Mejía, La Matanza, Bs.As. G.B.A. Oeste",Parrilla
Heladería | Fondo De Comercio,US$,10000,"Mar Del Tuyú, Provincia De Buenos Aires, Argentina, Mar Del Tuyú, Bs.As. Costa Atlántica",Heladería
Fondo De Comercio Bar Restaurante Palermo Hollywood,US$,30000,"Ciudad Autónoma De Buenos Aires, Argentina, Palermo Hollywood, Capital Federal",Restaurante
Lote De Repuestos Renault,US$,35000,"Temperley, Lomas De Zamora, Bs.As. G.B.A. Sur",Otros
Fondo De Comercio Verduleria,US$,6300,"Centro, Rosario, Santa Fe",Verdulería
Fondo Comercio Dietetica Todo Suelto Almacen Y Mas,US$,8000,"Mar Del Plata, Provincia De Buenos Aires, Argentina, Barrio Colinas Verdes, General Pueyrredón, Buenos Aires Interior",Dietética
"Fondo De Comercio. Salon Multiespacio. Fiestas Infantiles, Bautismos, Comuniones, Bodas, 15. Eventos Privados.",US$,25000,"Morón, Provincia De Buenos Aires, Argentina, Morón, Bs.As. G.B.A. Oeste",Eventos
Fondo De Comercio Maxikiosco Tortuguitas- Oportunidad!!!,US$,10000,"José Hernández 3998, Tortuguitas, Provincia De Buenos Aires, Argentina, Tortuguitas, Malvinas Argentinas, Bs.As. G.B.A. Norte",Kiosco
Fondo De Comercio La Plata,US$,18000,"La Plata, Bs.As. G.B.A. Sur",Otros
"Vendo Fondo De Comercio, Peluquería Equipada,",$,111111,"San Bernardo, Bs.As. Costa Atlántica",Peluquería
"Local En Pleno Centro De La Villa, Venta Y Servicio Tecnico De Informatica Y Teleonia Movil",US$,20000,"Villa Carlos Paz, Provincia De Córdoba, Argentina, Centro, Villa Carlos Paz, Córdoba",Otros
Fondo De Comercio De Verdulería,US$,17000,"Lomas De Zamora, Bs.As. G.B.A. Sur",Verdulería
Fondo De Comercio Ferretería,US$,35000,"City Bell, La Plata, Bs.As. G.B.A. Sur",Ferretería
Fondo De Comercio Polleria Fiambreria,US$,6000,"Parque San Vicente, Córdoba",Fiambrería
Fondo De Comercio Mar De Ajo,US$,15000,"Mar De Ajó, Provincia De Buenos Aires, Argentina, Mar De Ajo, Bs.As. Costa Atlántica",Otros
Agencia De Lotería De La Ciudad De Bs. As. Venta Fondo De Comercio Villa Urquiza,US$,23000,"Ciudad Autónoma De Buenos Aires, Argentina, Villa Urquiza, Capital Federal",Lotería
Fondo De Comercio Perfumería Y Art De Limpieza,US$,15000,"Guernica, Presidente Perón, Bs.As. G.B.A. Sur",Otros
Vendo Fondo De Comercio Fiambreria/rotiseria/casa De Comidas,$,100,"Lomas De Zamora, Bs.As. G.B.A. Sur",Fiambrería
Venta Parada De Piarios,$,1111,"Ramos Mejía, La Matanza, Bs.As. G.B.A. Oeste",Otros
Lavadero De Ropa,US$,35000,"Santa Teresita, Bs.As. Costa Atlántica",Indumentaria
Fondo De Comercio Ropa Indumentaria Av Crovara La Tablada,US$,3500,"La Tablada, La Matanza, Bs.As. G.B.A. Oeste",Indumentaria
Transfiero Agencia De Quiniela,US$,30000,"San José, Mar Del Plata, Bs.As. Costa Atlántica",Lotería
Fondo De Comercio San Martin De Los Andes,US$,17000,"Zona Centro, San Martin De Los Andes, Neuquén",Otros
Usado,$,65000,"Francisco Álvarez, Moreno, Bs.As. G.B.A. Oeste",Otros
Agencia Quiniela Loteria,US$,17000,"Once, Capital Federal",Lotería
Puesto De Diarios Y Revistas,$,100,"Belgrano, Capital Federal",Otros
Vendo Agencia Quiniela P/traslado,$,3000,"Ampliación Empalme, Córdoba",Lotería
Vendo Permuto Fondo De Comercio Lubricentro,$,165,"Cañuelas, Buenos Aires Interior",Otros
Vendo Fondo De Comercio Venta Fabricación Y Colocación De Ca,US$,350000,"Grand Bourg, Malvinas Argentinas, Bs.As. G.B.A. Norte",Fábrica
Fondo Comercio Chapa Y Pintura,$,20000,"Morón, Bs.As. G.B.A. Oeste",Otros
Fondo De Comercio Zapatería Zona Centro,US$,42000,"Centro, Mar Del Plata, Bs.As. Costa Atlántica",Otros
Parada De Diarios Y Revistas,US$,15000,"San Justo, La Matanza, Bs.As. G.B.A. Oeste",Otros
Vendo Fondo De Comercio,US$,500000,"San Miguel, Bs.As. G.B.A. Norte",Otros
"Gráfica En Nono, Córdoba - Trabajá En La Tranquilidad De Las Sierras - Se Vende Fondo De Comercio Por Viaje.",US$,20000,"Nono, Córdoba, Argentina, Nono, San Alberto, Córdoba",Otros
"Complejo De Cabañas, Al Lado De Un Arroyo, Con Pileta.",US$,70000,"La Falda, Córdoba Province, Argentina, La Falda, Punilla, Córdoba",Hotelería
Restaurante Mejor Puntuado Por Maps De Villa La Angostura,US$,50000,Villa La Angostu...,Restaurante
Venta Fondo De Comercio Verdulería Frutería Almacén Y Vivero,US$,10000,"Tigre, Bs.as. G.b...",Verdulería
