Titulo,Ubicacion,Precio,Rubro
"Vents Agencia Lotería Y Kiosco, Doy Financiación","Av. Eden 592, La Falda, Córdoba, A...",US$33.000,Kiosco
Sillas Y Mesas De Cerezo,"Belgrano Sn, Bernal, Quilmes, Bs.a...",$2.000.000,Otros
Vendo Fondo Comercio Fiambrería Y Granja Sobre Avenida Monte Castro- Caba,"Avenida Álvarez Jonte 4500, Buenos...",$30.000.000,Fiambrería
Agencia De Quiniela Dueño Directo Sin Expensas,"Av Constituyentes Sn, Villa Urquiz...",US$25.000,Lotería
Se Vende  Agencia De Lotería,"Av Calchaquí 4996, Quilmes Oeste, ...",US$25.000,Lotería
Venta De Fondo De Comercio Cafetería,"Sarmiento  2153, Palihue, Bahía Bl...",$11.111.111,Cafetería
Agencia De Lotería,"Muñiz  79, Ituzaingó Norte, Ituzai...",US$9.000,Lotería
"Fondo De Comercio Cotillon, Articulos Reposteria","Haedo, Provincia De Buenos Aires, ...",US$15.000,Cotillón
Vendo Fondo De Comercio,"Bucarelli 2294, Villa Urquiza, Cap...",US$15.000,Otros
Vendo Lavadero De Camiones,"Bvar Brown 1301, Victoria, Entre R...",US$150.000,Otros
Fondo De Comercio Peluqueria,"Italia Sn, San Miguel, Bs.as. G.b....",US$8.000,Peluquería
Venta De Fondo De Comercio,"Soler 3500, Recoleta, Capital Fede...",US$20.000,Otros
Fondo De Comercio En Palermo Soho,"Calle Godoy Cruz  2337, Palermo, C...",$25.000,Otros
Dietética..,"Rivadavia 8666, Floresta, Capital ...",US$6.500,Dietética
Vendo Fondo De Comercio,"Villa Tesei, Hurlingham, Provincia...",US$80.000,Otros
Fondo De Comercio - Kiosko,"9 De Julio 300 - 600, Ciudad De Có...",US$15.000,Kiosco
Vendo Monedas Antiguas Y Billetes De 5 Pesos,"Facundo Quiroga 602, Corzuela, Gen...",$500.000,Otros
Vendo Chapa De Loteria,"Darwin 96, Villa Pueyrredón, Capit...",US$11.111,Lotería
Agencia De Loteria,"Av 844 001, Quilmes Oeste, Quilmes...",$111.111,Lotería
"Transfiero Licencia Lotería Caba Cabinas Blindadas,","Neuquen 1510, Caballito, Capital F...",$3.500.000,Lotería
Bar 2 Año Antiguedad En Funcionamiento,"Avenida Pellegrini 1935, Rosario, ...",US$16.000,Otros
Fondo De Comercio,"Justa Lima 467, Zárate, Buenos Air...",US$19.000,Otros
"Agencia De Lotería De La Ciudad ,y Maxikiosko, ,",Av De Los Incasav Montes De Oca  1...,$16.000.000,Kiosco
Agencia De Loteria Muy Buena Rentabilidad),"Nazca 4595, Villa Pueyrredón, Capi...",US$12.000,Lotería
Agencia Lotería La Plata Sin Costo De Alquiler Por 5 Años.,"La Plata, Provincia De Buenos Aire...",US$22.000,Lotería
Refrigerante/ Anticorrosivo -  Fondo De Comercio Fabricacion,"Avenida Dardo Rocha 1000, Bernal, ...",US$15.000,Fábrica
Agencia De Loteria Y Rapipago Sobre Importante Avenida,"Avenida Bartolomé Mitre 5827, Wild...",US$30.000,Lotería
"Fondo De Comercio Maxikiosco, Excelente Ubicacion, Gran Rentabilidad","Avenida Doctor Honorio Pueyrredón,...",US$15.000,Kiosco
Farmacia Funcionando A Full Mas Propiedad,"Bv. Este 332, La Cesira, President...",US$130.000,Otros
Chapa Licencia Agencia De Lotería De La Provincia .quilmes,"Solo Chapa  Sn, Quilmes, Bs.as. G....",US$22.000,Lotería
Venta De Fabrica De Paneles Sip Posicionada  En Todo El País.,"Avenida Presidente Perón 1469, Vil...",US$74.000,Fábrica
Agencia De Loteria Y Quiniela,"Ituzaingo Sn, Lanús Este, Lanús, B...",US$30.000,Lotería
Vendo Chapa Lotería Para Quilmes Urgente,"Quilmes  Sn, Quilmes, Bs.as. G.b.a...",US$15.000,Lotería
Agencia De Lotería De La Ciudad,"Av. Rivadavia  8000, Floresta, Cap...",US$9.500,Lotería
Agencia De Loteria,"Castelar, Provincia De Buenos Aire...",US$30.000,Lotería
Venta  Agencia  De  Loteria,"Av. Calchaquí 5000, B1889jrh Ezpel...",US$27.900,Lotería
Venta De Agencia De Lotería,"Aguero 5291, Villa Dominico, Provi...",US$32.000,Lotería
Chapa De Agencia De Lotería Para Todo El Partido De 3 Febrer,"Ruta Nacional 8 Sn, Loma Hermosa, ...",US$20.000,Lotería
Parada De Diarios (devoto),"Beiro  4801, Villa Devoto, Capital...",$8.500.000,Otros
Venta Fondo De Comercio Lotería - Pilar,"Xxxxxzz Xxxx, Pilar, Bs.as. G.b.a....",US$29.000,Lotería
Agencia De Lotería -fondo De Comercio,"Av. Gral. Martín Rodríguez 1021, B...",US$14.000,Lotería
Fondo De Comercio Agencia De Lotería De La Provincia,"Noguera  1754, San Antonio De Padu...",US$9.000,Lotería
Vendo Agencia De Quiniela En Mar Del Plata,"Independencia Sn, San José, Mar De...",$30.000,Lotería
Fondo De Comercio Mercat,"Thames  747, Villa Crespo, Capital...",US$8.000,Otros
Oportunidad Vta Fondo Comercio Gaonómico Centro Villa Gessel,"105 260, Zona Centro, Villa Gesell...",US$27.000,Otros
Fondo De Comercio,"Avda 25 De Mayo  Sn, Lanús Oeste, ...",US$24.000,Otros
Fiambrería,"Tronador 4199, Dmy, Buenos Aires, ...",US$30.000,Fiambrería
Vendo Casa De Antigüedades De 40 Años De Trayectoria,"Belgrano 119, San Nicolás De Los A...",US$139.000,Otros
Fondo De Comercio Distribución De Productos De Almacén,"Mitre Sn, Alejandro Korn, San Vice...",$6.000.000,Otros
Hotel Pasajeros 26 Habitaciones En Venta Barrio San Cristóba,"Combate De Los Pozos  870, San Cri...",US$350.000,Hotelería
Se Vende Excelente Bar Cafetería En Alta Gracia,"Belisario Roldán  33, Centro, Alta...",$65,Cafetería
Fiambrería - Fondo De Comercio- Vendo,"Lebensohn  10, Bernal, Quilmes, Bs...",US$28.000,Fiambrería
Vendo Fondo De Comercio,"0000 000, Gerli, Lanús, Bs.as. G.b...",$3.000.000,Otros
Vendo Fondo De Comercio,"Quintino Bocayuva 401, Buenos Aire...",US$6.500,Otros
Radio Fm Funcionando Con Licencia,"José Ingenieros 31883, Dina Huapi,...",$3.000.000,Otros
"Vendo Agencia De Loteria Localidad De Salto, Pcia De Bs","Dardo Lafalce  90, Salto, Buenos A...",$100,Lotería
Fondo De Comercio,"San Martín 81, Matheu, Escobar, Bs...",US$15.000,Otros
Vendo Fondo De Comercio Churreria,"Alem 1217, Cipolletti, Río Negro",US$35.000,Panadería
Venta Agencia De Loteria Pcia. Bs As Zona Ezeiza,"Calle  Sn, Tristán Suárez, Ezeiza,...",$111,Lotería
"Venta De Fondo De Comercio , Tienda De Fiambres Y Quesos","Entre Brandsen Y Suarez Sn, Barrac...",US$22.000,Fiambrería
Fondo De Comercio,"Maipú 150, Centro, San Miguel De T...",US$120.000,Otros
Fondo De Comercio Aberturas Aluminio Y Pvc,"Av. Diaz Velez Sn, Ciudadela, Tres...",US$150.000,Otros
Vendo Agencia Lotería Capitán Sarmiento,"Rivadavia 499, Capitán Sarmiento, ...",$30.000,Lotería
Vendo Veterinaria Mardelplata,"No 1, Plaza Colón, Mar Del Plata, ...",US$65.000,Veterinaria
Fondo De Comercio Agencia De Remis,"Av San Martín 842, Huerta Grande, ...",$5.000,Otros
Fondo De Comercio Carniceria,"Presidente Perón 600 - 900, Cosquí...",$40.000.000,Carnicería
Agencia De Loteria!!!!,"Las Flores Sn, Wilde, Avellaneda, ...",US$26.000,Lotería
"Fondo De Comercio Autoescuela, Más 30 Años, Amplia Clientela","Soler Sn, Ituzaingó Centro, Ituzai...",US$10.000,Otros
"Agencia De Loteria En Salto, Provincia De Bs As","Salto, Provincia De Buenos Aires, ...",$100,Lotería
1,"Aenida Peru 2069, Otros Barrios, M...",$49.000.000,Otros
Parada De Diarios Estacion Villa Ballester,"San Martín 4900, Villa Ballester, ...",US$4.000,Otros
"Vendo Panadería, Hermosa, Clientela Fija, Antigüedad 4 Años","Sagrada Familia 1522, Cerro De Las...",US$22.000,Panadería
Fondo Taller Mecanico,"Ernestina Lopez De Nelson  6486, L...",$24.000.000,Otros
Fondo De Comercio,"Boyero Sn, Cariló, Bs.as. Costa At...",US$120.000,Otros
Venta Fondo De Comercio Optica,"Av. Sta. Fe 3554, C1425bgx Caba, A...",US$25.000,Otros
Chapa + Cerramiento Blindado Loteria De La Ciudad,"Constituyentes Sn, Villa Pueyrredó...",US$10.000,Lotería
Vendo/permuto Complejo De Departamentos,"Baigorria 183, Rosario, Provincia ...",US$280.000,Hotelería
Fondo De Comercio Importante Franquicia En Shopping,"Quevedo 3365, Villa Devoto, Capita...",US$90.000,Otros
Hostel De Vanguardia: Oportunidad Única De Negocio En El Turismo. Venta Fondo De Comercio,"Av. Pellegrini 461, S2000bte Rosar...",US$23.000,Hotelería
"Bebidas - Destilados, Remanente De Fondo De Comercio","Liniers Sn, Ramos Mejía, La Matanz...",US$3.900,Otros
Chapa De Loteria De La Provincia De Buenos Aires,"Lomas De Zamora, Provincia De Buen...",US$15.000,Lotería
Vendo Panadería Con Casa 300m2 En Rosario Zona Pellegrini,"España  1700, Abasto, Rosario, San...",US$350.000,Panadería
Fondo De 3 Comercios,"Constituyentes 200, Concepción Del...",US$220,Otros
Venta De Agencia De Lotería De La Ciudad De Buenos Aires En Floresta.,"Comuna 10, Avenida Rivadavia 8571,...",US$12.000,Lotería
Venta De Fondo De Comercio,"Zarraga 3345, Colegiales, Capital ...",US$10.000,Otros
Lavadero De Ropa,"Avenida Callao  Sn, Recoleta, Capi...",US$35.000,Indumentaria
"Fondo De Comercio. Kiosco, Wilde, Las Flores Y El Acceso.","Las Flores  1134, Wilde, Avellaned...",US$6.000,Kiosco
"Salon De Eventos, Local Y Dpto Con Propiedad","Olivieri 4848, Gregorio De Laferre...",US$450.000,Otros
"Lote , Casa Muy Amplia , Dúplex , Departamentos , Fondo De Comercio ! Posible Permuta !!!","Calchaqui 1823, Florencio Varela, ...",US$165.000,Otros
Venta De Fondo De Comercio - Local Ropa Deportiva/urbana,"Aguirre 672, Villa Crespo, Capital...",US$20.000,Indumentaria
Pizzeria Fondo De Comercio,"Castillo 501, Villa Crespo, Capita...",US$30.000,Pizzería
Oportunidad. Agencia De Lotería En Haedo. Excelentes Comisiones.  Venta Por Cambio De Rubro,"Juan B. Justo 499, Haedo, Provinci...",US$19.999,Lotería
Fondo De Comercio Loteria De La Ciudad Quiniela,"Rivadavia  4215, Caballito, Capita...",US$22.500,Lotería
Fondo De Comercio Rotiseria V Devoto A Metros De Beiro,"Allende  3464, Villa Devoto, Capit...",US$9.000,Otros
"Fondo De Comercio, Casa De Lotería.","Calle Cosquin , A Dos Cuadras De C...",US$17.000,Lotería
Parada De Diarios Villa Del Parque Valor $10.000.000.-,"Villa Del Parque, Caba, Buenos Air...",$10.000.000,Otros
Agencia De Loteria,"San Juan 3538, Recoleta, Capital F...",US$20.000,Lotería
Fondo De Comercio Heladería En Béccar - (josé Ingenieros 3510),"Jose Ingenieros  3510, Béccar, San...",US$22.000,Heladería
