Titulo,Ubicacion,Precio,Rubro
Fondo De Comercio Salon De Fiestas Infantiles,"Av Galicia  586, Piñeyro, Avellane...",US$40.000,Eventos
Fondo De Comercio  - Farmacia Y Perfumería,"Av. Bodereau  1911, El Ceibo, Vill...",US$15.000,Otros
Venta Fondo De Comercio Verdulería Frutería Almacén Y Vivero,"Albarellos  514, Tigre, Bs.as. G.b...",US$10.000,Verdulería
Estacion De Servicio Con Mercadería Incluida.,"Colon Y Belgrano Sn, La Cumbre, Pu...",US$200.000,Otros
Venta Fondo De Comercio,"Calle Geronimo L Fassola Sn, Haedo...",$9.000.000,Otros
Fondo De Comercio Rubro Panadería,"Av Varela 1130, Campana, Buenos Ai...",US$70.000,Panadería
Local Boutique Ropa Femenina,"Cerro De Las Rosas, Córdoba, Provi...",US$30.000,Indumentaria
"Complejo De Cabañas, Al Lado De Un Arroyo, Con Pileta.","Wf5c+rf, La Falda, Córdoba Provinc...",US$70.000,Hotelería
"Fondo De Comercio En Venta Minimercado, Verduleria, Fiambreria, Almacen Y Mas","Ortiz De Rosas 698, Morón, Provinc...",US$26.900,Fiambrería
Restaurante Mejor Puntuado Por Maps De Villa La Angostura,"Av. Arrayanes 87, Villa La Angostu...",US$50.000,Restaurante
Fondo De Comercio Pet Shop Y Pelu Canina,"San José  1845, Funes, Santa Fe",US$1.111,Pet shop
"Fondo De Comercio Dietetica Vitalcer , Se Puede Traspasar De Zona,,,","H Yrigoyen  540, General Pacheco, ...",US$20.000,Dietética
Venta Fondo De Comercio Rapipago Con Kiosko Y Servicios Vs.,"Aristóbulo Del Valle 400, Ciudad A...",US$10.500,Kiosco
Franquicia De Congelados Con 2 Sucursales En Caba Y Bs.as.,"España 12, Gran Buenos Aires, Buen...",US$45.000,Otros
Venta De Fondo De Comercio Verduleria Fruteria Almacen Y Vivero En Tigre,"Albarellos 514, Tigre, Provincia D...",US$10.000,Verdulería
Liquidacion Total Ferreteria Para Trasladar,"Empalme, Ciudad De Córdoba, Provin...",US$117.000,Ferretería
Fondo De Comercio Dietetica Almacen,"Hilario Ascasubi Sn, Villa Bosch, ...",US$5.000,Dietética
Bellisimo Complejo En Venta En Valle De Pancanta. San Luis.,"Ruta 9 66, Carolina, Coronel Pring...",US$280.000,Hotelería
Quimica Fondo De Comercio En Venta,"Enrique Santamarina  455, Monte Gr...",US$18.000,Otros
Local Importante De Fiambreria Zona Martinez Vendo Fondo Comercio,"Hipólito Yrigoyen, Martínez, Provi...",US$18.000,Fiambrería
¡no Pierdas Esta Oportunidad De Invertir En Tu Propio Negocio Fábrica De Pizzas A La Piedra! Ideal Grupo Familiar.,"Arias 2000, Bahía Blanca, Buenos A...",US$18.500,Fábrica
"Vendo Fondo De Comercio, Excelente Ubicación,","Cabello Y San Luis 3465, Florencio...",US$38.000,Otros
Agencia De Loteria Lomas De Zamora Parque Baron,"Francisco Siritto 226, Lomas De Za...",US$10.000,Lotería
Agencia De Lotería De La Ciudad,"Avenida Lope De Vega 570, Villa Lu...",US$4.000,Lotería
Fondo Comercio Panadería,"Agrelo  4383, Almagro, Capital Fed...",US$35.000,Panadería
"Dietetica , Tienda Saludable Venta De Fondo De Comercio Villa Urquiza","Av . Monroe 5239, Villa Urquiza, C...",US$35.000,Dietética
Vendo Fondo De Comercio De Catering Para Eventos,"Av. Directorio 771, Ciudad Autónom...",US$35.000,Eventos
Venta Fondo Comercio - Carnicería,"Avenida Hipólito Yrigoyen 2110, Bu...",$36.000.000,Carnicería
Vendo Fondo De Comercio Restobar Gualeguaychu,"25 De Mayo 552, Gualeguaychú, Entr...",US$75.000,Restaurante
Venta Ferreteria,"Alvear 544, Oriente, Coronel Dorre...",US$1,Ferretería
Galpón Mas Casa 3 Ambientes Más Fondo De Comercio Permuta,"Morón, Bs.as. G.b.a. Oeste",US$200.000,Otros
Fondo Comercio Cancha Futbol7 Y Quinta P/eventos - Tomo Auto,"Los Sauces Sn, La Lonja, Pilar, Bs...",US$8.000,Cancha de futbol
Complejo De 10 Departamentos En La Mejor Zona De San Bernardo!!!,"San Juan 2835, San Bernardo, Provi...",US$400.000,Hotelería
Fondo Comercio Suplementos Deportivo Y Dietética Funcionando,Avenida Brigadier General Juan Man...,US$30.000,Dietética
Fondo De Comercio  Dietética - Tienda Saludable,"Ituzaingó 1100, Lanús Este, Lanús,...",US$40.000,Dietética
Vendo Gran Fondo De Comercio En Importante Centro Turistico 2 Unidades De Negocio,"Av Argentina Sn, Villa Río Icho Cr...",US$38.000,Otros
Bulonera Fondo De Comercio,"Av. Gral. José De San Martín 102, ...",US$85.000,Ferretería
Venta De Fondo De Comercio De Carniceria,"3 De Febrero  3204, Santos Lugares...",US$60.000,Carnicería
Fondo De Comercio,"Rivadavia  100, San Isidro, Bs.as....",$65,Otros
Repuesto Originales Automotor Chevrolet,"Av 21 4000, Berazategui, Bs.as. G....",US$57.000,Otros
Único...!! Fondo De Comercio. La Mejor Inversión..!!,"Av. Alem  Sn, Universitario, Bahía...",$1.234.567,Otros
Fondo De Comercio Supermercado,"Senguel 6870, González Catán, La M...",US$20.000,Supermercado
Venta Fondo De Comercio,"Av. Bartolomé Mitre 398, Villa Mar...",US$50.000,Otros
Fondo De Comercio Panadería Y Rotisería,"Av Rodolfo López  1499, Quilmes, B...",US$10.000,Panadería
"Hedaria, Fondo De Comercio","Manuel Gomez Fretes 4099, Merlo, B...",US$7.000,Otros
Venta Fondo De Comercio Habilitado Restaurant Pizzeria Y Parrilla,"Constitucion 148, San Fernando, Bs...",US$12.500,Parrilla
Fondo De Comercio,"Avenida Rivadavia 4370, Caballito,...",US$15.000,Otros
Venta Hotel En Avenida Forest Y Av Álvarez Thomas Capital,"Forest  1162, Belgrano, Capital Fe...",US$470.000,Hotelería
Vendo Fondo De Comercio Kiosco,"Rosales  1582, El Palomar, Morón, ...",US$20.000,Kiosco
Carniceria,"Mosconi 1207, Lomas Del Mirador, L...",US$11.000,Carnicería
Fondo De Comercio Maxikiosco,"Parana 6529, Villa Adelina, San Is...",US$10.000,Kiosco
Vendo Fondo De Comercio Autoservicio 40 Años En La Zona,"Montiel 1696, Mataderos, Capital F...",US$30.000,Supermercado
Cervecería Y Vermuteria,"Cordoba 1101, Firmat, General Lópe...",US$115.000,Cervecería
Vendo Fondo De Comercio De Café / Bar,"Parana 1100, Recoleta, Capital Fed...",US$22.000,Cafetería
"Fondo De Comercio Juguetería, Pañalera Ropa Bebe Y Libreria","Crovara 1097, Lomas Del Mirador, L...",US$15.000,Librería
Fondo De Comercio Mar De Las Pampas Oportunidad,"Mar De Las Pampas, Provincia De Bu...",US$25.000,Otros
Fondo De Comercio Rubro Cervecería,Avenida Presidente Juan Domingo Pe...,US$50.000,Cervecería
Frigorífico Sin Funcionar Precio En Dólares Solo Venta,"Cañada De Gomez 2100, Mataderos, C...",US$560.000,Otros
Fondo De Comercio .... Escucho Ofertas,"Constitucion 668, San Fernando, Bs...",US$1.111.111,Otros
"Vendo Casa + Complejo De Cabañas + Fondo De Comercio Oportunidad - El Trapiche, San Luis","Ww4j+px Trapiche, San Luis, San Lu...",US$150.000,Hotelería
Fondo De Comercio Estetica Y Uñas,"Av Velez Sarsfield 22, Ciudad Made...",US$15.000,Salón de belleza
Venta De Fondo De Comercio Maxikiosco.   Villa Crespo-caba,"Av. Raúl Scalabrini Ortiz 1058, C1...",US$12.000,Kiosco
Fondo De Comercio - Kiosco - Librería - Villa Elisa,"Calle 3 & Calle 421, Villa Elisa, ...",US$16.000,Kiosco
Fondo De Comercio Kiosco (buena Caja Mensual $),"Av. Cristianía 1375, Kma, Provinci...",US$5.500,Kiosco
Vendo Fondo De Comercio Gomeria Alineacion Y Balanceo,"Mosconi 1150, Lomas Del Mirador, L...",US$28,Gomería
Vendo Apart Hotel Sierra De La Ventana,"Juan Bautista Alberdi 157, Sierra ...",US$340.000,Hotelería
"Oportunidad! Complejo De 5 Cabañas En P. Del Diablo, Uruguay","Abayuba 117, Otras Ciudades, Rocha...",US$190.000,Hotelería
Venta Fondo De Comercio Kiosko/almacen Venezolano/argentino Flores,"Culpina 58, Ciudad Autónoma De Bue...",US$12.900,Kiosco
Ferretería En Venta.. Permuta,"Yermoli 1243, Grand Bourg, Malvina...",US$65.000,Ferretería
Fondo De Comercio Merlo Sl,"Avenida Del Sol Sn, Merlo, Junín, ...",US$140.000,Otros
"Venta De Fondo De Comercio, Maxikiosco, Goloteca, Golosinas","Arrieta 2899, San Justo, Provincia...",US$8.000,Kiosco
Vendo Agencia De Lotería,"Avenida 44 2098, San Carlos, Provi...",$21.000.000,Lotería
Fondo De Comercio Ferretería Sanitarios,"Av.lope De Vega  1456, Monte Castr...",US$70.000,Ferretería
Fondo De Comercio De Casa De Repuestos Con 32 Años De Antiguedad,"Pte Peron 1404, Villa Luzuriaga, L...",US$170.000,Otros
Fondo De Comercio Salón De Belleza,"Moreno  490, Quilmes, Bs.as. G.b.a...",US$14.000,Salón de belleza
Fiambrería Autoservicio,"101 69, Guernica, Presidente Perón...",US$30.000,Supermercado
Fondo De Comercio Centro De Estética La Plata,"Calle 11 1037, Dps, Provincia De B...",US$12,Salón de belleza
Fondo De Comercio Restobar Santa Rosa Calamuchita,"Libertad  46, Centro, Santa Rosa D...",US$35.000,Restaurante
Se Vende Fondo De Comercio Hamburgueseria Fabena Food,"Crisologo Larralde 896, Morón, Bs....",US$18.000,Hamburguesería
Vendo Fondo De Comercio Café-resto-bar  En Palermo Soho,"Niceto Vega  4796, Palermo Soho, C...",US$48.000,Cafetería
Venta Fondo De Comercio Dueño Directo,"Gorriti Sn, Adrogué, Almirante Bro...",$111.111,Otros
Fondo De Comercio Cotillón En Flores,"Camacua 33, Flores, Capital Federal",US$14.000,Cotillón
Fondo De Comercio. Dietética,"Carlos Villate 3173, Olivos, Provi...",$11.000,Dietética
Venta De Instalaciones En Local Arrendado,"Güemes 3723, Ciudad Autónoma De Bu...",US$13.000,Otros
Fondo De Comercio - Funcionando,"Hipólito Yrigoyen 8, Embalse, Cala...",$11.111,Otros
Fondo De Comercio En Venta Canchas De Fútbol Ciudad Evita,"Paseo De Los Italianos Sn, Ciudad ...",US$98.000,Cancha de futbol
Fondo De Comercio Geriatrico,"Damaso Larrañaga  640, Parque Avel...",$111.111,Geriátrico
Excelente Fondo De Comercio En Villa Bosch Nuevo Precio,"Jose María Bosch 1058, Villa Bosch...",US$14.000,Otros
Fondo De Comercio Local Ind Femenina! Excelente Ubicación,"Meeks 71, Lomas De Zamora, Bs.as. ...",US$20.000,Indumentaria
"Gráfica En Nono, Córdoba - Trabajá En La Tranquilidad De Las Sierras - Se Vende Fondo De Comercio Por Viaje.","Rp14 300 - 600, Nono, Córdoba, Arg...",US$20.000,Otros
Fondo De Comercio En Venta,"Arias 2450, Castelar, Bs.as. G.b.a...",US$45.000,Otros
Fondo De Comercio Supermercado,"Juan Bautista Lasalle 4101, Gonzál...",US$45.000,Supermercado
Maxikiosco 24hs,"Av Eva Perón 851, Ramos Mejía, La ...",US$29.000,Kiosco
Fondo De Comercio Parrilla En Centro La Plata,"Calle 57 715, Bnc, La Plata, Provi...",US$15.000,Parrilla
Fondo De Comercio De Autoservicio,"Ricardo Rojas 5860, Moreno, Bs.as....",US$65.000,Supermercado
Fondo De Comercio Despacho Papas Cheddar Y Mas,"Av. 60 E/138 Y 139.  2174, Los Hor...",US$10.000,Otros
Fondo De Comercio Comiqueria San Miguel Centro,"Paunero 1505, San Miguel, Bs.as. G...",US$7.500,Otros
Fondo De Comercio Café,"Fitz Roy 1612, Palermo Hollywood, ...",US$29.000,Cafetería
Venta Local 36m En San Andres $$68mil,"Diego Pombo Sn, Villa San Andrés, ...",US$68.000,Otros
Cafetería Bar,"Arcos 2831, Ciudad Autónoma De Bue...",US$25.000,Cafetería
Centro Medico Ambulatorio -  Financiacion 50% Propia,"Alberti 627, Once, Capital Federal",US$650.000,Otros
Vendo Fondo De Comercio Kiosco,"Manuel Quindimil  769, Lanús Oeste...",US$9.000,Kiosco
Fondo De Comercio Barbería En Palermo,"Sánchez De Bustamante  1629, Paler...",US$8.500,Barbería
Fondo De Comercio Vinoteca,"Alberti 2332 2241, Güemes, Mar Del...",US$18.000,Otros
Invertí En La Angostura Fondo De Comer. Corazón Av Arrayanes,"Av.arrayanes 121, Villa La Angostu...",US$53.000,Otros
Vendo Complejo De Cabañas Desayunador Comedor Vivienda,"Las Violetas 785, Villa Parque Siq...",$111.111.111,Hotelería
Local Comercial + Fondo De Comercio,"Las Flores 1600, Wilde, Avellaneda...",US$100.000,Otros
Comercio Completo (mercadería Incluida),"Murguiondo 3378, Villa Lugano, Cap...",US$8.000,Otros
Fondo  De Comercio Vinoteca Gonnet,"25 3971, Manuel B. Gonnet, La Plat...",US$12.000,Otros
Venta De Fondo De Comercio Restobar,"Juan Domingo Peron  6992, Benavíde...",$150.000,Restaurante
Permuto Lote Ferreteria . Solo Mercaderia,"Cristóbal Colón, Monte Grande, Pro...",US$7.000,Ferretería
Cerveceria Bar Fondo De Comercio,"Gaucho Cruz 5356, Villa Bosch, Pro...",US$27.000,Cervecería
Fondo De Comercio Residencia Geriatrica,"Rivera Indarte Sn, San Justo, La M...",US$65.000,Geriátrico
Fondo De Comercio- Perfumería Y Limpieza,"Pedro Noguera 2581, San Antonio De...",US$19.000,Otros
Fondo De Comercio Local Antigüedades + De 8000 Prods. Leer,"Paysandú  1404, Villa Ariza, Ituza...",US$29.000,Otros
Vendo Fondo De Comercio De Pizzeria Restó,"Avenida Fragata Sarmiento 175, Agu...",US$18.000,Pizzería
Vendo Fondo De Comercio,"Deán Funes  Sn, Capilla Del Monte,...",$20.000,Otros
Venta Hotel Jagüel Santa Teresita,"3 59, Santa Teresita, Bs.as. Costa...",US$385.000,Hotelería
Barbería Completa,"San Martín  151, Villa Ojo De Agua...",US$4.500,Barbería
Fondo De Comercio Centro De Estética Spa Martínez,"Tres Sargentos 2009, Martínez, San...",US$30.000,Salón de belleza
Fondo De Comercio,"Soldado De Malvinas 1998, Villa Ad...",US$18.000,Otros
Vendo Fondo De Comercio De Maxikiosco,"Alvear 787, Quilmes, Bs.as. G.b.a....",US$3.900,Kiosco
Vendo Fondo Comercio Informática Y Tecnología,"J.k Sn, Jesús María, Córdoba",US$38.000,Otros
Ferreteria Con 28 Años De Antiguedad Permuto,"Triunvirato 1397, Ramos Mejía, Pro...",US$67.000,Ferretería
Fondo De Comercio Cancha De Fútbol,"Av Patricios  6200, Libertad, Merl...",US$35.000,Cancha de futbol
Oportunidad!!!  Fondo De Comercio Maxiquiosco,"Lascano 4100, Ciudad Autónoma De B...",US$4.500,Kiosco
Lote Ferreteria . Solo Mercaderia,"Av. Estado De Israel 4693, Ciudad ...",$10.000.000,Ferretería
Fondo De Comercio - Bar Cafe Resto - En Edifico Privado,"Santos Dumont 3454, Buenos Aires, ...",US$29.000,Cafetería
Vendo Fondo De Comercio Carpinteria,"Alférez Rubén Bertollo 2075, Luis ...",US$33.000,Otros
Fondo De Comercio Box De Ent. Funcional/cross/indoor,"Av De Mayo  1722, Ramos Mejía, La ...",US$50.000,Otros
Fondo De Comercio Estética Integral,"Mendoza 4626, Villa Urquiza, Capit...",US$7.500,Salón de belleza
Fondo De Comercio Cotillón Reposteria Y Dietetica. En Venta,"Moreno 1467, Villa Ballester, Gene...",US$17.000,Cotillón
Venta Fondo De Comercio .peluquería Unisex .,"Jose Pedro Varela 5310, Villa Devo...",US$11.500,Peluquería
Venta Fondo De Comercio: Indumentaria Zona Adrogué,"Benigno Macías  655, Adrogué, Almi...",US$15.000,Indumentaria
"Restaurante Fondo De Comercio, Oportunidad. Venta En Tandil, Zona Turistica Calvario.","Av. Monseñor De Andrea 111, Tandil...",US$13.000,Restaurante
Fondo De Comercio Cotillón,"Soldado Mansilla 1650, San Miguel,...",US$12.000,Cotillón
Fondo De Comercio,"Capraro 1141, Centro, Bariloche, R...",US$50.000,Otros
Fondo De Comercio-hostel,"Avenida Nicolás Dávila 121, Villa ...",US$15.000,Hotelería
Venta Fondo De Comercio: Local De Indumentaria En Adrogué,"Benigno Macías 655, Adrogué, Almir...",US$15.000,Indumentaria
Se Vende Llave De Comercio De Minimercado Muy Buenas Ventas,"Güemes  1646, Pilar, Las Colonias,...",$42.000.000,Supermercado
Fondo De Comercio Con O Sin Franquicia,"Las Magnolias  221, Centro, Villa ...",US$160.000,Otros
Fondo De Comercio En Venta Dietética U Otro Rubro,"Carlos Villate  3173, Florida, Vic...",US$11.000,Dietética
Hotel Rural (apart & Hotel) Ecoturismo Pesca,"Beron De Astrada  1730, Esquina, C...",$399.000,Hotelería
Fondo De Comercio De Cafeteria,"Las Flores  600, Wilde, Avellaneda...",US$7.000,Cafetería
Fondo De Comercio Salon Fiesta,"Rucci 2296, Isidro Casanova, La Ma...",$5.000.000,Eventos
Fondo De Comercio,"Saenz Peña Sn, La Paz, Entre Ríos",$1.000,Otros
Fondo Comercio Ferreteria,"Federico García Lorca Sn, Caballit...",US$15.000,Ferretería
Agencia De Loteria De La Provincia.,"Maipú. 495., Merlo, Bs.as. G.b.a. ...",$24.999,Lotería
Fondo De Comercio Resto Bar En Funcionamiento Villa Ballester,"Lamadrid 2600, Villa Ballester, Pr...",US$1.111,Restaurante
"Ferretería Bulonera Y Lubricentro, Vendo Por Mudanza.","Victor Hugo 832, Ostende, Provinci...",US$48.000,Ferretería
Fondo De Comercio Parrilla Restaurante Parque Cervecero,"Antártida Argentina  2802, Llavall...",US$12.000,Cervecería
Kiosco En Quilmes Fondo De Comercio,"Av. Hipólito Yrigoyen  Quilmes, Pr...",US$25.000,Kiosco
Venta Fondo De Comercio Ferreteria,"Av. Gral. San Martin 570, Ramos Me...",US$32.000,Ferretería
Fondo De Comercio De La Mejor Bicicletería De Belgrano,"Echeverría  2658, Belgrano, Capita...",US$20.000,Bicicletería
Fondo De Comercio Dietetica Beruti 2800,"Beruti 2800, Ciudad Autónoma De Bu...",US$30.000,Dietética
Vendo Fondo De Comercio Pizzeria-bar- Cafe,"Cabildo  332, El Jagüel, Esteban E...",US$10.000,Cafetería
Fondo De Comercio Pizzería,"Parana  Sn, Villa Adelina, Vicente...",US$30.000,Pizzería
Fondo De Comerio Kiosco Libreria Impresiones Paqueteria Mercado Libre,"La Rioja 2021, Buenos Aires, Argen...",US$11.000,Kiosco
Vendo Urgente ! Fondo De Comercio - Hamburgueseria Escobar,"Av. Inmigrantes  1320, Belén De Es...",US$9.500,Hamburguesería
Fondo De  Comercio Totalmente Equipado.facilidad Oportunidad,"Calle 2 1272, Santa Teresita, Bs.a...",US$70.000,Otros
"Se Vende Fondo De Comercio, Vidriería","Castro Barros  802, Lanús Oeste, L...",US$36.500,Otros
Fondo De Comercio Carniceria Y Granja,"Calle Bolivar 385, Ramos Mejía, La...",US$15.000,Carnicería
"Fondo De Comercio 4 Canchas Padel , 1 Bar Y 1 Proshop","Mariano Castex 835, Canning, Ezeiz...",US$279.999,Otros
Exelente Oportunidad Fondo De Comercio Linea Peugeot,"Av Crovara 439, Ciudad Madero, La ...",US$55.000,Otros
Vendo Fondo De Comercio Regaleria/bazar,"Av Capitan Claudio Rosales 1, Haed...",US$25.000,Otros
Vendo   Fondo De Comercio Oportunidad  En Caballito Primera,"Cachimayo 9, Caballito, Capital Fe...",US$6.500,Otros
Consultorio Odontológico Completo A 1 Cuadra Shopping Alto Palermo,"Avenida Santa Fe 3329, Buenos Aire...",US$22.000,Salud
Agencia De Loteria De La Ciudad En Venta Chapa E Instalaciones,"Av. De Los Constituyentes 5887, Ez...",US$9.500,Lotería
Vendo Fondo De Comercio Maxikisoco. Urgente !!! Hasta Fin De Mes !!! No Te Lo Pierdas!!!,"Bynon  6944, Liniers, Capital Fede...",$9.000.000,Otros
Puesto De Diarios Y Revistas - Centro De San Telmo,"Avenida Independencia 409, San Tel...",US$6.500,Otros
Fondo De Comercio Fábrica De Sandwiches De Miga,"Calle 3 1009, Santa Teresita, Bs.a...",US$16.000,Fábrica
Heladeria Volta Fondo De Comercio,"Avda Nazca  4692, Villa Pueyrredón...",$19.800,Heladería
Fondo De Comercio Barberia Con Excelente Ubicación,"Triunvirato  4012, Villa Urquiza, ...",US$6.999,Barbería
Heladería Fondo De Comercio Funcionando,"Calle 2 9150, Mar Del Tuyú, Provin...",US$10.000,Heladería
Hermoso Fondo Comercio Reposteria Cotillon,"A.jonte 5000, Monte Castro, Capita...",US$9.000,Cotillón
Venta D Fondo De Comercio Lavadero D Ropa..30 Años De Antigu,"Bynnon 2770, José Mármol, Almirant...",US$38.000,Indumentaria
Transfiero Fondo De Comercio Heladería Cafetería,"Avenida Lope De Vega  3238, Villa ...",US$38.000,Cafetería
Fondo De Comercio Cafetería Al Lado Teatro Melos,"Alberdi 50, Centro, Villa Carlos P...",US$15.000,Cafetería
Fondo De Comercio,"Andrés Baranda  1224, Quilmes, Bs....",US$4.200,Otros
Fondo De Comercio Regalos Empresariales Maquinas De Grabado Profesional Fabolusa Rentabilidad Real Comprobable,"Juan Díaz De Solís 308, Quilmes, P...",US$20.000,Otros
Vendo Fondo De Comercio Pet Shop,"Pte Roca  1900, Abasto, Rosario, S...",US$13.000,Pet shop
Fondo De Comercio,"Ricardo Balbin  895, Morón, Bs.as....",$10.000,Otros
¡oportunidad! Venta De Fondo De Comercio Para Hotel. Caba.,"Belgrano  2818, Balvanera, Capital...",US$2.500,Hotelería
Fondo De Comercio Fiambreria En Almagro,"Av. La Plata 320, Almagro, Capital...",US$25.000,Fiambrería
Fondo De Comercio Santa Teresita 47 Street-wanama-tascani,"2 1137, Santa Teresita, Bs.as. Cos...",US$25.000,Otros
Vendo Fondo De Comercio Materiales Electricos,"Ctr, Avenida 14 3060, Berazategui,...",US$60.000,Otros
Venta - Puesto De Diarios Y Revistas,"Colón & General Bartolomé Mitre, M...",$100,Otros
Heladería . Cafeteria,"Avda Tacuarí  7072, Villa Cabello,...",US$8.000,Cafetería
Fondo De Comercio,"Av Avellaneda 1750, Virreyes, San ...",US$50.000,Otros
Fondo De Comercio Fiambreria Y Quesería   La Mejor,"Av. Varela 1104, Flores, Capital F...",US$30.000,Fiambrería
Fondo De Comercio Ferreteria Villa Ciudad Parque Cordoba,"Av Los Reartes  715, Villa Ciudad ...",US$60.000,Ferretería
Venta Fondo De Comercio.,"Avenida Jose De San Martin  2815, ...",US$12.000,Otros
Fondo De Comercio Mercería,"España  709, Centro, Rosario, Sant...",US$29.000,Otros
Fondo De Comercio Autopartes/repuestos,Jeronimo L.de Cabrera Esq.rodrigue...,US$8.500,Otros
Fondo De Comercio Con Franquicia Propia,"Artigas 3188, Tigre, Bs.as. G.b.a....",US$16.000,Otros
Fondo De Comercio Importante Bar En Bella Vista,"Av. Pedro Riera 46, Bella Vista, P...",US$2,Otros
Fondo De Comercio,"Av. Bartolome Mitre 6587, Avellane...",US$30.000,Otros
Fondo De Comercio,"Calle Lascano 3995, Floresta, Capi...",US$28.000,Otros
Fondo De Comercio Bar Cerveceria,"Edmundo Gomez  Sn, Otros Barrios, ...",US$10.000,Cervecería
Fondo De Comercio Lavadero Autos Zona Ituzaingó .urg Salud,"Av Ratti 2636, Ituzaingó Sur, Ituz...",US$14.000,Lavadero de autos
Agencia Lotería Villa Del Parque Escucho Oferta Razonable,"Av Francisco Beiro  3388, Villa De...",US$15.000,Lotería
Fondo De Comercio Taller Mecanico Automotor Bosch Car Service,"Avenida Belgrano 3679, Buenos Aire...",US$85.000,Otros
Fondo De Comercio Av. Pedro Goyena - Caballito. Hermosa Despensa Boutique-fiambrería-vinería-quesos Oportunidad!,"Av. Pedro Goyena 1710, Buenos Aire...",US$30.000,Almacén
V 2 Fondos De Comercio! 2 Barberias/pelu Unisex C/ Gabinete,"Av. Nazca 5784, Villa Pueyrredón, ...",US$10.000,Barbería
Fondo De Comercio Cafeteria De Especialidad + Dietetica,"Calle Sanchez De Bustamante Sn, Re...",US$95.000,Cafetería
"Fondo De Comercio, Autoservicio, Ranelagh","Av Ranelagh  Sn, Ranelagh, Berazat...",US$38.000,Supermercado
Vendo  Maxikiosco,"Gaona 2994, Ramos Mejía, La Matanz...",US$22.000,Kiosco
Heladería,"Sánchez De Bustamante  1702, Barri...",US$20.000,Heladería
Vendo Fondo De Comercio - Cafeteria,"Pueyrredon  747, Centro, Rosario, ...",US$9.500,Cafetería
Fondo De Comercio Dietética En Zona Las Cañitas!!!,"Gorostiaga 1607, Belgrano, Capital...",US$14.000,Dietética
Fondo De Comercio Ferreteria Permuto Escucho Ofertas,"Fortunato De La Plaza 3433, Punta ...",US$35.000,Ferretería
Venta Dietetica Fondo De Comercio Palermo Soho!!,"Serrano 1321, Buenos Aires, Argent...",US$95.000,Dietética
Vendo Fondo De Comercio,"Hornos 902, Libertad, Merlo, Bs.as...",$15.000.000,Otros
Venta De Fondo De Comercio Bazar Y Deco,"Av. Gral. Mosconi, Ciudad Autónoma...",US$22.500,Otros
"Fondo De Comercio Fiambreria - San Bernardo, Costa Atlantica","Chiozza 3073, San Bernardo, Bs.as....",US$30.000,Fiambrería
Parada De Diarios Y Revistas,"Garay Y Jujuy Sn, Balvanera, Capit...",US$1.500,Otros
Fondo De Comercio En Venta Rubro Panadería,"Boulevard Roca Sn, Río Cuarto, Cór...",US$60,Panadería
Fondo De Comercio De Panaderia,"Sarmiento 214, Tandil, Buenos Aire...",US$70.000,Panadería
Fondo De Comercio Palermo Hollywood,"Fitz Roy Sn, Palermo Hollywood, Ca...",$16.000,Otros
Fondo De Comercio Computacion Y Accsesorios De Telefonia,"Leo, Guillermo Marconi 3751, Isidr...",US$5.500,Otros
Salon De Belleza. Fondo De Comercio.,"Moreno 354, Monserrat, Capital Fed...",US$27.000,Salón de belleza
Oportunidad Única: Fondo De Comercio De Heladería En Ubicación Estratégica,"Av. Congreso 3900 - 4200, Bac, Ciu...",US$12.500,Heladería
Vendo Fondo De Comercio De Ropa De Mujer. Villa Del Parque,"Cuenca 3300 Sn, Villa Del Parque, ...",US$15.000,Indumentaria
Fondo De Comercio Hamburguesería Artesanal Cadena Franquicia,"Av Independencia  3600, Boedo, Cap...",US$45.000,Hamburguesería
Fondo De Comercio Local De Ropa,"Juan Manuel De Rosas  841, Lomas D...",$14.000,Indumentaria
Vendo Fondo De Comercio En Villa Gesell - Centro (peatonal),"Paseo 107 297, Zona Centro, Villa ...",US$10.000,Otros
Fondo De Comercio Ferreteria Sanitarios Y Electricidad,"Tinogasta 5793, Ciudad Autónoma De...",US$25.000,Ferretería
Venta Fondo De Comercio En Zona Oeste A Metros Estación!! Local Funcionando!!! Vendo X Viaje!  Espectacular Oportunidad! Única!!!  70%off!!  Lo Estoy Regalando,"Nicolás Avellaneda  914, Castelar,...",US$27.500,Otros
Venta Fondo Comercio Local Nuevo/2 Años De Vida!,"Alvear 1975, Villa Ballester, Gene...",US$12.500,Otros
Vendo Importante Empresa Gastronomica De Servicio De Elaboracion De Viandas Para Empresas,"Italia 2240, Ciudad De Córdoba, Pr...",US$250.000,Otros
Fondo De Comercio: Kiosco/peluqueria,"Bolivia  748, Villa Martelli, Vice...",US$6.000,Kiosco
Fondo De Comercio Ferreteria,"French 395, Morón, Bs.as. G.b.a. O...",US$60.000,Ferretería
Fondo De Comercio Con Canchas De Futbol,"Anibal Troilo 1679, Quilmes Oeste,...",US$12.000,Cancha de futbol
Fondo De Comercio,"Consultar  Sn, Centro, Pinamar, Bs...",US$30.000,Otros
Heladería Fondo De Comercio,"Avenida Elcano Sn, Colegiales, Cap...",US$40.000,Heladería
Agencia De Lotería De La Provincia Con Anexo Provincianet,"Lavalle Sn, Villa Martelli, Vicent...",US$32.000,Lotería
Fondo De Comercio (venta De Pizza Y Empanadas),"Conrrado Villegas  1763, William C...",US$18.000,Pizzería
Fondo De Comercio Pago Fácil,"Mitre 542, Quilmes, Bs.as. G.b.a. ...",US$17.000,Otros
Fondo De Comercio Granja,"Mitre 4812, Caseros, Bs.as. G.b.a....",US$30.000,Otros
Venta Fondo De Comercio Fábrica De Sillones,"Vicente Espinel 875, Alta Córdoba,...",US$60.000,Fábrica
Excelente Oportunidad!!! Fondo De Comercio Fiambreria,"11 De Septiembre Y Convención  0, ...",US$24.000,Fiambrería
Fondo De Comercio Almacén Kiosco,"El Jaguel  Sn, El Jagüel, Esteban ...",US$15.000,Kiosco
Vendo Fondo De Comercio. Solo Mercaderia.,"9 De Julio 498, Maquinista Savio, ...",US$10.000,Otros
Fondo De Comercio De Gimnasio En Venta En Avellaneda,"Avenida Mitre 1756, Avellaneda, Pr...",$111,Gimnasio
Contenedor Patio Cervecero Funcionando Todo Perfecto !!,"Roque Sáenz Peña 1220, Luján De Cu...",US$15.000,Cervecería
