Titulo,Ubicacion,Precio,Rubro
"Fondo De Comercio De Prendas De Vestir, O Venta Por Lotes","Calle 63 2841, Necochea, Provincia...",US$39.000,Indumentaria
Fondo De Comercio Barberia / Peluqueria,"Gobernador Irigoyen 146, Lanús Oes...",US$9.000,Barbería
Oportunidad Real - Fondo Comercio Estética,"Paunero 1500 - 1800, San Miguel, P...",US$39.000,Salón de belleza
Fondo De Comercio Verduleria Con Dietetica Y Art. Limpieza.,"Corrientes  4985, Villa Crespo, Ca...",US$15.000,Dietética
Peluquería En Venta Por Viaje,"Av Pablo Richieri 3327, Jockey Clu...",US$120.000,Peluquería
Fondo De Comercio Local De Ropa Femenina,"Paunero 1035, Muñiz, Provincia De ...",US$12.000,Indumentaria
Fondo Comercio Salón De Uñas Pestañas Y Cafe De Especialidad,"Colombres  178, Almagro, Capital F...",US$11.000,Cafetería
"Cafetería Restó *oportunidad* Imperdible Fondo De Comercio Gastronómico, Café  Restaurante,","Catamarca & Avenida San Martín, Ca...",US$29.000,Cafetería
"Complejo De 7 Departamentos A Mtrs Del Mar, Muy Buena Renta","Avenida Rio De Janeiro 169, Santa ...",US$500.000,Hotelería
Galpon Deposito Guardamuebles Permuto,Avenida General Eugenio Garzón 600...,US$420.000,Otros
"Vendo Fondo De Comercio, Maxikiosco, Market, Villa Luro","Av Rivadavia 9874, Villa Luro, Cap...",US$12.500,Kiosco
Venta - Fondo De Comercio De Fábrica De Pastas - 50 Años De Trayectoria,"Av. Hipólito Yrigoyen 8752, B1832 ...",US$55.000,Fábrica
"Fondo De Comercio Papelera Mayorista Y Minorista, Limpieza, Higiene Institucional Y Bazar","Quilmes, Provincia De Buenos Aires...",US$40.000,Papelera
Fondo De Comercio Peluquería - Excelente Propuesta Sobre Av Cabildo,"Avenida Cabildo Sn, Núñez, Capital...",US$20.000,Peluquería
Fondo De Comercio Accesorios Y Repuestos Para Motos,"French 2787, Ciudad Autónoma De Bu...",US$37.000,Otros
Venta De Fondo De Comercio Supermercado,"Boulogne Sur Mer 855, Tapiales, La...",$1.000,Supermercado
"Gran Oportunidad, Venta Fondo De Comercio - Freshii","Calle 49 880, La Plata, Provincia ...",US$25.000,Otros
"¡gran Oportunidad! Venta De Fondo De Comercio De Indumentaria, Zapatería Y Accesorios En Neuquén","Julio Argentino Roca 150, Q8300lwb...",US$28.000,Indumentaria
Vendo Fondo De Comercio Pet Shop - Veterinaria - Tienda Mascotas,"Aráoz 2436, Buenos Aires, Argentin...",US$17.990,Pet shop
Panadería,"San Luis 4496, Rosario, Provincia ...",US$5.000,Panadería
Fondo De Comercio Cotillon - Villa Del Parque,"Comuna 11, Cuenca 3490, Ciudad Aut...",US$65.000,Cotillón
Vendo 2 Fondos De Comercio En B Guemes Excelente Ubicacion,"Fruct Rivera 200, Guemes, Córdoba",US$75.000,Otros
Fondo De Comercio Bar Restaurante Pimienta Food & Bar 100% Funcional Y Exitoso,"Avenida Brasil 385, San Telmo, Cab...",US$27.000,Restaurante
"Fondo De Comercio Bazar, Art De Limpieza Y Todo Suelto","Bynnon 3639, José Mármol, Almirant...",US$25.000,Otros
Cabañas Tipo Casa De Campo Para Uso Personal Y/o Para Alquiler Turístico,"Ruta 14 K. 130 Sn, Concepción Del ...",US$350.000,Otros
Liquido Permuto Fondo De Comercio Restaurante Bar,"Olavarria 2699, Güemes, Mar Del Pl...",US$38.000,Restaurante
Balneario Pehuen Co. Chalet 4 Ambientes + Local Comercial.,"Almirante Brown 640, Balneario Peh...",US$110.000,Otros
Ferretería Industrial Fondo De Comercio,"Avenida Crovara 1616, Villa Madero...",US$240.000,Ferretería
"Venta De Fondo De Comercio En Miami, Florida, Usa. Pet Shop Con Venta De Mascotas, Peluqueria Canina Y Venta De Alimentos Y Productos Accesorios Para Mascotas.","Caba, Argentina, Miami, Florida, U...",US$199.000,Peluquería
Venta Fondo De Comercio Hamburguesería,"Larrazabal 3402, Villa Lugano, Cap...",US$28.000,Hamburguesería
Venta Fondo De Comercio. Imperdible Oportunidad!!!!,"Ayacucho 2569, Barrio Parque Gral ...",US$30.000,Otros
Fondo De Comercio Cafeteria,"Xxxxx Sn, Caballito, Capital Feder...",$65,Cafetería
Vendo//permuto Fondo De Comercio Salon De Belleza,"Triunvirato  1553, Don Torcuato Oe...",$18.000,Salón de belleza
Vendo Fondo De Comercio 2 Locales De Venta De Indumentaria!,"Av Avellaneda 1725 Y 3349 3349, Vi...",US$25.000,Indumentaria
Venta De Fondo De Comercio Online - Indumentaria Femenina,"Cnel. Niceto Vega 5312, Buenos Air...",US$15.000,Indumentaria
Fondo Comercio Oportunidad Negocio Dietetica Alimentos Organicos,"Acassuso, Provincia De Buenos Aire...",US$29.500,Dietética
Venta De Empresa De Seguridad Privada En Rosario,"San Luis 760, Arb, Provincia De Sa...",US$150.000,Otros
Panadería,"Alberdi 1151, San Rafael, Mendoza",US$47.000,Panadería
Fondo Comercio Kiosko,"Corrientes  4655, Almagro, Capital...",US$16.000,Kiosco
Liquidooo!! Fondo De Comercio Bar En San Miguel,"Paunero 1134, San Miguel, Bs.as. G...",US$30.000,Otros
Fondo De Comercio Peluquería,"Bernardo De Irigoyen   2650, Boulo...",US$19.000,Peluquería
Fondo Comercio Exelente Fast Food,"Calle 4 2398, San Clemente Del Tuy...",US$75.000,Hamburguesería
Venta Fondo De Comercio Clínica Geriátrica Con/sin Propiedad,"Entre Ríos 2051 2051, San Justo, L...",US$225.000,Geriátrico
"Fondo De Comercio, Colocadora De Caños De Escapes Y Enganches, Macachin","Avenida General Savio 1046, Río Te...",US$120.000,Otros
Fondo De Comercio Salón De Uñas,"Avenida San Martín  608, Bernal, Q...",US$10.000,Otros
Oportunidad Vendo Complejo De  4 Cabañas .retasado. Permuta,"1 Bis  4276, San Clemente, Bs.as. ...",US$190.000,Hotelería
Fondo De Comercio Mercadería E Instalaciones Incluida/oportu,"3 De Febrero 4502, Caseros, Provin...",US$16.500,Otros
Fondo De Comercio Dietética Victoria Presidente Perón,"Avenida Presidente Perón 3412, Vic...",US$27.000,Dietética
Vendo Fondo De Comercio Vivero Boutiques En Recoleta . Funcionando .,"Snchez De Bustamante 1633, Recolet...",US$10.000,Vivero
Inmobiliaria Con Importante Clientela Y Antigüedad - Hay Financiación - Se Toman Valores (venta Fondo De Comercio),"Avenida Nazca 1021, Buenos Aires, ...",US$29.800,Otros
Fondo De Comercio Cervecería Bar Hamburguesería Almagro Excelente Zona Muy Bien Instalado Oportunidad,Teniente General Juan Domingo Peró...,US$40.000,Cervecería
Vendo Fondo De Comercio (o En Propiedad) Mar Del Plata Con 55 Años De Trayectoria Exelente Clientela,"Ayolas 4296, Mar Del Plata, Provin...",US$30.000,Otros
Fondo De Comercio Camping En Costa Atlantica,"Calle 101 Y 14 Sn, Miramar, Bs.as....",US$220.000,Otros
"Vendo Fondo De Comercio De Barberia, Actualmente En Función","Pichincha 27, Balvanera, Capital F...",US$15.000,Barbería
Fondo De Comercio 2 Kioscos,"Carlos Casares  687, Rafael Castil...",US$50.000,Kiosco
Fondo De Comercio De Verdulería En Venta,"Ezeiza  10, Merlo, Bs.as. G.b.a. O...",US$38.000,Verdulería
Fondo De Comercio Minimarket Con Excelentes Ingresos.,"Calle Junin 572, Puerto Norte, Ros...",US$95.000,Supermercado
Fondo De Comercio Consultorio Odontológico,"Panama 1803, Cipolletti, Río Negro",US$40.000,Salud
Fondo De Comercio Maxikiosco,"Avenida Álvarez Jonte 5034, Ciudad...",US$7.000,Kiosco
"Vendo Urgente Por Problema De Salud !!! Hermoso Complejo De 4200m2. Muy Equipado, Exelente Ocupación !!!","Villa Rumipal, Calamuchita, Provin...",US$220.000,Hotelería
Bar Cafeteria Tradicional  Importante Esquina Céntrica De Córdoba  La Esquina,"27 De Abril & Miguel C. Del Corro,...",US$20.000,Cafetería
Dietetica Y Panaderia Saludable,"Perú 162, Acassuso, Provincia De B...",US$75.000,Dietética
Fondo De Comercio Fiambrería Excelente,"General Artigas 4996, Villa Balles...",US$27.000,Fiambrería
Venta De Fondo De Comercio Pet Shop San Isidro,"Alte. Brown 132, San Isidro Centra...",US$18.000,Pet shop
Fondo De Comercio Pizzería - Rotiseria En Paternal,"Jose Gervasio Artigas 1777, Villa ...",US$17.000,Pizzería
Fondo De Comercio!! Indumentaria Para Chicos -  Se Escuchan Ofertas,"Dkv, Catamarca 1762, Mar Del Plata...",$111.111,Indumentaria
Fondo De Comercio - Autoservicio,"Cañada De Gomez 1945, Mataderos, C...",US$19.000,Supermercado
Venta Oportunidad Real Kiosco Esquina Barrio Norte,"Vidt 1900, Ciudad Autónoma De Buen...",US$9.000,Kiosco
Venta Fondo De Comercio En Belgrano- Servicio Tecnico  De Celulares Y Computadoras - Venta De Accesorios,"Av. Cabildo 2230, Buenos Aires, Ar...",US$3.800,Otros
Cafeteria Pastelería Y Restó,"Hipólito Hirigoyen 1100, General P...",US$80,Cafetería
Fondo De Comercio Odontológico Habilitado Por Mns En Caba,"Cuenca Sn, Villa Del Parque, Capit...",US$19.000,Salud
Fondo De Comercio Librería En Villa Del Parque Caba,"Pedro Lozano  3089, Villa Del Parq...",US$25.000,Librería
Fiambreria Premium En City Bell,"Calle 467 933, City Bell, Provinci...",US$35.000,Fiambrería
Fondo De Comercio Empanadas Economicas Frente A Facultad,"A Confirmar  Sn, Balvanera, Capita...",US$30.999,Otros
Venta Fondo De Comercio O Permuto Por Auto 2015 En Adelante,"Av. Eva Perón 6235, Libertad, Merl...",US$10.000,Otros
Venta De Agencia De Lotería Y Pagofacil Muy Buena Recaudación Y Ubicacion Del Comercio,"Av Directorio  2627, Flores, Capit...",US$1,Lotería
Fondo De Comercio Librería Y Centro De Copiado En Recoleta,"Peña 2147, Ciudad Autónoma De Buen...",US$30.000,Librería
Venta Fondo Comercio Restobar Lomas De Zamora,"Carlos Pellegrini 201, Lomas De Za...",US$80.000,Restaurante
Fondo De Comercio Salón De Belleza - Peluquería Con 16 Años De Sólida Trayectoria En El Rubro,"Los Tilos 111, Merlo, Provincia De...",US$8.000,Peluquería
Fondo De Comercio Lavanderia,"Av. Balbin 1886, San Miguel, Bs.as...",US$1,Otros
Fondo De Comercio Bar/local De Bebidas,"Olleros 3213, Colegiales, Capital ...",$8.500.000,Otros
Agencia De Loteria De La Ciudad De Bs. As. Venta Fondo De Comercio Caba,"Quito 3602, Buenos Aires, Argentin...",US$24.000,Lotería
Café De Especialidad,"Campillo 3102, Parque Chas, Capita...",$30.000.000,Cafetería
Fondo De Comercio-.cómida Al Paso,"Tres De Febrero  2583, Caseros, Bs...",US$18.000,Otros
Agencia De Quiniela Y Loteria En Mataderos Usd 25.000,"Guaminí 2600, Buenos Aires, Argent...",US$25.000,Lotería
"Fondo De Comercio Reposteria, Cotillon Y Mucho Mas","Florentino Ameghino 2826, Sáenz Pe...",US$29.000,Cotillón
"Fondo De Comercio Reposteria, Cotillon, Y Mucho Mas","Av. La Plata 3929, Santos Lugares,...",US$34.000,Cotillón
Vendo Complejo De 8  Departamentos/ Renta Asegurada/acepto Permuta En Parte De Pago/ Financiación,"Las Margaritas 763, Las Margaritas...",US$165.000,Hotelería
Vendo Fondo De Comercio Lavadero De Autos,"Uriarte 1261, Remedios De Escalada...",US$30.000,Lavadero de autos
"Fondo De Comercio Pet Shop, Peluquería Canina Mascotas","Cabrera 2934, Recoleta, Capital Fe...",US$11.000,Peluquería
Oportunidad!! Fondo De Comercio Maxikiosco Excelente Ubicación! Ramos Mejía,"Bolívar 364, Ramos Mejía, Provinci...",US$14.900,Kiosco
Farmacia En Sarmiento Chubut,"Calle España 479, Sarmiento, Chubu...",US$115.000,Otros
"Oportunidad Sushi Bar Nuevo Barrio Chino! Local Disponible Gastronomia.,","Echeverría 1677, Buenos Aires, Arg...",US$70.000,Otros
Vendo O Permuto Fábrica De Balanzas Electrónicas Ganaderas X Auto O Camioneta,"Aristóbulo Del Valle 62, General A...",US$25.000,Fábrica
Restaurante Fondo De Comercio,"Mitre Sn, Centro, Bariloche, Río N...",$65,Restaurante
Vendo Agencia De Loteria De La Provincia De Bs.as Y Kiosco,"Av. Vergara 2076, Villa Santos Tes...",US$10.000,Kiosco
Venta Fondo De Comercio - Fabrica De Pastas - Lomas De Zamora,"Balcarce 164, Lomas De Zamora, Pro...",US$68.000,Fábrica
Fondo De Comercio Local De Decoración Y Alfombras En Devoto,"Cuenca 3601, Buenos Aires, Argenti...",US$18.000,Otros
Vende Fondo De Comercio. Trabajando Con Todo El Equipamiento,"Av. Mitre 984, Quilmes, Provincia ...",US$12.000,Otros
Cafetera Bunn Vp-17 Impecable Estado. Poco Uso,"Avenida Hipólito Yrigoyen 565, Gen...",$900.000,Cafetería
"Venta Fondo De Comercio De Hamburgueseria Full Completa, Lista Para Abrir","Gorriti 4788, Ciudad Autónoma De B...",US$60.000,Hamburguesería
Vendo Fondo De Comercio De Materiales Electricos  Iluminacio,"14 De Julio 87, Temperley, Lomas D...",US$89.000,Otros
Verduleria Fondo De Comercio,"Lima 1485, Constitución, Capital F...",$15.000,Verdulería
Fondo De Comercio La Plata - Chipa Panaderia,"Calle 10 & Calle 61, La Plata, Pro...",US$23.100,Panadería
Fondo De Comercio Heladería Con Franquicia,"Av. Andrés Rolón 599, San Isidro, ...",US$15.000,Heladería
Fondo De Comercio Heladeria,"Capitan Juan De San Martin  1474, ...",US$15.000,Heladería
Una Marca De Lencería Diferente Y Consolidada En El Mercado,"Av. Corrientes 3900 - 4200, Ciudad...",US$99.000,Otros
Almacen Quesos Y Fiambres,"Aranguren 4220, Floresta, Capital ...",US$25.000,Fiambrería
Excelente Fondo De Comercio,"Alvear 833, Quilmes, Bs.as. G.b.a....",US$60.000,Otros
Restoran Cafeteria,"Calle 13 4672, Berazategui, Provin...",US$75.000,Cafetería
"Carniceria En Flores, La Mejor De Flores Transfiero!","Culpina 399, Flores, Capital Feder...",US$150,Carnicería
Vendo Fondo De Carnicería En Moreno Pcia B.s A.s,"Diagonal Del Cañón 2542, Moreno, B...",US$50.000,Carnicería
"Venta De Fonde De Comercio, Bar Cafetería Y Restó","Arregui 6187, Versalles, Capital F...",US$52.000,Cafetería
Fondo De Comercio Restaurant Italiano.  Funcionando A Full,"Calle Alsina 148, Avellaneda, Bs.a...",US$80.000,Restaurante
"Gran Oportunidad Restaurante En Caballito, Hermoso Local","Víctor Martínez 42, Ciudad Autónom...",US$195.000,Restaurante
Fondo Comercio La Falda  Parrilla  Lomoteria En Plen,"9 De Julio  247, La Falda, Punilla...",US$18.000,Parrilla
Cerveceria Venta Fondo Comercio Zona Residencial,"Martin Fierro  3290, Parque Leloir...",US$100.000,Cervecería
"Fondo De Comercio Heladeria,  14 Años En La Zona","Zelarrayan  4904, Villa Lugano, Ca...",US$10.000,Heladería
Instalaciones + Mercaderia Libreria Completa Caballito,"Rivadavia 5665, Caballito, Capital...",US$18.900,Librería
Depi4ever - Venta De Fondo De Comercio De Reconocida Marca De Depilacion Definitiva,"Alsina 337, Quilmes, Provincia De ...",$111.111,Salón de belleza
Venta Fondo De Comercio/fiambreria Americana,"Avenida Hipólito Yrigoyen 2192, Fl...",US$1,Fiambrería
Fondo De Comercio Venta De Indumentaria Femenina,"Av. San Martín 1 - 300, Villa Giar...",US$37.000,Indumentaria
Se Vende Gomeria Completa En La Falda - Punilla - Oportunidad Unica,"Av. España 316, La Falda, Provinci...",US$28.000,Gomería
Vendo Fondo De Comercio Ferreteria De Mas De 30 Años De Trayectoria Excelente Caja Comprobable!!,"Rawson 2100 - 2400, Martínez, Prov...",US$45.000,Ferretería
Venta Fondo De Comercio. De Bar /cervecería.,"Martin Lange  4490, Villa Balleste...",US$40.000,Cervecería
"Fondo De Comercio Pelotero, Espacio De Juegos, Impecable Estado, Todo Equipado.","Av. Pueyrredón 672, Ciudad Autónom...",US$40.000,Otros
Agencia De Lotería Quiniela,"Alsina Sn, Balvanera, Capital Fede...",US$15.000,Lotería
Vendo Fondo De Comercio,"Somellera 538, Adrogué, Almirante ...",$111,Otros
Franquicia Fast Food De Pastas 1,"Av Boedo Sn, Boedo, Capital Federal",US$1,Hamburguesería
Fondo De Comercio Ferreteria,"Capitan Fragata Moyano  2553, Adro...",US$85.000,Ferretería
Cafeteria Pasteleria Dulce Salado Take Away,"Nogoyá 3300 - 3600, Ciudad Autónom...",US$12.000,Cafetería
Exelente Resto Bar - Pizzas De 1° Calidad - Tragos Y Otros,"Ejo, Washington 6222, Isidro Casan...",US$40.000,Pizzería
Fondo De Comercio,"Alberti 4692, Terminal Nueva, Mar ...",$65,Otros
Fondo Comercio Gastronomico,"Azcuenaga 783, Barrio Norte, Capit...",US$13.000,Otros
Franquicia Lo De Jacinto,"Bv Illia Sn, Nueva Córdoba, Córdoba",US$30.000,Otros
"Venta De Fondo De Comercio, Cotillon","Av Belgrano  496, Garín, Escobar, ...",US$7.000,Cotillón
Venta Fondo De Comercio Av. Pedro Goyena - Caballito. Despensa Boutique-fiambreria-vineria-quesos Y Fiambres-,"Av. Pedro Goyena 1710, Caballito, ...",US$27.000,Almacén
Vendo Fondo De Comercio Pizzeria Capital Federal   Coghlan,"Av. Dr. Ricardo Balbín 3000, Bueno...",US$35.000,Pizzería
Peluqueria Totalmente Equipada Ubicada En El Barrio De Las Cañitas,"San Benito De Palermo 1660, Ciudad...",US$1,Peluquería
Venta Mercadería E Instalaciones Ferreteria Industrial,"Vergara 2525, Villa Santos Tesei, ...",US$24.999,Ferretería
Propiedad En Traslasierra Tu Emprendimiento Turístico A Solo 10min De Merlo San Luis,"Ruta 14 Km 175 0, La Ramada, San J...",US$70,Otros
Fondo Comercio Ferretería Imperdible,"Obarrio 2194, Libertad, Merlo, Bs....",US$28.000,Ferretería
Fondo De Comercio Parrilla,"Fitz Roy 1612, Palermo Hollywood, ...",US$109.000,Parrilla
Pepper -bar Restaurante,"9 De Julio 165, Chivilcoy, Provinc...",US$30.000,Restaurante
Fondo De Comercio Local Gastronómico,"Av General San Martín 158, Ramos M...",US$20.000,Otros
Fondo De Comercio Fiambreria Sandwicheria Apto Bar,"Av. Cordoba  900, San Nicolás, Cap...",US$10.500,Fiambrería
Vendo Fondo De Comercio Dietetica,"Moctezuma  2817, Beccar, Bs.as. G....",US$55.000,Dietética
Venta De Fiambreria Totalmente Equipada.,"Pedro Ignacio Rivera  499, Lomas D...",$9.000.000,Fiambrería
Fondo De Comercio Churreria Villa Adelina,"Av De Mayo 534, Villa Adelina, San...",US$19.000,Panadería
Vendo Fondo Comercio,"25 De Mayo 261, Temperley, Lomas D...",US$60.000,Otros
Pastelería/cafetería Excelente Ubicación Fondo De Comercio,"Av. Galicia 284, Piñeyro, Avellane...",US$30.000,Cafetería
Importante Estética Y Centro De Pilates,"Loria 477, Lomas De Zamora, Bs.as....",US$20.000,Salón de belleza
Maxikiosco Vendo Urgente!!,"Billinghurst  2000, Palermo, Capit...",US$12.000,Kiosco
Gimnasio Completo Con Máquinas Nuevas Todo Funcionando,"José Ingenieros  300, Otros Barrio...",$111.111,Gimnasio
Fondo De Comercio Kiosco,"Abelino Rolon  201, Boulogne Sur M...",US$14.500,Kiosco
Vendo Fondo De Comercio  ( Con Opc Compra De Propiedad ),"Avenida Libertador San Martin 338,...",US$30.000,Otros
Taller Mecánico Totalmente Equipado Y En Funcionamiento,"Zeballos 300, Moreno, Bs.as. G.b.a...",US$70.000,Otros
"Almacén, Fiambrería, Excelente Ubicación","Colon 1847, Centro, Mar Del Plata,...",$18.000,Fiambrería
Fondo De Comercio Lavadero De Ropa,"Miralla 22, Villa Luro, Capital Fe...",US$50.000,Indumentaria
Imprenta / Librería Con 35 Años De Trayectoria Vende Su Fondo De Comercio - Caba - Balvanera / Congreso,"Rincón 27, Ciudad Autónoma De Buen...",US$50.000,Librería
Fondo Comercio.. Pastelería Panadería Sandwicheri,"Avenida San Martin 1373, Zona Cent...",$50.000,Panadería
Vendo Delivery De Bebidas (la Previa) En Ciudad De Rosario. Escucho Oferta Razonable,"Bqb, Zeballos 1348, Rosario, Provi...",US$40.000,Otros
"Agencia De Lotería, Sube Y Kiosco Lanus Oeste","Av. Hipolito Yrigoyen 3110, Lanús ...",US$25.000,Kiosco
Vendo  Fondo De Comercio De Carnicería,"Mitre 2781, Sarandí, Avellaneda, B...",US$19.900,Carnicería
Fondo De Comercio Telefonía Celular - La Costa,"Calle 31 N 393, Santa Teresita, Pr...",US$12.000,Otros
Fondo D Comercio. Funcionando.,"Cristóbal Colon  885, Monte Grande...",US$20.000,Otros
Venta Fondo De Comercio Estética Merlo Centro,"Riobamba 600 - 900, Merlo, Provinc...",US$6.000,Salón de belleza
"Venta De Fondo De Comercio Para Dietética, Tienda De Suplementos, Café, Kiosko","Scalabrini Sn, Palermo, Capital Fe...",US$18.000,Cafetería
Venta Fondo De Comercio  Fábrica Paneles Sip (galpón Propio En Alquiler Incluido En El Precio),Avenida Presidente Perón 1200 - 15...,US$56.000,Fábrica
Fondo De Comercio Heladeria,"Chilavert  1618, Villa Celina, La ...",$10.000.000,Heladería
"Ferreteria En Plena Zona Del Rubro, Mas De 50 Años De Presencia.","Rivadavia 328, Córdoba, Provincia ...",US$25.000,Ferretería
Agencia De Loteria Y Kiosco  Excel Recaudacion En Ascenso,"Av Cruz 1062, Boedo, Capital Feder...",US$12.000,Kiosco
Heladería Fondo De Comercio,"Marcelo T. De Alvear 834, Don Torc...",US$50.000,Heladería
Almacen De Bebidas Y Varios En Pleno Centro De Villa Del Parque,"Tinogasta, Ciudad Autónoma De Buen...",US$9.200,Otros
Vendo Fondo De Comercio,"Mitre 555, Quilmes, Bs.as. G.b.a. ...",US$18.000,Otros
Fondo De Comercio,"Calle 13 A 261, City Bell, La Plat...",US$25.000,Otros
Fondo De Comercio Despensa Polirubro Valle Hermoso.,"Avenida General Paz Ruta38 Sn, Val...",US$22.000,Almacén
Importante Propiedad En Esquina Con Fondo De Comercio De Fábrica Y Atención Al Público De Helados-panaderia-pasteleria-rotiseria-churreria En 2 Locales Independientes,"Av. Gaona 4500 - 4800, Ciudad Autó...",US$800.000,Panadería
Fondo De Comercio Franquicia Tropea Escucho Ofertas,"Scalabrini Ortiz 461, Villa Crespo...",US$30.000,Otros
Departamentos A Entregar En Diciembre De 2024,"Paso De Los Andes 308, Colón, Entr...",US$70.000,Otros
Fondo De Comercio,"Campos Salles Sn, Núñez, Capital F...",US$15.000,Otros
"Fondo De Comercio Juguetería Didáctica, Oportunidad De Inversión","Onelli 300 - 600, San Carlos De Ba...",US$15.000,Otros
Agencia De Lotería,"Máximo Paz 1104, Lanús, Provincia ...",US$50.000,Lotería
Cotillón Y Repostería Trabajando En San Rafael,"Almafuerte 140, San Rafael, Provin...",US$160,Cotillón
Venta Fondo De Comercio Restaurante,"Muñiz, San Miguel, Provincia De Bu...",US$65.000,Restaurante
Venta De Fondo De Comercio Supermercado,"Alvear 4433, Villa Bonich, Billing...",US$12.345,Supermercado
Vendo Agencia De Loteria  Con Local,"Bouchard, Caseros, Provincia De Bu...",US$39.000,Lotería
Vendo Agencia De Loteria Y Quiniela,"Los Olivos, Pablo Nogués, Provinci...",US$25.000,Lotería
Fondo Comercio Gastronómico En Mar Azul Excelente Ubicación,33 Entre Mar Del Plata Y Punta Del...,US$15.000,Otros
Agencia De Lotería (permiso De Explotación),"Calle 2 7198, Mar Del Tuyú, Provin...",US$10.000,Lotería
Oportunidad Venta De Fondo De Comercio Gastronómico Caba,"Av Francisco Beiro  5757, Villa De...",US$60.000,Otros
Fondo De Comercio - Local Indumentaria - San Martín De Los Andes Zona Centro,"Sarmiento  869, Zona Centro, San M...",US$18.000,Indumentaria
Fondo De Comercio - Local Indumentaria - San Martín De Los Andes Zona Centro,"Sarmiento  869, Zona Centro, San M...",US$18.000,Indumentaria
Venta Fondo De Comercio Restaurante/ Cervecería,"Av Bustillo 7584, Pinar De Festa, ...",US$50.000,Cervecería
Fondo De Comercio,"Tomas Thomas  75, San Martín, Mend...",US$40.000,Otros
Resto Bar Desde 1968,"Colón  498, Centro, Córdoba",US$90.000,Restaurante
Fondo De Comercio Fiambrería Sandwicheria Apto Bar,"Avenida Córdoba  908, San Nicolás,...",US$10.500,Fiambrería
"Gran Oportunidad, Venta De Fondo De Comercio","General San Martín 1600, Área Cent...",US$20.000,Otros
Fondo De Comercio,"Gral Teniente Peron 1615, Congreso...",US$8.000,Otros
Panaderia Sandwicheria Centrica,"Lavalle 505, Retiro, Capital Feder...",US$15.000,Panadería
Se Vende Fondo De Comercio Maxikiosco Benyi,"Av 21 4145, Berazategui Oeste, Ber...",US$18.000,Kiosco
Vendo Fondo De Comercio Los Hornos,"136 1648, Los Hornos, La Plata, Bs...",US$5.000,Otros
Fondo De Comercio,"Cochabamba 612 600, Banfield, Loma...",$19.000,Otros
Fondo De Comercio Fiambreria,"San Martín  Sn, Alejandro Korn, Sa...",US$28.000,Fiambrería
Fondo De Comercio - Container En Predio Gastronómico,"Avenida Rivadavia 2355, Rosario, P...",US$15.000,Otros
Sala De Ensayo - Venta De Fondo De Comercio - San Francisco Solano,"M. A. Pascual 2100 - 2400, San Fra...",$1.500.000,Otros
Fondo De Comercio,"Cochrane  2509, Villa Pueyrredón, ...",US$15.000,Otros
Vendo Fondo De Comercio,"Av.ramon Falcon 1745, Francisco Ál...",$10.000.000,Otros
Estetica Fondo De Comercio,"Calle 12 Sn, Berazategui, Bs.as. G...",US$10.000,Salón de belleza
Vendo Fondo De Comercio,"Pres Peron  1622, San Miguel, Bs.a...",$2.000.000,Otros
Vendo Fondo Comercio En Importante Shoping De Caba,"Condarco 1691, Saavedra, Capital F...",$28.000,Otros
Fondo De Comercio,"San Juan 735, Otros Barrios, Mendo...",US$50.000,Otros
Farmacia,"Roca Sn, Esquel, Futaleufú, Chubut",US$60.000,Otros
Venta Agencia De Lotería Y Quiniela.,"Villa Ballester Sn, Villa Balleste...",US$18.000,Lotería
Agencia De Lotería De La Provincia En Hurlingham,"Avenida Gobernador Vergara 4890, H...",US$30.000,Lotería
Dietética Ubicada En Zona Céntrica De Morón,"Morón, Provincia De Buenos Aires, ...",US$27.000,Dietética
Fondo De Comercio,"Santos Vega 6589, Villa Bosch, Tre...",US$3.000,Otros
Lavarropas Automático Samsung 6.5 Kg Saww65m0nhuu 1000 Rpm C,"Guatemala 150, Francisco Álvarez, ...",$700.000,Indumentaria
Vendo Permuto Empresa De Transporte,"Inclán 4200 - 4500, Ciudad Autónom...",US$1.111,Otros
Fondo De Comercio Agencia De Loteria Y Rapipago. Lanus Oeste,"Coronel Rosales 2056, Lanús Oeste,...",US$15.000,Lotería
Fondo De Comercio,"Itaqui 6510, Villa Riachuelo, Capi...",US$16.000,Otros
Venta De Chapa O Agencia De Loteria,"Lavalle 105, Avellaneda, Bs.as. G....",$20.000,Lotería
Fondo De Comercio,"Boedo 609, Boedo, Capital Federal",US$8.000,Otros
Marca De Accesorios,"Palermo Chico, Ciudad Autónoma De ...",US$1.200,Otros
"Vendo Pesa,nueva Sin Uso","San Carlos  1652, Rafael Calzada, ...",$100,Otros
Vendo Fondo De Comercio Librería Papelería,"Lamadrid Y Cobos 1138, Guaymallén,...",$11.000.000,Librería
Importante Metalúrgica Fabrica De Implementos Agrícolas. 40 Años De Trayectoria.,"Departamento San Jerónimo, Provinc...",US$1.650.000,Fábrica
Fondo De Comercio Proveedor De Materiales Generales Para La Industria Y La Construccion. Local A La Calle En Caba,"Avenida Gaona 2911, Ciudad Autónom...",US$49.000,Otros
Equipo De Música Muteki 6.2 Canales,"Geronimo Elguera  1707, Barrio Sur...",$1.055.000,Otros
Venta De Fondo De Comercio Farmacia,"Sarmiento 270, Nono, Córdoba, Arge...",US$55.000,Otros
Fondo De Comercio Heladeria Y Cafeteria,"Constitucion 1300, San Fernando, B...",US$15.000,Cafetería
Kiosco Y Agencia De Quiniela,"Villa Elvira, La Plata, Provincia ...",US$18.000,Kiosco
Fondo De Comercio Farmacia,"Almirante Brown, Provincia De Buen...",US$111.111,Otros
Se Vende Fondo De Comercio,"Córdoba 91, La Carlota, Córdoba",US$38.000,Otros
Fondo De Comercio Bemba Bar-cerveceria & Estación De Recarga,"Intendente Ballester 3301, Villa S...",US$16.000,Cervecería
