Titulo,Ubicacion,Precio,Rubro
Venta De Fondo De Comercio (escucho Ofertas)el Número Public,"Mendoza Sn, Belén De Escobar, Esco...",US$12.000,Otros
Venta De Fábrica De Rotomoldeo,"Hipolito Yrigoyen 2328, Venado Tue...",$1.111.111,Fábrica
Fondo De Comercio,"Cabo Chioffi Y Edison Sn, Sarandí,...",US$7.000,Otros
Fondo De Conercio - Carniceria - Solo Maquinas,"Lisandro De La Torre 207, Quilmes ...",US$5.000,Carnicería
Fondo De Comercio,"San Martin  237, Ciudadela, Tres D...",$2.000.000,Otros
Fondo De Comercio,"Honorio Pueyrredon  1414, Caballit...",US$25.000,Otros
Fondo De Comercio Gastronomía.,"Pte. Peron 1100, San Vicente, Buen...",US$22.000,Otros
Fondo De Comercio (gastronomía),"Ciudad De La Paz  2065, Belgrano, ...",US$90.000,Otros
Venta De Fondo De Comercio,"Av. Del Libertador 3817, La Lucila...",$5.000,Otros
Fondo De Comercio Fiambreria,"Moreno  1800, Villa Ballester, Gen...",US$35.000,Fiambrería
Se Vende Fondo De Comercio Peluquería En Nva Córdoba,"Angelo De Peredo 20, Nueva Córdoba...",US$6.000,Peluquería
Carrito De Comidas,"San Martin  Sn, Roldán, Santa Fe",US$5.800,Otros
"Venta De Fondo De Comercio . Estética En Caballito , Con Clientes Demostrados","Coronel Ramon Falcon 1679, Caballi...",US$18.000,Salón de belleza
Oferta Oportunidad Fondo D Comercio Guemes Barrio Los Troncos 20 Años D Experiencia,"Güemes 3300 - 3600, Mar Del Plata,...",US$12.000,Otros
Peluquería Unisex,"Coronel Burelas  3249, Lanús Este,...",US$15.000,Peluquería
Fondo De Comercio,"Alberdi 30, Centro Cívico, San Fra...",US$35.000,Otros
Kiosco-polirrubro Zona Guemes,"Alberti 1254, Güemes, Mar Del Plat...",US$0,Kiosco
Oportunidad .vendo/perm.  Fondo Come,"3 Y 105 Sn, Zona Centro, Villa Ges...",US$38.000,Otros
Venta Fondo De Comercio Indumentaria Hombre Y Mujer,"San Nicolás 1188, Rosario, Provinc...",US$16.000,Indumentaria
"Fondo De Comercio,villa La Angostura,café Bar","Av Arrayanes  21, Villa La Angostu...",$65.000,Cafetería
Vendo Fondo De Estetica Y Nutrición. Nuñez .,"Vuelta De Obligado Sn, Núñez, Capi...",US$15.000,Salón de belleza
Fondo De Comercio Confitería En Palermo,"Av. Córdoba 4451, Ciudad Autónoma ...",US$70.000,Panadería
Maxikiosco En Recoleta,"Ayacucho 1583, Recoleta, Capital F...",US$20.000,Kiosco
Fábrica De Pastas En Venta,"Av. Independencia 4315, Caballito,...",US$140.000,Fábrica
Puesto De Diarios,"25 De Mayo  657, Belén De Escobar,...",$900.000,Otros
Vendo Fondo De Comercio Locutorio Maxikiosco Y Cyber,"Juan Bautista Alberdi 6598, Matade...",US$7.500,Kiosco
Fondo De Comercio Lavadero De Autos. San Justo,Presidente Perón 2901 Y Salta 2901...,US$45.000,Lavadero de autos
Parada De Diarios Y Revistas En Estación Subte  A,"Av. Rivadavia 2400, Once, Capital ...",$1.521.300,Otros
Fondo De Comercio Petshop Y Peluquería,"El Salvador 4506, Palermo Soho, Ca...",US$18.000,Peluquería
Venta Fondo De Comercio En Centro De San Martin Local De Pilas Y Baterias,"Yapeyú 2028, San Martín, Provincia...",US$100.000,Otros
Permuto Omplejo De 6 Departamentos  En Merlo San Luis Por Motorhome Y Vehiculos,"Av. De La Juventud 500, Merlo, San...",US$170.000,Otros
Fondo De Comercio Carnicería Y Pollería En Haedo,"Jeronimo Fasola 702, Haedo, Morón,...",US$10.000,Carnicería
Pañalera Venta Fonde De Comericio - Excelente Rentabilidad - Excelente Ubicacion,"Avenida San Martín 4748, Rosario, ...",US$39.000,Otros
Fondo De Comercio,"Bulnes  6, Almagro, Capital Federal",US$6.500,Otros
Se Busca Socio Para Local De Comida Rápida En Palermo Soho,"Paraguay 4597, Palermo Soho, Capit...",US$22.000,Otros
Bar Sammy,"Av Francisco Beiro  5750, Villa Re...",$111.111.111,Otros
Fondo De Comercio Veterinaria (parque Patricios),"Av. Jujuy  2180, Parque Patricios,...",US$25.000,Veterinaria
Venta Franquicia Estética Spa De Manos Y Pies,"Rosario 125, Caballito, Capital Fe...",US$40.000,Salón de belleza
Excelente Fondo De Comercio Se Vende!!,"2 De Mayo 4266, Lanús Este, Lanús,...",$18.000,Otros
Maquinaria Cafetería Heladera Exhibidora,"Meeks Sn, Lomas De Zamora, Bs.as. ...",$3.500.000,Cafetería
Oportunidad Única Para Emprendedores!! @_tanbrocoli  Gesell,"Av 3 881, Zona Centro, Villa Gesel...",US$13.500,Otros
Fondo De Comercio Vinoteca Bodegon De Bebidas,"Viamonte 1708, Recoleta, Capital F...",$15.000,Otros
Fondo De Comercio Bicicleteria,"Ruta 58 Sn, Canning, Ezeiza, Bs.as...",US$130.000,Bicicletería
Fondo De Comercio Quilmes Centro,"Rivadavia  418, Quilmes, Bs.as. G....",US$28.000,Otros
Venta Agencia De Lotería A Trasladar,"Av. Independencia 621, Mar Del Pla...",US$9.000,Lotería
Venta Fondo De Comercio. Urgente!!! Precio Súper Rebajado,"Madariaga  400, Luis Guillón, Este...",US$15.000,Otros
Importante Fondo De Comercio (venta Por Mudanza),"Av. Libertad 236, Villa Carlos Paz...",US$110.000,Otros
"Minimercado, Carnicería, Verdulería Y Almacen","Ruta Provincial 28 & Austria, Tant...",$666,Carnicería
Vendo Fondo De Comercio,"Calle 413  1245, Juan María Gutiér...",US$15.000,Otros
Fondo De Comercio Merceria,"Lope De Vega 1636, Monte Castro, C...",US$45.000,Otros
Vendo Fondo De Comercio,"Elordi 444, Zona Centro, San Marti...",$15.000,Otros
Fondo De Comercio Ropa Mujer,"Cuenca 2800, Villa Del Parque, Cap...",US$15.000,Indumentaria
Fondo De Comercio Pescaderia Y Marisqueria,"131 5169, Barrio Marítimo, Berazat...",US$18.000,Otros
Ferreteria En Venta,"Rosario, Santa Fe, Argentina, Azcu...",US$24.000,Ferretería
Fondo De Comercio Barberia,"Lavallol 2732, Villa Del Parque, C...",$4.500.000,Barbería
Vendo Fondo De Comercio  Casita De Fiestas  Punta Alta,"Luiggi 430, Punta Alta, Coronel Ro...",$15.000.000,Eventos
Gran Oportunidad Fondo De Comercio Gastronómico,"Av Larrazabal  1254, Mataderos, Ca...",$45.000,Otros
Fondo De Comercio En Ramos,"Belgrano  69, Ramos Mejía, La Mata...",$7.500,Otros
Fondo De Comercio Salón Masculino,"Avenida Independencia 2811, Ciudad...",US$4.000,Otros
Fondo De Comercio Dietetica Y Panaderia Saludable,"Perú 162, Acassuso, Provincia De B...",US$75.000,Dietética
Gimnasio Fondo De Comercio,"Lima 1000, Luis Agote, Rosario, Sa...",US$35.000,Gimnasio
Vendo Fondo De Comercio Rotisería Muy Buena Ubicación.,"C. 3 170, Santa Teresita, Provinci...",US$15.000,Otros
Fondo De Comercio. Local De Indumentaria,"Mariano Moreno 6212, Wilde, Provin...",US$8.000,Indumentaria
Fondo De Comercio Espacio Cultural Shows En Vivo,Avenida Mariano Acosta & Avenida R...,US$40.000,Otros
Fondo De Comercio Cotillón Y Repostería,"Blanco Encalada 5073, Villa Urquiz...",US$50.000,Cotillón
"Restaurante De Diseño. 1 Año De Uso, Totalmente Equipado En Centro De Ituzaingó","General Mansilla 757, Ituzaingó, P...",US$100.000,Restaurante
"Fondo De Comercio . Salón De Eventos, Bar, Recitales, Parque, Multiuso.","Av. Del Arroyo 2, B7609 Santa Clar...",US$120.000,Otros
"Vendo Negocio Poli Rubro (calzado, Ropa, Telas, Etc.) Con 18 Años De Antigüedad Por No Poder Atender","Avenida Marcelo T. De Alvear, Río ...",US$50.000,Indumentaria
Agroveterinaria,"Avenida San Martín 2086, El Bolsón...",US$80.000,Veterinaria
"Transfiero Fondo Comercio, Tienda Saludable, Referente Zona.  Consultar Precio. Oportunidad. Negocio. Dietética","Remedios De Escalada, Provincia De...",US$10.500,Dietética
Vendo Panadería,"H Sn, Hostería San Antonio, Luján,...",US$47.000,Panadería
Fondo De Comercio Cancha Futbol,"Maestro Ferreyra Sn, San Miguel, B...",US$20.000,Cancha de futbol
Oportunidad! Kiosco/almacen Lichu En Venta!,"Av. Ramón J. Cárcano 624, Villa Ca...",US$14.000,Kiosco
Fondo De Comercio - Dietética - Escucho Ofertas!!!,"Bv. Illia Sn, Nueva Córdoba, Córdo...",US$5.000,Dietética
Restaurante En Malaga España,"Plaza Almirante Brown, Pl. Almte B...",US$60.000,Restaurante
Fondo De Comercio Consultorio Odontologico,"Centenario Uruguayo Sn, Lanús Este...",US$30.000,Salud
Kiosco De Diarios Y Revistas,"Alma Fuerte  1300, Campos De Alvar...",US$40.000,Kiosco
Cafeteria Al Paso Frente A La Universidad De Palermo,"Mario Bravo 1009, C1175 Buenos Air...",US$19.000,Cafetería
Vendo Fondo De Comercio Y Franquicia De Seitu,"Ramon Santamarina 1030, Monte Gran...",$17.000.000,Otros
Vendo Fondo De Comercio Franquicia De Pizza Y Empanadas,"Av De La Union  2456, Pontevedra, ...",US$20.000,Pizzería
Fondo De Comercio Heladería Sei Tu,"Bv. Buenos Aires  1098, Luis Guill...",US$25.000,Heladería
Vendo Agencia De Quiniela Y Lotería Oficial.,"San Martin 760, Apart Club San Ped...",US$55.000,Lotería
Vendo Fondo De Comercio Cafetería Y Panadería.,"La Pampa Y Av. Constituyentes 3, G...",US$16.000,Cafetería
"Fondo De Comercio Lubricentro, Funcionando !!","Av. Rivadavia 541, Villa Parque Sa...",$30.000.000,Otros
Agencia De Lotería Oficial - Berazategui - Zona Sur,"Calle 31 A 4391, Villa España, Pro...",US$65.000,Lotería
Fondo De Comercio Lubricentro Más De 30 Años De Antigüedad,"Av. Pres. Hipólito Yrigoyen

 2837...",US$25.000,Otros
Gimnasio Completo,"Calle 49 643, La Plata, Bs.as. G.b...",US$45.000,Gimnasio
Fondo De Comercio Estacionamiento Garage Vendo Urgenteeee,"Julio A Roca 553, Olivos, Vicente ...",US$10.000,Otros
Maquinas De Cerrajería Y Mercadería Lote,"39 1512, La Plata, Bs.as. G.b.a. S...",US$9.000,Otros
Fondo De Comercio. Restaurante. San Isidro,"Blanco Encalada 88, La Loma, San I...",US$40.000,Restaurante
Fondo De Comercio Urgente Por Viaje,"Av La Plata  2026, Quilmes Oeste, ...",US$20.000,Otros
Venta De Fondo De Comercio  Ferreteria Con Mercaderia Incluida Bien Surtida.,"Primera Junta 852, San Isidro, Pro...",US$135.000,Ferretería
Venta Fondo De Comercio Empanadas Y Pizzas,"Avda.cordoba 3862, Almagro, Capita...",US$27.000,Pizzería
Vendo Fondo De Comercio De Un Local De Indumentaria Femenina,"Vte López 296, Monte Grande, Esteb...",US$25.000,Indumentaria
Laboratorio Suplementos Dietarios Habilitado Fdo. Comercio,Redios De Escala De San Martin  Sn...,$400.000,Otros
Fondo De Comercio Franquicia Kawirth,"Doblas Sn, Caballito, Capital Fede...",US$15.000,Otros
Fondo De Comercio Carnicería,"Camarones 3442, Santa Rita, Capita...",US$1,Carnicería
Dónde De Comercio -pilleria-granja,"Musso -, General Rodríguez, Buenos...",$6.000.000,Otros
Venta Fondo Comercio Vivero Productor,"Venezuela 2998, Ituzaingó Norte, I...",US$20.000,Vivero
Carniceria Fondo De Comercio.,"Camarones 4308, Floresta, Capital ...",US$20.000,Carnicería
Vendo Fondo De Comercio ..vinoteca Con 20 Años De Antiguedad,"Av. Pueyrredón 1678, Ciudad De Cór...",$20.000.000,Otros
Fondo De Comercio Barberia Peluqueria,"Suipacha 766, San Nicolás, Capital...",US$6.000,Barbería
Pantografo Laser Cortadora 600x900,"San Blas  Sn, Monte Castro, Capita...",US$4.000,Otros
Fondo De Comercio- Kiosco Excelente Ubicación.,"Gral. Paz 101, X5022 Córdoba, Arge...",US$11.000,Kiosco
Fondo De Comercio Franquicia Tropea Escucho Ofertas,"Scalabrini Ortiz 461, Villa Crespo...",US$30.000,Otros
Tintoreria Totalmente Equipada. Gran Oportunidad De Inversion. Muy Buena Ubicación,"Julián Álvarez 439, Buenos Aires, ...",US$15.000,Otros
Ferreteria Fondo De Comercio,"N 12, 9 De Abril, Esteban Echeverr...",US$90.000,Ferretería
Fondo De Comercio // Fast Food Venezolana // Ramos Mejia,"Abg, Av. Gral. San Martín 1951, Ra...",$200,Hamburguesería
"Se Vende Marca Registrada, Clase 39, Mixta: Expreso Rutas Argentinas","San Martín 1475, Luis Guillon, Pro...",US$38.000,Otros
Venta Fondo De Comercio,"Castro Barros  25, Almagro, Capita...",$100,Otros
Fondo De Comercio Centro De Estética,"Av San Juan 4124, Boedo, Capital F...",US$12.000,Salón de belleza
Importante Pinturería Zona Sur S/avenida C/estacionam Propio,"Andrés Baranda, Quilmes, Provincia...",US$45.000,Otros
Vendo Fondo De Comercio,"Av San Juan 2858, San Cristóbal, C...",US$22.000,Otros
Local Gastronomico,"Barrio Marítimo, Guillermo Enrique...",$1.111,Otros
Venta Ferreteria Con Clientes Fijos,"Luis De Góngora 300 - 600, Bgj, Pr...",US$25.000,Ferretería
Vendo 3 Sitios Web Funcionando Desde Hace 5 Años Con Facturación,"Buenos Aires, Caba, Argentina, Pal...",US$4.000,Otros
Local Habilitado Para Dietetica Y Herboresteria,"Avs, Caseros 3069, B1636 Olivos, P...",US$20.000,Dietética
Fondo De Comercio Para Trasladar,"Caseros 53, Centro, Villa Carlos P...",US$9.000,Otros
Piano Antiguo En Muy Buen Estado,"Condarco 5835, Quilmes Oeste, Quil...",$800.000,Otros
Vendo Ferreteria En Las Sierras De Cordoba Oportunidad Para Cambio De Vida!!! 23 Años En El Rubro Gran Variedad De Mercaderia!! Ingresos Comprobables!!,"Av. Guido, Av. Costanera Guido San...",US$150.000,Ferretería
Venta De Fondo De Comercio De Indumentaria,"Pareja 2700, Villa Pueyrredón, Cap...",US$18.000,Indumentaria
Vendo Fondo De Comercio Colchoneria Y Afines,"Av. Hipólito Yrigoyen 931, Gran Bu...",$34.990,Otros
Fondo De Comercio Tienda Saludable,"Acevedo Sn, “caisamar”, Mar Del Pl...",US$35.000,Otros
Pizzería Luigy,"Carlos Gardel 102, Lanús Oeste, La...",US$40.000,Pizzería
Fondo De Comercio Fiambrería Y Productos De Almacén,"Sarmiento 2555, El Bolsón, El Bols...",$1.111,Fiambrería
Fondo De Comercio Local De Indumentaria General Las Heras,"Las Heras 888, General Las Heras, ...",US$68.000,Indumentaria
Fondo De Comercio,"State Road Sn, Miami, Florida, Usa",US$660.000,Otros
Local De Indumentaria,"San Martin 1146, Acceso Sur, Cosqu...",US$15.000,Indumentaria
Fondo De Comercio Lavadero Autos,"Av. Balbin 927, San Miguel, Bs.as....",US$20.000,Lavadero de autos
Fondo De Comercio  Lavadero De Ropa,"Emilio Castro 5104, Mataderos, Cap...",US$5.000,Indumentaria
Se Vende Fondo De Comercio De Café Bar Frente A La Universidad De Quilmes,"Rodolfo Walsh Plazoleta, Roque Sáe...",US$12.000,Cafetería
Fondo De Comercio Pet Shop Caballito,"Ampere 838, Ciudad Autónoma De Bue...",US$6.900,Pet shop
Agencia De Loteria,"Avenida Saenz 84, Parque Patricios...",US$12.000,Lotería
Fondo De Comercio Heladeria,"Av. Olazábal 5397, Buenos Aires, A...",US$20.000,Heladería
Agencia De Loteria De La Provincia De Bs.as,"Pueyrredón 2457, Villa Ballester, ...",US$47.000,Lotería
Bar Al Paso Y Kiosco,"Alvear 622, Quilmes, Provincia De ...",US$16.000,Kiosco
Venta De Fondo De Comercio Salón De Fiestas Y Eventos,"44 472 1/2, La Plata, Bs.as. G.b.a...",US$35.000,Eventos
Importante Fondo De Comercio Heladería Y Cafetería 230 M2 - A Dos Cuadras Del Congreso De La Nación,"Avenida Rivadavia 2030, Buenos Air...",US$40.000,Cafetería
"Fondo De Comercio Peluqueria , Barberia , Salon De Belleza En Predio Supermercado De Facil Acceso",Av. Pres. Arturo Umberto Illia 111...,US$4.000,Barbería
Fondo De Comercio Pizzeria Olivos,"Ramon B Castro 1517, Olivos, Vicen...",US$30.000,Pizzería
Fondo De Comercio,"Boccuzzi  51, Florencio Varela, Bs...",$5.900.000,Otros
Gran Oportunidad!!fondo De Comercio,"Calle 11 893, La Plata, Bs.as. G.b...",US$8.000,Otros
Fondo De Comercio,"Cordoba  975, Centro, Rosario, San...",US$18.000,Otros
Fondo De Comercio Fabrica De Indumentaria Femenina,"Cardeza 189, Monte Grande, Esteban...",US$9.500,Fábrica
Casa De Comidas - Rotiseria,"Garibaldi 286, Quilmes, Bs.as. G.b...",US$20.000,Otros
Vendó Fondo De Comercio..,"Av.edison 1180, Puerto, Mar Del Pl...",US$9.300,Otros
Fondo De Comercio Lenceria En Venta,"Calle Mitre 415, Centro, Bariloche...",US$200.000,Otros
Vendo Fondo De Comercio - Optica,"Coronel Mercau  550, Merlo, Junín,...",US$27.000,Otros
"Parada De Diarios En Florida, Vicente López, Bs. As.","Warnes 1504, Florida, Vicente Lópe...",US$10.000,Otros
Se Vende Fondo De Comercio Dietética En A Zona Quilmes Oeste,"Triunvirato  3396, Quilmes Oeste, ...",$11.111,Dietética
Vendo Fondo De Comercio En San Fco Del Monte De Oro San Luis,"Sarmiento  Sn, San Francisco Del M...",US$27.000,Otros
"Venta De Fondo De Comercio Ferreteria, Sanitario, Electricidad Y Mat. De Construccion - Zona Villa Devoto","Avenida San Martín 6000 - 6300, Vi...",US$70.000,Ferretería
Ferreteria,"Av. Pedro Luro 4864, Mar Del Plata...",$111,Ferretería
Venta Importante Solarium Fondo De Comercio,"Elias Yofre Sn, Jardín Espinosa, C...",US$53.000,Otros
Vendo Exelente Fondo De Comercio,"Juramento 905, Villa Santos Tesei,...",$5.000.000,Otros
Instalaciónes Y Mercadería De Pesca En Capital,"Chile 1832, Congreso, Capital Fede...",US$90.000,Otros
Fondo De Comercio Zona Villa Bosch Indumentaria,"Santos Vega  5879, Villa Bosch, Tr...",$18.000.000,Indumentaria
Vendo Fondo De Comercio Pizzería En Zona Bernal Este,"Lago Alumine  1460, Bernal, Quilme...",US$10,Pizzería
Vendo Fondo De Comercio Maxikiosco,"25 De Mayo 198, Ciudadela, Provinc...",US$10.000,Kiosco
Fondo De Comercio Villa De Mayo Liquido!!,"Presidente Perón (ex Maipu) 398, V...",$7.000,Otros
Fondo De Comercio Remiseria,"Avenida 7 & Calle 511, Ringuelet, ...",US$30.000,Otros
Fondo De Comercio Caballito/parque Chacabuco,"Avenida Asamblea  431, Parque Chac...",$25.000,Otros
Exelente Estado Funcionando Perfecto.,"Esmeralda  711, San Nicolás, Capit...",$400.000,Otros
Fondo De Comercio Vineria,"Moreno 2772, Mar Del Plata, Provin...",US$18.000,Otros
Fondo De Comercio Ropa De Bebés Centro De Lomas Galería Nazm,Galería Nazmi Peatonal Laprida 245...,US$6.000,Indumentaria
Fondo De Comercio Calzados La Liquidadors,"Hipolito Yrigoyen  990, Rufino, Ge...",$111.111.111,Otros
Fondo De Comercio En San Martin De Los Andes !,"San Martín 1358, Zona Centro, San ...",US$25.000,Otros
Fiambreria (fondo De Comercio),"Av. La Plata  3500, Santos Lugares...",$8.000,Fiambrería
Fondo De Comercio En Adrogué,"Martin Rodríguez  Sn, Adrogué, Alm...",US$25.000,Otros
Parada De Diarios. Escucho Oferta,"Pastor La Casa Sn, Tapiales, La Ma...",US$2.500,Otros
"Vendo Licencia/chapa/ Local De Agencia De Loteria De La Ciudad De Bs As, Por Viaje!!.","Recoleta, Buenos Aires, Caba, Arge...",US$5.000,Lotería
Agencia De Loteria,"Av. Diaz Velez Sn, Caballito, Capi...",US$13.000,Lotería
Agencia De Lotería Zona Florida,"Av San Martín  3300, Barrio Parque...",US$25.000,Lotería
Complejo De Fútbol 5,"24 115, La Plata, Bs.as. G.b.a. Sur",US$40.000,Hotelería
"Vendo  Fondo De Comercio, Kiosco, Almacen Fiambreria En Carlos Paz","Aristoteles 93, Carlos Paz Sierras...",US$20.000,Fiambrería
Maxikiosco Escucho Ofertas!  Libreria Fondo De Comercio,"Ing Huergo 3395, Los Polvorines, M...",$1.111,Kiosco
Fondo De Comercio - Bar+restaurant Lomas De Zamora Alem 200,"Alem Sn, Lomas De Zamora, Bs.as. G...",US$100.000,Restaurante
"Kiosco, Rapipago, Fotocopiadora Y Envío De Paqueteria","9 De Julio 100, San Vicente, Bueno...",US$27.000,Kiosco
Chapa Agencia De Loteria Pcia,"Ucrania 3129, Lanús Oeste, Lanús, ...",US$5.000,Lotería
Fondo De Comercio Casa Electricidad,"Avenida Santa Fe 1341, Martínez, S...",US$25.000,Otros
Fondo De Comercio Local Maxikiosco,"Eva Perón 4000, Monte Chingolo, Pr...",US$1,Kiosco
Fondo De Comercio En Venta Restobar En Chacarita Funcionando,"Jorge Newbery 3801, Chacarita, Cap...",US$45.000,Restaurante
Parrilla Al Paso En Estacion Tren San Isidro! Oportunidad!!,"Ccf, Juan Marin 240, San Isidro, P...",US$15.000,Parrilla
Transfiero Licencia Loteria Quiniela Y Juegos Azar Tandil,"9 De Julio 400, Tandil, Provincia ...",US$24.000,Lotería
Fondo De Comercio Fiambrería Almacén,"Avenida Gaona 1474, Buenos Aires, ...",US$50.000,Fiambrería
Fondo De Comercio Salón De Uñas Y Pestañas Almagro,"Av. Corrientes 3870, Almagro, Capi...",US$10.000,Otros
Peluqueria Baberia,"Hipólito Yrigoyen 1472, Moreno, Pr...",US$3.500,Peluquería
Venta De Fondo De Comercio (instalaciones) + Posibilidad Venta De Marca,"Gorriti 4812, Ciudad Autónoma De B...",US$48.000,Otros
"Agencia De Lotería Y Rapipago, Fondo De Comercio Rentable","Avenida Escalada  Sn, Parque Avell...",US$20.000,Lotería
Lote De Griferias,"Calle Chubut Sn, Ramos Mejía, La M...",US$9.000,Otros
Fondo De Comercio Bebidas,"Julián Álvarez  649, Villa Crespo,...",US$19.900,Otros
Vendo Fondo De Comercio De Lavadero De Autos,"Comuna 4, Tilcara 2933, Buenos Air...",US$70.000,Lavadero de autos
Venta Fondo De Comercio Vivero En Palmares,"San Martín  2875, Godoy Cruz, Mend...",US$20.000,Vivero
Reconocido Resto Bar En Miramar - Cerveceria Shows En Vivo Fondo Comercio,"Calle 20 1121, Miramar, Provincia ...",US$75.000,Cervecería
Fondo De Comercio Agencia De Lotería Y Quiniela,"Av. Goycoechea  545, Villa Allende...",US$21.000,Lotería
"Dueño Vende Fondo De Comercio: Torre, Antena Y Oficina Aptas Para Fm En El Centro De Rosario. Excelente Ubicacion","Córdoba 1365, Rosario, Provincia D...",US$22.000,Otros
Vendo Fondo De Comercio,"Aristobulo Del Valle  4000, Otros ...",US$100,Otros
"Fondo De Comercio Barberia , Oportunidad!","Beron De Astrada  2700, Ramos Mejí...",US$6.000,Barbería
Fondo De Comercio - Excelente Zona Comercial,"Salta Sn, Macrocentro, Mar Del Pla...",US$6.000,Otros
Fondo De Comercio Dietetica,"San Lorenzo 3284, Villa San Andrés...",US$25.000,Dietética
Fondo De Comercio Kiosco Y Regaleria,"Calle 13 Entre 37 Y 38 270, La Pla...",US$15.000,Kiosco
Casa De Repuestos Linea Ford,"Av Triunvirato 3531, Ciudad Autóno...",US$18.000,Otros
Fondo De Comercio,"Leandro N Alem 2392, Monte Grande,...",$9.500,Otros
Fondo De Comercio,"9 De Julio 1650, Centro, Rosario, ...",US$6.000,Otros
Dietetica El Lahuan - Impecable - Excelente Oportunidad - Cambia Tu Vida!!!!,"Av. Los Notros, Lago Puelo, Chubut...",US$32.000,Dietética
Vendo Fondo De Comercio Bicicleteria Costa Del Sol,"Federico Lacroze Sn, Chacarita, Ca...",US$1,Bicicletería
Fondo De Comercio Mercería Y Retacería Financiación,"José Hernández 345, Luis Guillon, ...",$6.000,Otros
Fondo De Comercio - Zona Comercial San Fernando,"Constitución  1701, San Fernando, ...",$50.000,Otros
Salas De Ensayo En Santa Fe Capital,"Francia 2000, Ciudad De Santa Fe, ...",US$24.000,Otros
Fabrica De Ionizadores Solares Para Piscinas,"Ingeniero Huergo 1500 - 1800, San ...",US$50.000,Fábrica
Bowling Completo,"Av Del Valle  Sn, Tandil, Buenos A...",US$70.000,Otros
Vendo Fondo De Comercio,"Balcarce  460, Nueva Córdoba, Córd...",US$40.000,Otros
Fondo De Comercio Market 24 Hs,"Av. Emilio Olmos  502, Centro, Cór...",US$4.000,Otros
"Fondo De Comercio - Merceria, Lenceria, Bebes - Mas De 30 Años De Actividad! - La Merceria Mas Completa De La Zona!","Avenida Senador Morón 900 - 1200, ...",US$47.000,Otros
Cápsula Termoadelgazante,"Ramona Pereyra  2028, Otros Barrio...",$250,Otros
Fondo Comercio Dietetica,"Duarte Quiros  2141, Alto Alberdi,...",US$5.000,Dietética
Vendo Fondo Comercio Venta Repuestos Chevrolet,"Avenida Directorio 3047, Ciudad Au...",US$30.000,Otros
"Dietetica Y Almacen Naturista Sobre Avenida Comercial, A Diez Metros De Parada De Colectivos","Avenida Cazón 758, Tigre, Provinci...",US$12.000,Dietética
Chapa Licencia Agencia De Lotería De La Ciudad,"Ciudad Autónoma De Buenos Aires, A...",US$2.500,Lotería
Kiosco Puesto Parada De Diarios Y Revistas,"Av. Cerviño  3330, Palermo, Capita...",US$38.000,Kiosco
Agencia De Lotería,"Guise 1704, Palermo, Capital Feder...",US$50.000,Lotería
Fondo De Comercio - Indumentaria Infantil/bebes - Quilmes Peatonal,"Avenida Rivadavia 200, Quilmes, Pr...",US$14.000,Indumentaria
Vendo Agencia De Lotería,"Avenida 9 De Julio 1744, Lanús, Pr...",US$50.000,Lotería
Agencia De Lotería,"Avenida Mitre  915, Quilmes, Bs.as...",US$33.000,Lotería
Agencia De Loteria,"Avenida San Martín 2954, Buenos Ai...",US$15.000,Lotería
Barberia Fondo De Comercio,"Planes  1839, William C. Morris, H...",$7.000.000,Barbería
Fondo De Comercio Fiambrería Granja Listo Para Trabajar Tocl,"Somellera  Sn, Adrogué, Almirante ...",US$35.000,Fiambrería
Fondo De Comercio Agencia Oficial De Loteria,"Avenida San Martin 2679, Lanús Oes...",US$15.000,Lotería
Agencia De Loteria En Llavallol,"Nestor De La Peña 55, Llavallol, P...",US$21.000,Lotería
"Loteria Neuquina, Fondo De Comercio De Lotería Y Quiniela","Ruta 40 2210, Zona Centro, San Mar...",US$59.999,Lotería
"Fondo De Comercio Sushi, Oportunidad","Falcon 6000, Villa Luro, Capital F...",$50.000.000,Otros
Cerveceria Y Hamburgueseria En Polo Gastronomico De Banfield,"Cochabamba 321, Banfield, Provinci...",US$1,Cervecería
Se Venden Heladeras Y Picadora D Carne,"Soldado De La Frontera  5158, Vill...",$700.000,Otros
Chapa Loteria De La Provincia,"Calchaqui 3138, Quilmes Oeste, Qui...",$1.111,Lotería
Pizzería Muy Acreditada Zona Paalomarr,"Marconi  773, El Palomar, Morón, B...",US$50.000,Pizzería
Vendo Fondo De Comercio,"Doctor Juan Felipe Aranguren 744, ...",$6.500.000,Otros
Se Vende Fondo De Comercio - Kiosco En Pleno Centro,"Arturo M. Bas 1 - 300, Córdoba, Pr...",US$5.500,Kiosco
Vendo Fondo De Comercio Feria Americana,"Av Corrientes  3900, Almagro, Capi...",$4.000.000,Otros
Vendo Fondo De Comercio,"Av. Goycoechea 193, Villa Allende ...",US$25.000,Otros
Fondo Comercio Ferreteria Funcionando,"Mariano Moreno 407, Rosario, Provi...",US$26.000,Ferretería
Oportunidad De Inversión Venta De Fondo De Comercio - Rubro Informática,"San Lorenzo, Santa Fe, Argentina, ...",US$5.500,Otros
Fiambrera Poco Uso.como Nueva .sistel Cf.330,"Calle 10 Sur 2490, Colonia Caroya,...",$900.000,Fiambrería
Frezzer Helados,"Antonio De La Maza  3185, José Ign...",$400.000,Otros
Vendo Importante Fondo De Comercio + De 10 Años Funcionando,"Alvear 1751, Villa Ballester, Gene...",US$35.000,Otros
Kiosco Venta Fondo De Comercio,Avenida Tte Gral Juan Domingo Peró...,US$15.000,Kiosco
Agencia De Loterías,"Calle 8 Entre 55 Y 56 1800, La Pla...",US$8.700,Lotería
Fondo De Comercio De Fabrica De Pastas En Ramos Mejia,"Avenida General San Martín 170, Ra...",$1.000,Fábrica
Vendo O Permuto Agencia De Loteria .florencio Varela,"Senzabello 797, Florencio Varela, ...",US$35,Lotería
Agencia De Lotería. Florencio Varela,"Monteverde  294, Florencio Varela,...",US$15.000,Lotería
Fondo De Comercio Maxikiosco,"Aquino 5661, Caba, Argentina, Vill...",US$10.000,Kiosco
Vendo Fondo Comercio Supermercado Muy Bien Ubicado Y Equipado. 30 Años En El Rubro,"Salta 1230, San Lorenzo, Provincia...",US$70.000,Supermercado
Vendo Licencia Con Máquina En Guarda!,"44 E/23 Y 24  1430, La Plata, Bs.a...",US$10.000,Otros
