Titulo,Moneda,Precio,Ubicacion,Rubro
Local Boutique Ropa Femenina,US$,30000,"Córdoba, Provi...",Indumentaria
Fabrica De Galletitas Con Instalaciones E Inmueble Propio,US$,480000,"Banfield, P...",Fábrica
Vendo Fondo De Comercio - Tienda De Decoración Del Hogar/ventas De Muebles/cuadros-gran Oportunidad ¡excelente Rubro Rentable!,US$,23000,Villa Carl...,Otros
Venta Fondo De Comercio,$,9000000,Haedo...,Otros
Casa De Repuestos Automotor Tren Delantero (ex Mostrador Fric Rot),US$,50000,"Balcarce, Pro...",Otros
Fondo De Comercio Rubro Panadería,US$,70000,"Campana, Buenos Ai...",Panadería
"Cabañas Complejo , Exelente  Oportunidad!!..",US$,450000,"-64.456607 00, Villa D...",Hotelería
Fondo De Comercio Salon De Fiestas Infantiles,US$,40000,"Piñeyro, Avellane...",Eventos
Venta Fondo De Comercio Rapipago Con Kiosko Y Servicios Vs.,US$,6500,Ciudad A...,Kiosco
Franquicia De Congelados Con 2 Sucursales En Caba Y Bs.as.,US$,45000,"Gran Buenos Aires, Buen...",Franquicia
Venta De Fondo De Comercio Verduleria Fruteria Almacen Y Vivero En Tigre,US$,10000,"Tigre, Provincia D...",Verdulería
Liquidacion Total Ferreteria Para Trasladar,US$,99000,"Ciudad De Córdoba, Provin...",Ferretería
Fondo De Comercio Lavadero De Ropa,US$,50000,"Villa Luro, Capital Fe...",Indumentaria
Vendo Fondo De Carnicería En Moreno Pcia B.s A.s,US$,50000,"Moreno, B...",Carnicería
Local Importante De Fiambreria Zona Martinez Vendo Fondo Comercio,US$,18000,"Martínez, Provi...",Fiambrería
¡no Pierdas Esta Oportunidad De Invertir En Tu Propio Negocio Fábrica De Pizzas A La Piedra! Ideal Grupo Familiar.,US$,18500,"Bahía Blanca, Buenos A...",Fábrica
Fondo De Comercio Ferreteria,US$,60000,"Morón, Bs.as. G.b.a. O...",Ferretería
Fondo De Comercio Minimarket Con Excelentes Ingresos.,US$,105000,"Puerto Norte, Ros...",Supermercado
Vendo Fondo De Comercio De Ropa De Mujer. Villa Del Parque,US$,13000,"Villa Del Parque, ...",Indumentaria
Fondo De Comerio Kiosco Libreria Impresiones Paqueteria Mercado Libre,US$,11000,"Buenos Aires, Argen...",Kiosco
Fondo De Comercio Lavadero De Autos. San Justo,US$,45000,Presidente Perón 2901 Y Salta 2901...,Lavadero de autos
"Minimercado, Carnicería, Verdulería Y Almacen",$,20000000,Tant...,Carnicería
Comercio Completo (mercadería Incluida),US$,6000,"Villa Lugano, Cap...",Otros
Venta Fondo De Comercio: Indumentaria Zona Adrogué,US$,12000,"Adrogué, Almi...",Indumentaria
Fondo De Comercio,US$,4200,"Quilmes, Bs....",Otros
Vendo Fondo De Comercio Pet Shop,US$,13000,"Abasto, Rosario, S...",Pet shop
Fondo Comercio Panadería,US$,30000,"Almagro, Capital Fed...",Panadería
Venta Mercadería E Instalaciones Ferreteria Industrial,US$,24999,"Villa Santos Tesei, ...",Ferretería
Vendo Fondo De Comercio De Catering Para Eventos,US$,35000,Ciudad Autónom...,Eventos
Venta Fondo Comercio - Carnicería,$,36000000,Bu...,Carnicería
Venta Ferreteria,US$,1,"Oriente, Coronel Dorre...",Ferretería
Oportunidad Venta De Fondo De Comercio Gastronómico Caba,US$,60000,Villa De...,Otros
Venta Fondo De Comercio Maxikiosco Villa Luzuriaga,US$,130000,"Villa Luzuriaga, La Mat...",Kiosco
Oportunidad. Agencia De Lotería En Haedo. Excelentes Comisiones.  Venta Por Cambio De Rubro,US$,15500,"Haedo, Provinci...",Lotería
Galpón Mas Casa 3 Ambientes Más Fondo De Comercio Permuta,US$,200000,Bs.as. G.b.a. Oeste,Otros
Fondo Comercio Cancha Futbol7 Y Quinta P/eventos - Tomo Auto,US$,8000,"La Lonja, Pilar, Bs...",Cancha de futbol
Complejo De 10 Departamentos En La Mejor Zona De San Bernardo!!!,US$,400000,"San Bernardo, Provi...",Hotelería
Fondo Comercio Suplementos Deportivo Y Dietética Funcionando,US$,30000,Avenida Brigadier General Juan Man...,Dietética
Bulonera Fondo De Comercio,US$,85000,...,Ferretería
Fondo De Comercio En Caballito,US$,80000,Buenos Aires...,Otros
Venta De Fondo De Comercio De Carniceria,US$,60000,Santos Lugares...,Carnicería
Fondo De Comercio Almacén Y Kiosco Zona Sur,$,15000,Sarandí...,Kiosco
Repuesto Originales Automotor Chevrolet,US$,57000,"Berazategui, Bs.as. G....",Otros
Fondo De Comercio,$,65,"San Isidro, Bs.as....",Otros
Único...!! Fondo De Comercio. La Mejor Inversión..!!,$,1234567,"Universitario, Bahía...",Otros
Fondo De Comercio Gastronómico En Venta (no Franquicia).,US$,260000,"Paraná, Entre Ríos...",Franquicia
¡oportunidad Única! Fondo De Comercio: Quesería En Venta,US$,60000,"Bernardo De Irigoyen, Misiones, Argentina, Bernardo De Irigoyen, General Manuel Belgrano, Misiones",Otros
"Hedaria, Fondo De Comercio",US$,7000,"Merlo, Bs.As. G.B.A. Oeste",Otros
Fondo De Comercio,US$,5500,"Villa Giardino, Punilla, Córdoba",Otros
Vendo Fondo De Comercio Barberia,US$,29900,"Monte Castro, Capital Federal",Barbería
Venta Local 36m En San Andres $$68mil,US$,68000,"Villa San Andrés, General San Martín, Bs.As. G.B.A. Norte",Otros
Fondo De Comercio Bulonera Y Ferretería Troncos Del Talar 30 Años En El Mercado,US$,19000,"Troncos Del Talar, Provincia De Buenos Aires, Argentina, Los Troncos Del Talar, Tigre, Bs.As. G.B.A. Norte",Ferretería
"Liquido!!!  - Dueño Vende Complejo De Cabañas / Departamentos. Uso Turístico, Alquiler Temporal",US$,160000,"X5189, Córdoba, Argentina, Villa Ciudad Parque Los Reartes, Calamuchita, Córdoba",Hotelería
Venta Hotel En Avenida Forest Y Av Álvarez Thomas Capital,US$,470000,"Belgrano, Capital Federal",Hotelería
"Salon De Eventos, Local Y Dpto Con Propiedad",US$,450000,"Gregorio De Laferrere, La Matanza, Bs.As. G.B.A. Oeste",Eventos
Vendo Fondo De Comercio Kiosco,US$,20000,"El Palomar, Morón, Bs.As. G.B.A. Oeste",Kiosco
Fondo De Comercio Maxikiosco,US$,10000,"Villa Adelina, San Isidro, Bs.As. G.B.A. Norte",Kiosco
Carniceria,US$,11000,"Lomas Del Mirador, La Matanza, Bs.As. G.B.A. Oeste",Carnicería
Vendo Fondo De Comercio Autoservicio 40 Años En La Zona,US$,30000,"Mataderos, Capital Federal",Supermercado
Ferretería Funcionando,US$,20000,"Ituzaingó Norte, Ituzaingó, Bs.As. G.B.A. Oeste",Ferretería
Fondo Comercio Casa De Pesca,US$,15000,"Roque Pérez, Buenos Aires Interior",Otros
Cervecería Y Vermuteria,US$,115000,"Firmat, General López, Santa Fe",Cervecería
Vendo Fondo De Comercio De Café / Bar,US$,25000,"Recoleta, Capital Federal",Cafetería
Fondo De Comercio Rubro Cervecería,US$,50000,"Muñiz, San Miguel, Buenos Aires Province, Argentina, Muñiz, San Miguel, Bs.As. G.B.A. Norte",Cervecería
Fondo De Comercio Mar De Las Pampas Oportunidad,US$,22000,"Provincia De Buenos Aires, Argentina, Mar De Las Pampas, Bs.As. Costa Atlántica",Otros
Frigorífico Sin Funcionar Precio En Dólares Solo Venta,US$,560000,"Mataderos, Capital Federal",Otros
"Vendo Fondo De Comercio, Excelente Ubicación,",US$,38000,"Florencio Varela, Bs.As. G.B.A. Sur",Otros
"Vendo Casa + Complejo De Cabañas + Fondo De Comercio Oportunidad - El Trapiche, San Luis",US$,150000,"San Luis, San Luis Province, Argentina, El Trapiche, Coronel Pringles, San Luis",Hotelería
Fondo De Comercio Fiambreria Y Quesería   La Mejor,US$,30000,"Flores, Capital Federal",Fiambrería
Venta De Fondo De Comercio Maxikiosco.   Villa Crespo-caba,US$,12000,"C1414 Cdad. Autónoma De Buenos Aires, Argentina, Villa Crespo, Capital Federal",Kiosco
Fondo De Comercio - Kiosco - Librería - Villa Elisa,US$,16000,"Villa Elisa, Provincia De Buenos Aires, Argentina, Villa Elisa, La Plata, Bs.As. G.B.A. Sur",Kiosco
Fondo De Comercio Gestoría Y Peluquería Canina Tigre Centro,$,100,"Tigre, Bs.As. G.B.A. Norte",Peluquería
Venta Fondo De Comercio Kiosko/almacen Venezolano/argentino Flores,US$,12900,"Ciudad Autónoma De Buenos Aires, Argentina, Flores, Capital Federal",Kiosco
Panaderia .peluqueria.y 2 Departamentos,US$,130000,"General Roca, Río Negro",Panadería
Fondo De Comercio Indumentaria Femenina En Villa Urquiza,US$,25000,"Villa Urquiza, Capital Federal",Indumentaria
Venta Fondo De Comercio Consultorio Más Estetica.,$,10000,"Belgrano, Capital Federal",Salón de belleza
Fondo De Comercio Eléctrica Electricidad,US$,40000,"Ituzaingó Norte, Ituzaingó, Bs.As. G.B.A. Oeste",Otros
"Venta De Fondo De Comercio, Maxikiosco, Goloteca, Golosinas",US$,8000,"San Justo, Provincia De Buenos Aires, Argentina, San Justo, La Matanza, Bs.As. G.B.A. Oeste",Kiosco
Fondo Comercio Kiosko,US$,14000,"Almagro, Capital Federal",Kiosco
Fondo De Comercio De Casa De Repuestos Con 32 Años De Antiguedad,US$,170000,"Villa Luzuriaga, La Matanza, Bs.As. G.B.A. Oeste",Otros
Fondo De Comercio Salón De Belleza,US$,14000,"Quilmes, Bs.As. G.B.A. Sur",Salón de belleza
"Fondo De Comercio En Venta Minimercado, Verduleria, Fiambreria, Almacen Y Mas",US$,29900,"Morón, Provincia De Buenos Aires, Argentina, Morón, Bs.As. G.B.A. Oeste",Fiambrería
Fondo De Comercio Centro De Estética La Plata,US$,1,"DPS, Provincia De Buenos Aires, Argentina, La Plata, Bs.As. G.B.A. Sur",Salón de belleza
Vendo Fondo De Comercio Café-resto-bar  En Palermo Soho,US$,35000,"Palermo Soho, Capital Federal",Cafetería
"Lote , Casa Muy Amplia , Dúplex , Departamentos , Fondo De Comercio ! Posible Permuta !!!",US$,165000,"Florencio Varela, Bs.As. G.B.A. Sur",Otros
Fondo De Comercio Restobar Santa Rosa Calamuchita,US$,35000,"Centro, Santa Rosa De Calamuchita, Córdoba",Restaurante
Se Vende Fondo De Comercio Hamburgueseria Fabena Food,US$,18000,"Morón, Bs.As. G.B.A. Oeste",Hamburguesería
Dietetica Y Almacén Natural,US$,89000,"Zárate, Buenos Aires Interior",Dietética
Fondo De Comercio En Berazategui Centro - Espacio De Yoga Y Terapias Alternativa,US$,30000,"Berazategui, Provincia De Buenos Aires, Argentina, Berazategui, Bs.As. G.B.A. Sur",Otros
Fondo De Comercio Bar Caba,US$,24500,"Balvanera, Capital Federal",Otros
Fondo De Comercio Cotillón En Flores,US$,14000,"Flores, Capital Federal",Cotillón
Fondo De Comercio. Dietética,$,5000,"Olivos, Provincia De Buenos Aires, Argentina, Olivos, Vicente López, Bs.As. G.B.A. Norte",Dietética
Fondo De Comercio - Local Indumentaria - San Martín De Los Andes Zona Centro,US$,18000,"Zona Centro, San Martin De Los Andes, Neuquén",Indumentaria
Fondo De Comercio En Venta Canchas De Fútbol Ciudad Evita,US$,98000,"Ciudad Evita, La Matanza, Bs.As. G.B.A. Oeste",Cancha de futbol
Venta Fondo De Comercio Libreria - Papeleria - Artistica- Imprenta Afip - Sellos,US$,35000,"Ciudad Autónoma De Buenos Aires, Argentina, Balvanera, Capital Federal",Librería
Fondo De Comercio Geriatrico,$,111111,"Parque Avellaneda, Capital Federal",Geriátrico
Excelente Fondo De Comercio En Villa Bosch Nuevo Precio,US$,14000,"Villa Bosch, Tres De Febrero, Bs.As. G.B.A. Oeste",Otros
Vendo Fondo D Comercio,US$,60000,"Belén De Escobar, Escobar, Bs.As. G.B.A. Norte",Otros
Fondo De Comercio Centro De Estética /solarium,US$,15000,"Villa Urquiza, Capital Federal",Salón de belleza
Maxikiosco 24hs,US$,29000,"Ramos Mejía, La Matanza, Bs.As. G.B.A. Oeste",Kiosco
Fondo De Comercio Local Ind Femenina! Excelente Ubicación,US$,20000,"Lomas De Zamora, Bs.As. G.B.A. Sur",Indumentaria
Fondo De Comercio Café,US$,29000,"Palermo Hollywood, Capital Federal",Cafetería
Fondo De Comercio Parrilla En Centro La Plata,US$,15000,"BNC, La Plata, Provincia De Buenos Aires, Argentina, La Plata, Bs.As. G.B.A. Sur",Parrilla
Fondo De Comercio Despacho Papas Cheddar Y Mas,US$,10000,"Los Hornos, La Plata, Bs.As. G.B.A. Sur",Otros
Venta Fondo De Comercio Restaurante/ Cervecería,US$,50000,"Pinar De Festa, Bariloche, Río Negro",Cervecería
Venta Fondo De Comercio Peluqueria Canina Y Felina Petshop,US$,9000,"Martínez, San Isidro, Bs.As. G.B.A. Norte",Peluquería
Estacion De Servicio Con Mercadería Incluida.,US$,200000,"La Cumbre, Punilla, Córdoba",Otros
Vendo Fondo De Comercio Kiosco,US$,8500,"Lanús Oeste, Lanús, Bs.As. G.B.A. Sur",Kiosco
Centro Medico Ambulatorio -  Financiacion 50% Propia,US$,650000,"Once, Capital Federal",Otros
Fondo De Comercio Venta Oportunidad Acepto Permuta Vehicular,US$,9000,"Don Torcuato Oeste, Tigre, Bs.As. G.B.A. Norte",Otros
Fondo De Comercio Vinoteca,US$,18000,"Güemes, Mar Del Plata, Bs.As. Costa Atlántica",Bebidas
Local Comercial + Fondo De Comercio,US$,100000,"Wilde, Avellaneda, Bs.As. G.B.A. Sur",Otros
Vendo Complejo De Cabañas Desayunador Comedor Vivienda,$,111111111,"Villa Parque Siquimán, Punilla, Córdoba",Hotelería
Venta Spa. Estetica.belleza,US$,5000,"Floresta, Capital Federal",Salón de belleza
"Complejo De Cabañas, Villa Río Icho Cruz, Punilla, Córdoba",US$,230000,"Villa Río Icho Cruz, Punilla, Córdoba",Hotelería
Permuto Lote Ferreteria . Solo Mercaderia,US$,7000,"Monte Grande, Provincia De Buenos Aires, Argentina, Monte Grande, Esteban Echeverría, Bs.As. G.B.A. Sur",Ferretería
Cerveceria Bar Fondo De Comercio,US$,27000,"Villa Bosch, Provincia De Buenos Aires, Argentina, Villa Bosch, Tres De Febrero, Bs.As. G.B.A. Oeste",Cervecería
Fondo De Comercio- Perfumería Y Limpieza,US$,19000,"San Antonio De Padua, Merlo, Bs.As. G.B.A. Oeste",Otros
Vendo Fondo De Comercio De Pizzeria Restó,US$,18000,"Aguas Verdes, Provincia De Buenos Aires, Argentina, Aguas Verdes, Bs.As. Costa Atlántica",Pizzería
Fondo De Comercio Estética Integral,US$,5500,"Villa Urquiza, Capital Federal",Salón de belleza
Se Vende Excelente Fondo De Comercio Precio Negociable!!!!,US$,1111111,"Villa La Angostura, Neuquén",Otros
Venta Hotel Jagüel Santa Teresita,US$,385000,"Santa Teresita, Bs.As. Costa Atlántica",Hotelería
Fondo De Comercio,US$,13000,"Villa Adelina, San Isidro, Bs.As. G.B.A. Norte",Otros
Fondo De Comercio,US$,40000,"San Martín, Mendoza",Otros
Fondo De Comercio Carnicería Y Pollería En Haedo,US$,10000,"Haedo, Morón, Bs.As. G.B.A. Oeste",Carnicería
Fondo De Comercio Cancha De Fútbol,US$,35000,"Libertad, Merlo, Bs.As. G.B.A. Oeste",Cancha de futbol
Oportunidad!!!  Fondo De Comercio Maxiquiosco,US$,4500,"Ciudad Autónoma De Buenos Aires, Argentina, Monte Castro, Capital Federal",Kiosco
Lote Ferreteria . Solo Mercaderia,$,10000000,"Ciudad Autónoma De Buenos Aires, Argentina, Villa Crespo, Capital Federal",Ferretería
Cerveceria Venta Fondo Comercio Zona Residencial,US$,100000,"Parque Leloir, Ituzaingó, Bs.As. G.B.A. Oeste",Cervecería
Fondo De Comercio Box De Ent. Funcional/cross/indoor,US$,45000,"Ramos Mejía, La Matanza, Bs.As. G.B.A. Oeste",Otros
Fondo De Comercio Cotillón Reposteria Y Dietetica. En Venta,US$,17000,"Villa Ballester, General San Martín, Bs.As. G.B.A. Norte",Cotillón
Fondo De Comercio Fiambreria Gourmet Y Vinoteca,US$,65000,"San Justo, Provincia De Buenos Aires, Argentina, San Justo, La Matanza, Bs.As. G.B.A. Oeste",Bebidas
Vendo Bar/cerveceria,US$,25000,"Villa Crespo, Capital Federal",Cervecería
Venta Fondo De Comercio .peluquería Unisex .,US$,11500,"Villa Devoto, Capital Federal",Peluquería
Fondo De Comercio Cotillón,US$,8000,"San Miguel, Bs.As. G.B.A. Norte",Cotillón
Fondo De Comercio,US$,7500,"Caballito, Capital Federal",Otros
Se Vende Llave De Comercio De Minimercado Muy Buenas Ventas,$,36000000,"Pilar, Las Colonias, Santa Fe",Supermercado
Fondo De Comercio En Venta Dietética U Otro Rubro,US$,8000,"Florida, Vicente López, Bs.As. G.B.A. Norte",Dietética
Fondo De Comercio: Local De Indumentaria En Adrogué Centro,US$,12000,"Adrogué, Almirante Brown, Bs.As. G.B.A. Sur",Indumentaria
Fondo De Comercio Berazategui,US$,19000,"Berazategui, Bs.As. G.B.A. Sur",Otros
Hotel Rural (apart & Hotel) Ecoturismo Pesca,$,399000,"Esquina, Corrientes",Hotelería
Vendo Fondo Comercio Salón Estética Únik,US$,13000,"Aldo Bonzi, La Matanza, Bs.As. G.B.A. Oeste",Salón de belleza
Vendo Por Viaje Peluqueria Equipada,US$,8000,"Ciudad Autónoma De Buenos Aires, Argentina, Congreso, Capital Federal",Peluquería
Venta De Fondo De Comercio Bazar Y Deco,US$,23600,"Ciudad Autónoma De Buenos Aires, Argentina, Villa Pueyrredón, Capital Federal",Otros
Fondo De Comercio,$,1000,"La Paz, Entre Ríos",Otros
Fondo Comercio Ferreteria,US$,13000,"Caballito, Capital Federal",Ferretería
Agencia De Loteria De La Provincia.,US$,23000,"Merlo, Bs.As. G.B.A. Oeste",Lotería
Gimnasio Completo Con Máquinas Nuevas Todo Funcionando,$,111111,"Otros Barrios, Posadas, Misiones",Gimnasio
Fondo De Comercio Parrilla Restaurante Parque Cervecero,US$,12000,"Llavallol, Lomas De Zamora, Bs.As. G.B.A. Sur",Cervecería
Kiosco En Quilmes Fondo De Comercio,US$,25000,"Provincia De Buenos Aires 347, Quilmes, Bs.As. G.B.A. Sur",Kiosco
Quimica Fondo De Comercio En Venta,US$,15000,"Monte Grande, Esteban Echeverría, Bs.As. G.B.A. Sur",Otros
Fondo De Comercio Dietetica Beruti 2800,US$,30000,"Ciudad Autónoma De Buenos Aires, Argentina, Recoleta, Capital Federal",Dietética
Venta Fondo De Comercio Ferreteria,US$,32000,"Ramos Mejía, La Matanza, Bs.As. G.B.A. Oeste",Ferretería
Vendo Fondo De Comercio Pizzeria-bar- Cafe,US$,10000,"El Jagüel, Esteban Echeverría, Bs.As. G.B.A. Sur",Cafetería
Fondo De Comercio De La Mejor Bicicletería De Belgrano,US$,20000,"Belgrano, Capital Federal",Bicicletería
Fondo De Comercio Pizzería,US$,30000,"Villa Adelina, Vicente López, Bs.As. G.B.A. Norte",Pizzería
Fondo De Comercio - Hamburgueseria Escobar,US$,12000,"Belén De Escobar, Escobar, Bs.As. G.B.A. Norte",Hamburguesería
Fondo De  Comercio Totalmente Equipado.facilidad Oportunidad,US$,70000,"Santa Teresita, Bs.As. Costa Atlántica",Otros
Venta Fondo De Comercio Pañalera,US$,12000,"Merlo, Provincia De Buenos Aires, Argentina, Merlo, Bs.As. G.B.A. Oeste",Otros
Fondo De Comercio De Estetica,US$,12000,"Belgrano, Rosario, Santa Fe",Salón de belleza
"Se Vende Fondo De Comercio, Vidriería",US$,36500,"Lanús Oeste, Lanús, Bs.As. G.B.A. Sur",Otros
Se Vende Fondo De Comercio  Tienda De Bebidas,US$,10500,"Isidro Casanova, La Matanza, Bs.As. G.B.A. Oeste",Bebidas
Vendo   Fondo De Comercio Oportunidad  En Caballito Primera,US$,6500,"Caballito, Capital Federal",Otros
Exelente Oportunidad Fondo De Comercio Linea Peugeot,US$,49000,"Ciudad Madero, La Matanza, Bs.As. G.B.A. Oeste",Otros
Venta Fondo De Comercio (se Acepta Permuta Vehicular),US$,9000,"Don Torcuato, Provincia De Buenos Aires, Argentina, Don Torcuato Oeste, Tigre, Bs.As. G.B.A. Norte",Otros
Venta De Fábrica De Rotomoldeo,$,1111111,"Venado Tuerto, Provincia De Santa Fe, Argentina, Venado Tuerto, General López, Santa Fe",Fábrica
Agencia De Loteria De La Ciudad En Venta Chapa E Instalaciones,US$,8900,"EZJ, Buenos Aires, Argentina, Villa Urquiza, Capital Federal",Lotería
Vendo Fondo De Comercio Maxikisoco. Urgente !!! Hasta Fin De Mes !!! No Te Lo Pierdas!!!,$,9000000,"Liniers, Capital Federal",Kiosco
Fondo De Comercio Kiosco,US$,13000,"Ituzaingó Centro, Ituzaingó, Bs.As. G.B.A. Oeste",Kiosco
Puesto De Diarios Y Revistas - Centro De San Telmo,US$,6500,"San Telmo, Buenos Aires, Argentina, San Telmo, Capital Federal",Otros
Heladeria Volta Fondo De Comercio,$,19800,"Villa Pueyrredón, Capital Federal",Heladería
"Fondo De Comercio Dietetica Vitalcer , Se Puede Traspasar De Zona,,,",US$,20000,"General Pacheco, Tigre, Bs.As. G.B.A. Norte",Dietética
Fondo De Comercio Fábrica De Sandwiches De Miga,US$,16000,"Santa Teresita, Bs.As. Costa Atlántica",Fábrica
Fondo De Comercio Dietetica Almacen,US$,5000,"Villa Bosch, Tres De Febrero, Bs.As. G.B.A. Oeste",Dietética
Venta D Fondo De Comercio Lavadero D Ropa..30 Años De Antigu,US$,38000,"José Mármol, Almirante Brown, Bs.As. G.B.A. Sur",Indumentaria
Hermoso Fondo Comercio Reposteria Cotillon,US$,9000,"Monte Castro, Capital Federal",Cotillón
"Restaurant , Parrilla , Pizzeria , Estilo Bodegon En San Justo",US$,50000,"San Justo, Provincia De Buenos Aires, Argentina, San Justo, La Matanza, Bs.As. G.B.A. Oeste",Parrilla
Fondo De Comercio Cafetería Al Lado Teatro Melos,US$,15000,"Centro, Villa Carlos Paz, Córdoba",Cafetería
Fondo De Comercio Maxikiosco-libreria.,US$,10000,"San Justo, La Matanza, Bs.As. G.B.A. Oeste",Kiosco
Fondo De Comercio Regalos Empresariales Maquinas De Grabado Profesional Fabolusa Rentabilidad Real Comprobable,US$,20000,"Quilmes, Provincia De Buenos Aires, Argentina, Quilmes, Bs.As. G.B.A. Sur",Otros
Venta - Puesto De Diarios Y Revistas,$,100,"Morón, Provincia De Buenos Aires, Argentina, Morón, Bs.As. G.B.A. Oeste",Otros
Fondo De Comercio,$,10000,"Morón, Bs.As. G.B.A. Oeste",Otros
Venta Fondo De Comercio Maxikiosco,US$,10000,"Monserrat, Capital Federal",Kiosco
Vendo Fondo De Comercio Materiales Electricos,US$,60000,"Avenida 14 3060, Berazategui, Provincia De Buenos Aires, Argentina, Berazategui Oeste, Berazategui, Bs.As. G.B.A. Sur",Otros
Heladería . Cafeteria,US$,8000,"Villa Cabello, Posadas, Misiones",Cafetería
Fondo De Comercio Con Franquicia Propia,US$,16000,"Tigre, Bs.As. G.B.A. Norte",Franquicia
Fondo De Comercio,US$,50000,"Virreyes, San Fernando, Bs.As. G.B.A. Norte",Otros
Fondo De Comercio Santa Teresita 47 Street-wanama-tascani,US$,20000,"Santa Teresita, Bs.As. Costa Atlántica",Otros
Fondo De Comercio,US$,1,"La Plata, Bs.As. G.B.A. Sur",Otros
Fondo De Comercio Cerrajeria Ferreteria,US$,15000,"Mar Del Plata, Provincia De Buenos Aires, Argentina, La Perla, General Pueyrredón, Buenos Aires Interior",Ferretería
Resto Bar Desde 1968,US$,90000,"Centro, Córdoba",Restaurante
Fondo De Comercio,US$,30000,Avellane...,Otros
Fondo De Comercio En El Centro De Rosario,US$,6500,"Centro, Rosario, Sa...",Otros
Fondo De Comercio Bar Cerveceria,US$,10000,"Otros Barrios, ...",Cervecería
Vendo Fondo De Comercio Rotiseria,$,1234,Lomas Del...,Otros
Se Vende Fondo De Comercio Peluquería En Nva Córdoba,US$,6000,Nueva Córdoba...,Peluquería
Se Vende Fondo De Comercio Maxikiosco Benyi,US$,18000,"Berazategui Oeste, Ber...",Kiosco
Fondo De Comercio Lavadero Autos Zona Ituzaingó .urg Salud,US$,14000,"Ituzaingó Sur, Ituz...",Lavadero de autos
Venta De Agencia $15.000  Usd Permuta,US$,15000,Villa De...,Otros
Se Vende Fondo De Comercio De Lavadero De Autos,US$,25000,"Villa Maipú, G...",Lavadero de autos
Venta D Fondo D Comercio. La Mejor Ubi D San Miguel,US$,50000,"San Miguel, Bs.as. G....",Otros
V 2 Fondos De Comercio! 2 Barberias/pelu Unisex C/ Gabinete,US$,10000,"Villa Pueyrredón, ...",Barbería
"Fondo De Comercio, Autoservicio, Ranelagh",US$,38000,"Ranelagh, Berazat...",Supermercado
Fondo De Comercio Cafeteria De Especialidad + Dietetica,US$,95000,Re...,Cafetería
Vendo  Maxikiosco,US$,22000,"Ramos Mejía, La Matanz...",Kiosco
Heladería,US$,20000,Barri...,Heladería
Vendo Fondo De Comercio - Cafeteria,US$,9500,"Centro, Rosario, ...",Cafetería
Fondo De Comercio Dietética En Zona Las Cañitas!!!,US$,14000,"Belgrano, Capital...",Dietética
Fondo De Comercio Ferreteria Permuto Escucho Ofertas,US$,35000,Punta ...,Ferretería
Fondo De Comercio Repuestos Automotor,US$,89000,"San Fernando, Pr...",Otros
Venta Dietetica Fondo De Comercio Palermo Soho!!,US$,79000,"Buenos Aires, Argent...",Dietética
Vendo Delivery De Bebidas (la Previa) En Ciudad De Rosario. Escucho Oferta Razonable,US$,38000,"Zeballos 1348, Rosario, Provi...",Bebidas
Vendo Barberia El Fondo De Comercio Se Escuchan Ofertas,US$,20000,"San Miguel, Bs.as. G....",Barbería
"Fondo De Comercio Fiambreria - San Bernardo, Costa Atlantica",US$,30000,"San Bernardo, Bs.as....",Fiambrería
Venta Fondo De Comercio Dueño Directo,$,111111,"Adrogué, Almirante Bro...",Otros
Parada De Diarios Y Revistas,US$,1500,"Balvanera, Capit...",Otros
Vendo Fondo Comercio Informática Y Tecnología,US$,38000,"Jesús María, Córdoba",Otros
Fondo De Comercio En Venta Rubro Panadería,US$,60,"Río Cuarto, Cór...",Panadería
Fondo De Comercio Fiambrería Sandwicheria Apto Bar,US$,10000,"San Nicolás,...",Fiambrería
Vendo Local Manuela Pedraza Y Conesa Oportunidad!!,US$,55000,Ciudad Autónoma De Bu...,Otros
Fondo De Comercio De Panaderia,US$,70000,"Tandil, Buenos Aire...",Panadería
Fondo De Comercio Kiosco A Dos Cuadras Del Centro De Quilmes,US$,30000,"Quilmes, Bs.as....",Kiosco
Vendo Fondo De Comercio De Almacen Gourmet Excelente Ubicación,US$,24000,La Luci...,Otros
Fondo De Comercio Maq. Textiles Circulares Tejido De Punto,$,650,"Villa Luro, Capital F...",Otros
Vendo Fondo De Comercio Los Hornos,US$,5000,"Los Hornos, La Plata, Bs...",Otros
Vendemos Fondo De Comercio !!,US$,25000,"Centro, Rosario, S...",Otros
Venta De Agencia De Lotería Y Pagofacil Muy Buena Recaudación Y Ubicacion Del Comercio,US$,1,"Flores, Capit...",Lotería
Fondo De Comercio  - Farmacia Y Perfumería,US$,16000,"El Ceibo, Vill...",Farmacia
Fondo De Comercio Con Canchas De Futbol,US$,12000,"Quilmes Oeste,...",Cancha de futbol
Vendo Fondo De Comercio En Villa Gesell - Centro (peatonal),US$,10000,"Zona Centro, Villa ...",Otros
Fondo De Comercio Ferreteria Sanitarios Y Electricidad,US$,25000,Ciudad Autónoma De...,Ferretería
Vendo  Fondo De Comercio De Carnicería,US$,19900,"Sarandí, Avellaneda, B...",Carnicería
Heladería Fondo De Comercio,US$,1,"Colegiales, Cap...",Heladería
Agencia De Lotería De La Provincia Con Anexo Provincianet,US$,32000,"Villa Martelli, Vicent...",Lotería
Agencia De Loteria Lomas De Zamora Parque Baron,US$,10000,Lomas De Za...,Lotería
Fondo De Comercio (venta De Pizza Y Empanadas),US$,18000,William C...,Pizzería
Vendo Licencia/chapa De Loteria De La Provincia,US$,7000,"Temperley, Provincia...",Lotería
Vendo Fondo De Comercio De Maxikiosco,US$,3900,"Quilmes, Bs.as. G.b.a....",Kiosco
Venta Fondo De Comercio Fábrica De Sillones,US$,60000,"Alta Córdoba,...",Fábrica
Venta De Fondo De Comercio (escucho Ofertas)el Número Public,US$,12000,"Belén De Escobar, Esco...",Otros
Vendo Fondo De Comercio. Solo Mercaderia.,US$,10000,"Maquinista Savio, ...",Otros
"Fabrica De Pinturas C/máquinas,fórmulas, Clientes ¡completa Y Funcionando)",$,1000,Provincia De Buenos Ai...,Fábrica
"Fondo De Comercio. Kiosco, Wilde, Las Flores Y El Acceso.",US$,6000,"Wilde, Avellaned...",Kiosco
Fondo De Comercio,$,2000000,"Ciudadela, Tres D...",Otros
Fondo De Comercio Merlo Sl,US$,140000,"Merlo, Junín, ...",Otros
Panaderia Sandwicheria Centrica,US$,15000,"Retiro, Capital Feder...",Panadería
Fondo De Comercio,US$,7000,"Sarandí,...",Otros
Fondo De Comercio,US$,25000,Caballit...,Otros
